{
  "asJSONList": [
    {
      "MENSA": "Mensa Haste",
      "DATUM": "25.01.2022",
      "VK-ArtikelNr": "2097",
      "VK-GebindeNR": "3666",
      "SPEISE": "Dessert 2",
      "SPEISE_BEZEICHNUNG": "Dessert",
      "REZEPTUR_ID": "461",
      "TEXT1": "Quark (20,g)",
      "TEXT2": "Erdbeersauce",
      "TEXT3": "",
      "TEXT4": "",
      "TEXT5": "",
      "TEXT6": "",
      "TEXT1_1": "Quark dessert (20,g)",
      "TEXT2_1": "Strawberry sauce",
      "TEXT3_1": "",
      "TEXT4_1": "",
      "TEXT5_1": "",
      "TEXT6_1": "",
      "STD_PREIS": "0,50",
      "BED_PREIS": "1,00",
      "GÄSTE_PREIS": "1,20",
      "FREI1": "c",
      "FREI2": "",
      "FREI3": "",
      "ZSNUMMERN": "20, g, 0",
      "ZSNAMEN": "vegetarisch, Milch und Laktose (g), zusatzstoff- und allergenfrei",
      "NAEHRWERTEJE100G": "-",
      "NAEHRWERTEJEPORT": "Brennwert=612 kJ (146 kcal), Fett=1,1g, davon gesättigte Fettsäuren=0,6g, Kohlenhydrate=19,8g, davon Zucker=18,8g, Ballaststoffe=0,0g, Eiweiß=12,8g, Salz=0,1g,"
    },
    {
      "MENSA": "Mensa Haste",
      "DATUM": "25.01.2022",
      "VK-ArtikelNr": "2097",
      "VK-GebindeNR": "3666",
      "SPEISE": "Dessert 2",
      "SPEISE_BEZEICHNUNG": "Dessert",
      "REZEPTUR_ID": "253",
      "TEXT1": "Quark (20,g)",
      "TEXT2": "Erdbeersauce",
      "TEXT3": "",
      "TEXT4": "",
      "TEXT5": "",
      "TEXT6": "",
      "TEXT1_1": "Quark dessert (20,g)",
      "TEXT2_1": "Strawberry sauce",
      "TEXT3_1": "",
      "TEXT4_1": "",
      "TEXT5_1": "",
      "TEXT6_1": "",
      "STD_PREIS": "0,50",
      "BED_PREIS": "1,00",
      "GÄSTE_PREIS": "1,20",
      "FREI1": "c",
      "FREI2": "",
      "FREI3": "",
      "ZSNUMMERN": "20, g, 0",
      "ZSNAMEN": "vegetarisch, Milch und Laktose (g), zusatzstoff- und allergenfrei",
      "NAEHRWERTEJE100G": "-",
      "NAEHRWERTEJEPORT": "Brennwert=612 kJ (146 kcal), Fett=1,1g, davon gesättigte Fettsäuren=0,6g, Kohlenhydrate=19,8g, davon Zucker=18,8g, Ballaststoffe=0,0g, Eiweiß=12,8g, Salz=0,1g,"
    },
    {
      "MENSA": "Mensa Haste",
      "DATUM": "25.01.2022",
      "VK-ArtikelNr": "2130",
      "VK-GebindeNR": "4389",
      "SPEISE": "KM 2 Fleisch/Fisc,+1,55 €",
      "SPEISE_BEZEICHNUNG": "Hauptgericht",
      "REZEPTUR_ID": "3143",
      "TEXT1": "Avocado Pulled Chicken Burger mit Chili-Mayo und BBQ-Sauce (2,9,a,c,j,m,40)",
      "TEXT2": "",
      "TEXT3": "",
      "TEXT4": "",
      "TEXT5": "",
      "TEXT6": "",
      "TEXT1_1": "Avocado Pulled Chicken Burger with chili mayonnaise an BBQ sauce (2,9,a,c,j,m,40)",
      "TEXT2_1": "",
      "TEXT3_1": "",
      "TEXT4_1": "",
      "TEXT5_1": "",
      "TEXT6_1": "",
      "STD_PREIS": "3,60",
      "BED_PREIS": "5,15",
      "GÄSTE_PREIS": "5,95",
      "FREI1": "c",
      "FREI2": "2",
      "FREI3": "",
      "ZSNUMMERN": "2, 9, a, c, j, m, 40, 0",
      "ZSNAMEN": "mit Konservierungsstoff, mit Süßungsmitteln, Glutenhaltiges Getreide (a), Hühnerei (c), Senf (j), Sesam (m), Geflügel, zusatzstoff- und allergenfrei",
      "NAEHRWERTEJE100G": "-",
      "NAEHRWERTEJEPORT": "Brennwert=2556 kJ (611 kcal), Fett=35,1g, davon gesättigte Fettsäuren=5,1g, Kohlenhydrate=37,8g, davon Zucker=12,8g, Ballaststoffe=5,4g, Eiweiß=33,4g, Salz=4,2g,"
    }
  ],
  "content": "MENSA\tDATUM\tVK-ArtikelNr\tVK-GebindeNR\tSPEISE\tSPEISE_BEZEICHNUNG\tREZEPTUR_ID\tTEXT1\tTEXT2\tTEXT3\tTEXT4\tTEXT5\tTEXT6\tTEXT1_1\tTEXT2_1\tTEXT3_1\tTEXT4_1\tTEXT5_1\tTEXT6_1\tSTD_PREIS\tBED_PREIS\tGÄSTE_PREIS\tFREI1\tFREI2\tFREI3\tZSNUMMERN\tZSNAMEN\tNAEHRWERTEJE100G\tNAEHRWERTEJEPORT\nMensa Haste\t21.01.2022\t2130\t4389\tKM 2 Fleisch/Fisc,+1,55 €\tHauptgericht\t521\tAlaska-Seelachsfilet mit Pfefferkruste (24,d,a,g,i,43)\tSauce Hollandaise (20,c,g,i)\tBio-Schnittlauchkartoffeln (19,21)\t\t\t\tPepper-crusted Alaska pollock fillet (24,d,a,g,i,43)\tHollandaise sauce (20,c,g,i)\tOrganic chive potatoes (19,21)\t\t\t\t2,60\t4,15\t4,95\tc\t2\t\t19, 20, 21, 24, d, a, c, g, i, 43, 0\tBio-Erzeugnis DE-ÖKO-039, vegetarisch, vegan, Fisch aus nachhaltiger Fischerei, Fisch (d), Glutenhaltiges Getreide (a), Hühnerei (c), Milch und Laktose (g), Sellerie (i), Fisch, zusatzstoff- und allergenfrei\t-\tBrennwert=849 kJ (203 kcal), Fett=9,9g, davon gesättigte Fettsäuren=3,3g, Kohlenhydrate=12,3g, davon Zucker=1,3g, Ballaststoffe=0,4g, Eiweiß=15,2g, Salz=1,8g,\nMensa Haste\t21.01.2022\t2130\t4388\tKM 1 veget./vegan,+1,35 €\tHauptgericht\t2914\tGemüse-Chilli mit Kokos und Linsen (3,17,21)\t\t\t\t\t\tVegetable chili with coconut and lentils (3,17,21)\t\t\t\t\t\t1,80\t3,15\t3,95\tg\t2\t\t17, 21, 0\tKnoblauch, vegan, zusatzstoff- und allergenfrei\t-\tBrennwert=2446 kJ (584 kcal), Fett=23,0g, davon gesättigte Fettsäuren=11,2g, Kohlenhydrate=53,9g, davon Zucker=14,9g, Ballaststoffe=20,7g, Eiweiß=25,2g, Salz=2,4g,\nMensa Haste\t21.01.2022\t1701\t3648\tStärkebeilage 3\tBeilagen\t525\tPommes frites klein (21)\t\t\t\t\t\tPommes frites small (21)\t\t\t\t\t\t0,55\t1,05\t1,25\tc\t2\t\t21, 0\tvegan, zusatzstoff- und allergenfrei\t-\tBrennwert=79 kJ (19 kcal), Fett=0,9g, davon gesättigte Fettsäuren=0,3g, Kohlenhydrate=2,3g, davon Zucker=0,1g, Ballaststoffe=0,2g, Eiweiß=0,3g, Salz=0,1g,\nMensa Haste\t21.01.2022\t2130\t10518\tKM 5 veget./vegan,+1,35 €\tHauptgericht\t3183\tPommes frites groß (21)\t\t\t\t\t\tPommes frites large (21)\t\t\t\t\t\t1,00\t2,35\t3,15\tc\t2\t\t21, 0\tvegan, zusatzstoff- und allergenfrei\t-\tBrennwert=44 kJ (10 kcal), Fett=0,5g, davon gesättigte Fettsäuren=0,2g, Kohlenhydrate=1,3g, davon Zucker=0,0g, Ballaststoffe=0,1g, Eiweiß=0,2g, Salz=0,0g,\nMensa Haste\t21.01.2022\t1714\t3614\tEintopf (Terrine, Teller)\tEintopf Terrine\t2045\tChinesischer Bratnudeleintopf mit Wokgemüse und Tofu (2,16,21,a,m,f)\tWeizenbrötchen (1,21,a,f)\t\t\t\t\tChinese fried noodle stew with wok vegetables and tofu (2,16,21,a,m,f)\tBread roll (1,21,a,f)\t\t\t\t\t1,80\t3,40\t4,20\tg\t2\t\t1, 2, 16, 21, a, m, f, 0\tmit Farbstoff, mit Konservierungsstoff, KlimaTeller, vegan, Glutenhaltiges Getreide (a), Sesam (m), Soja (f), zusatzstoff- und allergenfrei\t-\tBrennwert=2558 kJ (611 kcal), Fett=17,9g, davon gesättigte Fettsäuren=2,5g, Kohlenhydrate=83,6g, davon Zucker=20,1g, Ballaststoffe=6,3g, Eiweiß=23,3g, Salz=8,9g,\nMensa Haste\t21.01.2022\t2130\t4389\tKM 2 Fleisch/Fisc,+1,55 €\tHauptgericht\t1057\tAlaska-Seelachsfilet mit Pfefferkruste (24,d,a,g,i,43)\tSauce Hollandaise (20,c,g,i)\tBio-Schnittlauchkartoffeln (19,21)\t\t\t\tPepper-crusted Alaska pollock fillet (24,d,a,g,i,43)\tHollandaise sauce (20,c,g,i)\tOrganic chive potatoes (19,21)\t\t\t\t2,60\t4,15\t4,95\tc\t2\t\t19, 20, 21, 24, d, a, c, g, i, 43, 0\tBio-Erzeugnis DE-ÖKO-039, vegetarisch, vegan, Fisch aus nachhaltiger Fischerei, Fisch (d), Glutenhaltiges Getreide (a), Hühnerei (c), Milch und Laktose (g), Sellerie (i), Fisch, zusatzstoff- und allergenfrei\t-\tBrennwert=849 kJ (203 kcal), Fett=9,9g, davon gesättigte Fettsäuren=3,3g, Kohlenhydrate=12,3g, davon Zucker=1,3g, Ballaststoffe=0,4g, Eiweiß=15,2g, Salz=1,8g,\nMensa Haste\t21.01.2022\t2130\t4389\tKM 2 Fleisch/Fisc,+1,55 €\tHauptgericht\t2662\tAlaska-Seelachsfilet mit Pfefferkruste (24,d,a,g,i,43)\tSauce Hollandaise (20,c,g,i)\tBio-Schnittlauchkartoffeln (19,21)\t\t\t\tPepper-crusted Alaska pollock fillet (24,d,a,g,i,43)\tHollandaise sauce (20,c,g,i)\tOrganic chive potatoes (19,21)\t\t\t\t2,60\t4,15\t4,95\tc\t2\t\t19, 20, 21, 24, d, a, c, g, i, 43, 0\tBio-Erzeugnis DE-ÖKO-039, vegetarisch, vegan, Fisch aus nachhaltiger Fischerei, Fisch (d), Glutenhaltiges Getreide (a), Hühnerei (c), Milch und Laktose (g), Sellerie (i), Fisch, zusatzstoff- und allergenfrei\t-\tBrennwert=849 kJ (203 kcal), Fett=9,9g, davon gesättigte Fettsäuren=3,3g, Kohlenhydrate=12,3g, davon Zucker=1,3g, Ballaststoffe=0,4g, Eiweiß=15,2g, Salz=1,8g,\nMensa Haste\t21.01.2022\t1714\t3614\tEintopf (Terrine, Teller)\tEintopf Terrine\t1350\tChinesischer Bratnudeleintopf mit Wokgemüse und Tofu (2,16,21,a,m,f)\tWeizenbrötchen (1,21,a,f)\t\t\t\t\tChinese fried noodle stew with wok vegetables and tofu (2,16,21,a,m,f)\tBread roll (1,21,a,f)\t\t\t\t\t1,80\t3,40\t4,20\tg\t2\t\t1, 2, 16, 21, a, m, f, 0\tmit Farbstoff, mit Konservierungsstoff, KlimaTeller, vegan, Glutenhaltiges Getreide (a), Sesam (m), Soja (f), zusatzstoff- und allergenfrei\t-\tBrennwert=2558 kJ (611 kcal), Fett=17,9g, davon gesättigte Fettsäuren=2,5g, Kohlenhydrate=83,6g, davon Zucker=20,1g, Ballaststoffe=6,3g, Eiweiß=23,3g, Salz=8,9g,\nMensa Lingen\t21.01.2022\t2130\t4389\tKM 2 Fleisch/Fisc,+1,55 €\tHauptgericht\t521\tAlaska-Seelachsfilet mit Pfefferkruste (24,d,a,g,i,43)\tSauce Hollandaise (20,c,g,i)\tBio-Schnittlauchkartoffeln (19,21)\t\t\t\tPepper-crusted Alaska pollock fillet (24,d,a,g,i,43)\tHollandaise sauce (20,c,g,i)\tOrganic chive potatoes (19,21)\t\t\t\t2,60\t4,15\t4,95\tc\t2\t\t19, 20, 21, 24, d, a, c, g, i, 43, 0\tBio-Erzeugnis DE-ÖKO-039, vegetarisch, vegan, Fisch aus nachhaltiger Fischerei, Fisch (d), Glutenhaltiges Getreide (a), Hühnerei (c), Milch und Laktose (g), Sellerie (i), Fisch, zusatzstoff- und allergenfrei\t-\tBrennwert=2288 kJ (547 kcal), Fett=26,6g, davon gesättigte Fettsäuren=8,8g, Kohlenhydrate=32,9g, davon Zucker=3,4g, Ballaststoffe=0,9g, Eiweiß=40,9g, Salz=4,9g,\nMensa Lingen\t21.01.2022\t2130\t4389\tKM 2 Fleisch/Fisc,+1,55 €\tHauptgericht\t1057\tAlaska-Seelachsfilet mit Pfefferkruste (24,d,a,g,i,43)\tSauce Hollandaise (20,c,g,i)\tBio-Schnittlauchkartoffeln (19,21)\t\t\t\tPepper-crusted Alaska pollock fillet (24,d,a,g,i,43)\tHollandaise sauce (20,c,g,i)\tOrganic chive potatoes (19,21)\t\t\t\t2,60\t4,15\t4,95\tc\t2\t\t19, 20, 21, 24, d, a, c, g, i, 43, 0\tBio-Erzeugnis DE-ÖKO-039, vegetarisch, vegan, Fisch aus nachhaltiger Fischerei, Fisch (d), Glutenhaltiges Getreide (a), Hühnerei (c), Milch und Laktose (g), Sellerie (i), Fisch, zusatzstoff- und allergenfrei\t-\tBrennwert=2288 kJ (547 kcal), Fett=26,6g, davon gesättigte Fettsäuren=8,8g, Kohlenhydrate=32,9g, davon Zucker=3,4g, Ballaststoffe=0,9g, Eiweiß=40,9g, Salz=4,9g,\nMensa Lingen\t21.01.2022\t2130\t4389\tKM 2 Fleisch/Fisc,+1,55 €\tHauptgericht\t2662\tAlaska-Seelachsfilet mit Pfefferkruste (24,d,a,g,i,43)\tSauce Hollandaise (20,c,g,i)\tBio-Schnittlauchkartoffeln (19,21)\t\t\t\tPepper-crusted Alaska pollock fillet (24,d,a,g,i,43)\tHollandaise sauce (20,c,g,i)\tOrganic chive potatoes (19,21)\t\t\t\t2,60\t4,15\t4,95\tc\t2\t\t19, 20, 21, 24, d, a, c, g, i, 43, 0\tBio-Erzeugnis DE-ÖKO-039, vegetarisch, vegan, Fisch aus nachhaltiger Fischerei, Fisch (d), Glutenhaltiges Getreide (a), Hühnerei (c), Milch und Laktose (g), Sellerie (i), Fisch, zusatzstoff- und allergenfrei\t-\tBrennwert=2288 kJ (547 kcal), Fett=26,6g, davon gesättigte Fettsäuren=8,8g, Kohlenhydrate=32,9g, davon Zucker=3,4g, Ballaststoffe=0,9g, Eiweiß=40,9g, Salz=4,9g,\nMensa Lingen\t21.01.2022\t2130\t4388\tKM 1 veget./vegan,+1,35 €\tHauptgericht\t2914\tGemüse-Chilli mit Kokos und Linsen (3,17,21)\t\t\t\t\t\tVegetable chili with coconut and lentils (3,17,21)\t\t\t\t\t\t1,80\t3,15\t3,95\tg\t2\t\t17, 21, 0\tKnoblauch, vegan, zusatzstoff- und allergenfrei\t-\tBrennwert=2446 kJ (584 kcal), Fett=23,0g, davon gesättigte Fettsäuren=11,2g, Kohlenhydrate=53,9g, davon Zucker=14,9g, Ballaststoffe=20,7g, Eiweiß=25,2g, Salz=2,4g,\nMensa Lingen\t21.01.2022\t2130\t10518\tKM 5 veget./vegan,+1,35 €\tHauptgericht\t3183\tPommes frites groß (21)\t\t\t\t\t\tPommes frites large (21)\t\t\t\t\t\t1,00\t2,35\t3,15\tc\t2\t\t21, 0\tvegan, zusatzstoff- und allergenfrei\t-\tBrennwert=2194 kJ (524 kcal), Fett=24,2g, davon gesättigte Fettsäuren=8,8g, Kohlenhydrate=66,0g, davon Zucker=1,5g, Ballaststoffe=6,0g, Eiweiß=7,5g, Salz=1,6g,\nMensa Lingen\t21.01.2022\t1701\t3648\tStärkebeilage 3\tBeilagen\t525\tPommes frites klein (21)\t\t\t\t\t\tPommes frites small (21)\t\t\t\t\t\t0,55\t1,05\t1,25\tc\t2\t\t21, 0\tvegan, zusatzstoff- und allergenfrei\t-\tBrennwert=1097 kJ (262 kcal), Fett=12,1g, davon gesättigte Fettsäuren=4,4g, Kohlenhydrate=33,0g, davon Zucker=0,8g, Ballaststoffe=3,0g, Eiweiß=3,8g, Salz=1,0g,\nMensa Schlossgarten\t21.01.2022\t2130\t4389\tKM 2 Fleisch/Fisc,+1,55 €\tHauptgericht\t1057\t\t\t\t\t\t\t\t\t\t\t\t\t2,60\t4,15\t4,95\tc\t\t\t19, 20, 21, 24, d, a, c, g, i, 43, 0\tBio-Erzeugnis DE-ÖKO-039, vegetarisch, vegan, Fisch aus nachhaltiger Fischerei, Fisch (d), Glutenhaltiges Getreide (a), Hühnerei (c), Milch und Laktose (g), Sellerie (i), Fisch, zusatzstoff- und allergenfrei\t-\tBrennwert=2290 kJ (547 kcal), Fett=26,6g, davon gesättigte Fettsäuren=8,8g, Kohlenhydrate=33,0g, davon Zucker=3,4g, Ballaststoffe=1,0g, Eiweiß=40,9g, Salz=4,9g,\nMensa Schlossgarten\t21.01.2022\t2130\t4389\tKM 2 Fleisch/Fisc,+1,55 €\tHauptgericht\t2662\t\t\t\t\t\t\t\t\t\t\t\t\t2,60\t4,15\t4,95\tc\t\t\t19, 20, 21, 24, d, a, c, g, i, 43, 0\tBio-Erzeugnis DE-ÖKO-039, vegetarisch, vegan, Fisch aus nachhaltiger Fischerei, Fisch (d), Glutenhaltiges Getreide (a), Hühnerei (c), Milch und Laktose (g), Sellerie (i), Fisch, zusatzstoff- und allergenfrei\t-\tBrennwert=2290 kJ (547 kcal), Fett=26,6g, davon gesättigte Fettsäuren=8,8g, Kohlenhydrate=33,0g, davon Zucker=3,4g, Ballaststoffe=1,0g, Eiweiß=40,9g, Salz=4,9g,\nMensa Schlossgarten\t21.01.2022\t2130\t4389\tKM 2 Fleisch/Fisc,+1,55 €\tHauptgericht\t521\t\t\t\t\t\t\t\t\t\t\t\t\t2,60\t4,15\t4,95\tc\t\t\t19, 20, 21, 24, d, a, c, g, i, 43, 0\tBio-Erzeugnis DE-ÖKO-039, vegetarisch, vegan, Fisch aus nachhaltiger Fischerei, Fisch (d), Glutenhaltiges Getreide (a), Hühnerei (c), Milch und Laktose (g), Sellerie (i), Fisch, zusatzstoff- und allergenfrei\t-\tBrennwert=2290 kJ (547 kcal), Fett=26,6g, davon gesättigte Fettsäuren=8,8g, Kohlenhydrate=33,0g, davon Zucker=3,4g, Ballaststoffe=1,0g, Eiweiß=40,9g, Salz=4,9g,\nMensa Schlossgarten\t21.01.2022\t2130\t10518\tKM 5 veget./vegan,+1,35 €\tHauptgericht\t3183\tPommes frites groß (21)\t\t\t\t\t\tPommes frites large (21)\t\t\t\t\t\t1,00\t2,35\t3,15\tc\t\t\t21, 0\tvegan, zusatzstoff- und allergenfrei\t-\tBrennwert=2194 kJ (524 kcal), Fett=24,2g, davon gesättigte Fettsäuren=8,8g, Kohlenhydrate=66,0g, davon Zucker=1,5g, Ballaststoffe=6,0g, Eiweiß=7,5g, Salz=1,6g,\nMensa Schlossgarten\t21.01.2022\t1714\t3614\tEintopf (Terrine, Teller)\tEintopf Terrine\t2045\tChinesischer Bratnudeleintopf mit Wokgemüse und Tofu (2,16,21,a,m,f)\tWeizenbrötchen (1,21,a,f)\t\t\t\t\tChinese fried noodle stew with wok vegetables and tofu (2,16,21,a,m,f)\tBread roll (1,21,a,f)\t\t\t\t\t1,80\t3,40\t4,20\tg\t\t\t1, 2, 16, 21, a, m, f, 0\tmit Farbstoff, mit Konservierungsstoff, KlimaTeller, vegan, Glutenhaltiges Getreide (a), Sesam (m), Soja (f), zusatzstoff- und allergenfrei\t-\tBrennwert=2397 kJ (572 kcal), Fett=16,6g, davon gesättigte Fettsäuren=2,3g, Kohlenhydrate=78,7g, davon Zucker=18,9g, Ballaststoffe=6,0g, Eiweiß=21,9g, Salz=8,4g,\nMensa Schlossgarten\t21.01.2022\t1714\t3614\tEintopf (Terrine, Teller)\tEintopf Terrine\t1350\tChinesischer Bratnudeleintopf mit Wokgemüse und Tofu (2,16,21,a,m,f)\tWeizenbrötchen (1,21,a,f)\t\t\t\t\tChinese fried noodle stew with wok vegetables and tofu (2,16,21,a,m,f)\tBread roll (1,21,a,f)\t\t\t\t\t1,80\t3,40\t4,20\tg\t\t\t1, 2, 16, 21, a, m, f, 0\tmit Farbstoff, mit Konservierungsstoff, KlimaTeller, vegan, Glutenhaltiges Getreide (a), Sesam (m), Soja (f), zusatzstoff- und allergenfrei\t-\tBrennwert=2397 kJ (572 kcal), Fett=16,6g, davon gesättigte Fettsäuren=2,3g, Kohlenhydrate=78,7g, davon Zucker=18,9g, Ballaststoffe=6,0g, Eiweiß=21,9g, Salz=8,4g,\nMensa Schlossgarten\t21.01.2022\t2097\t3666\tDessert 2\tDessert\t1998\tGebackene Banane mit Ahornsirup (21,a)\t\t\t\t\t\tBaked banana with maple syrup (21,a)\t\t\t\t\t\t0,95\t1,45\t1,65\tg\t\t\t21, a, 0\tvegan, Glutenhaltiges Getreide (a), zusatzstoff- und allergenfrei\t-\tBrennwert=1197 kJ (286 kcal), Fett=11,2g, davon gesättigte Fettsäuren=1,0g, Kohlenhydrate=41,8g, davon Zucker=23,1g, Ballaststoffe=1,7g, Eiweiß=2,5g, Salz=0,1g,\nMensa Schlossgarten\t21.01.2022\t2097\t3665\tDessert 1\tDessert\t461\tQuark (20,g)\tAprikosensauce\t\t\t\t\tQuark dessert (20,g)\tApricot sauce\t\t\t\t\t0,50\t1,00\t1,20\tc\t\t\t20, g, 0\tvegetarisch, Milch und Laktose (g), zusatzstoff- und allergenfrei\t-\tBrennwert=595 kJ (142 kcal), Fett=1,0g, davon gesättigte Fettsäuren=0,6g, Kohlenhydrate=19,3g, davon Zucker=18,1g, Ballaststoffe=0,0g, Eiweiß=12,8g, Salz=0,1g,\nMensa Schlossgarten\t21.01.2022\t2097\t3665\tDessert 1\tDessert\t249\tQuark (20,g)\tAprikosensauce\t\t\t\t\tQuark dessert (20,g)\tApricot sauce\t\t\t\t\t0,50\t1,00\t1,20\tc\t\t\t20, g, 0\tvegetarisch, Milch und Laktose (g), zusatzstoff- und allergenfrei\t-\tBrennwert=595 kJ (142 kcal), Fett=1,0g, davon gesättigte Fettsäuren=0,6g, Kohlenhydrate=19,3g, davon Zucker=18,1g, Ballaststoffe=0,0g, Eiweiß=12,8g, Salz=0,1g,\nMensa Schlossgarten\t21.01.2022\t1701\t3648\tStärkebeilage 3\tBeilagen\t525\tPommes frites klein (21)\t\t\t\t\t\tPommes frites small (21)\t\t\t\t\t\t0,55\t1,05\t1,25\tc\t\t\t21, 0\tvegan, zusatzstoff- und allergenfrei\t-\tBrennwert=1097 kJ (262 kcal), Fett=12,1g, davon gesättigte Fettsäuren=4,4g, Kohlenhydrate=33,0g, davon Zucker=0,8g, Ballaststoffe=3,0g, Eiweiß=3,8g, Salz=1,0g,\nMensa Schlossgarten\t21.01.2022\t1701\t3646\tGemüsebeilage 3/Tagessala\tTagessalat\t477\tMensa-Salatmix (3,21,k,j)\t\t\t\t\t\tMixed salad (3,21,k,j)\t\t\t\t\t\t0,50\t1,00\t1,20\ta\t\t\t3, 21, k, j, 0\tmit Antioxidationsmittel, vegan, Schwefeldioxid u. Sulfite (k), Senf (j), zusatzstoff- und allergenfrei\t-\tBrennwert=624 kJ (149 kcal), Fett=9,5g, davon gesättigte Fettsäuren=0,8g, Kohlenhydrate=8,9g, davon Zucker=6,7g, Ballaststoffe=4,8g, Eiweiß=2,7g, Salz=0,2g,\nMensa Schlossgarten\t21.01.2022\t2097\t3697\tDessert 3\tDessert\t1656\tBio-Apfelmark (19,21,23)\t\t\t\t\t\tOrganic apple pulp (19,21,23)\t\t\t\t\t\t0,70\t1,20\t1,40\tg\t\t\t19, 21, 23, 0\tBio-Erzeugnis DE-ÖKO-039, vegan, Bio-Menü, zusatzstoff- und allergenfrei\t-\tBrennwert=333 kJ (80 kcal), Fett=0,2g, davon gesättigte Fettsäuren=0,2g, Kohlenhydrate=18,6g, davon Zucker=16,8g, Ballaststoffe=0,0g, Eiweiß=0,5g, Salz=0,2g,\nMensa Schlossgarten\t21.01.2022\t2130\t4388\tKM 1 veget./vegan,+1,35 €\tHauptgericht\t2914\tGemüse-Chilli mit Kokos und Linsen (3,17,21)\t\t\t\t\t\tVegetable chili with coconut and lentils (3,17,21)\t\t\t\t\t\t1,80\t3,15\t3,95\tg\t\t\t17, 21, 0\tKnoblauch, vegan, zusatzstoff- und allergenfrei\t-\tBrennwert=2450 kJ (585 kcal), Fett=23,0g, davon gesättigte Fettsäuren=11,2g, Kohlenhydrate=54,0g, davon Zucker=14,9g, Ballaststoffe=20,7g, Eiweiß=25,3g, Salz=2,4g,\nMensa Schlossgarten\t21.01.2022\t2130\t10190\tKM 4 Fleisch/Fisc,+1,55 €\tHauptgericht\t1624\tFish & Chips mit dänischer Remoulade (2,3,8,9,24,d,a,c,g,k,i,j,43)\t\t\t\t\t\tFish & chips with Danish remoulade sauce (2,3,8,9,24,d,a,c,g,k,i,j,43)\t\t\t\t\t\t2,65\t4,20\t5,00\tc\t\t\t2, 3, 8, 9, 24, d, a, c, g, k, i, j, 43, 0\tmit Konservierungsstoff, mit Antioxidationsmittel, mit Phosphat, mit Süßungsmitteln, Fisch aus nachhaltiger Fischerei, Fisch (d), Glutenhaltiges Getreide (a), Hühnerei (c), Milch und Laktose (g), Schwefeldioxid u. Sulfite (k), Sellerie (i), Senf (j), Fisch, zusatzstoff- und allergenfrei\t-\tBrennwert=4115 kJ (983 kcal), Fett=69,4g, davon gesättigte Fettsäuren=5,8g, Kohlenhydrate=60,0g, davon Zucker=5,6g, Ballaststoffe=4,2g, Eiweiß=28,0g, Salz=5,1g,\nMensa Vechta\t21.01.2022\t2130\t4389\tKM 2 Fleisch/Fisc,+1,55 €\tHauptgericht\t521\tAlaska-Seelachsfilet mit Pfefferkruste (24,d,a,g,c,i,43)\tTomatenschmelze (21)\tBio-Schnittlauchkartoffeln (19,21)\t\t\t\tPepper-crusted Alaska pollock fillet (24,d,a,g,c,i,43)\tTomato concassee (21)\tOrganic chive potatoes (19,21)\t\t\t\t2,60\t4,15\t4,95\tc\t2\t\t19, 21, 24, d, a, g, i, 43, 0\tBio-Erzeugnis DE-ÖKO-039, vegan, Fisch aus nachhaltiger Fischerei, Fisch (d), Glutenhaltiges Getreide (a), Milch und Laktose (g), Sellerie (i), Fisch, zusatzstoff- und allergenfrei\t-\tBrennwert=2437 kJ (582 kcal), Fett=27,7g, davon gesättigte Fettsäuren=8,0g, Kohlenhydrate=38,3g, davon Zucker=7,5g, Ballaststoffe=2,8g, Eiweiß=42,4g, Salz=5,1g,\nMensa Vechta\t21.01.2022\t2130\t4389\tKM 2 Fleisch/Fisc,+1,55 €\tHauptgericht\t1057\tAlaska-Seelachsfilet mit Pfefferkruste (24,d,a,g,c,i,43)\tTomatenschmelze (21)\tBio-Schnittlauchkartoffeln (19,21)\t\t\t\tPepper-crusted Alaska pollock fillet (24,d,a,g,c,i,43)\tTomato concassee (21)\tOrganic chive potatoes (19,21)\t\t\t\t2,60\t4,15\t4,95\tc\t2\t\t19, 21, 24, d, a, g, i, 43, 0\tBio-Erzeugnis DE-ÖKO-039, vegan, Fisch aus nachhaltiger Fischerei, Fisch (d), Glutenhaltiges Getreide (a), Milch und Laktose (g), Sellerie (i), Fisch, zusatzstoff- und allergenfrei\t-\tBrennwert=2437 kJ (582 kcal), Fett=27,7g, davon gesättigte Fettsäuren=8,0g, Kohlenhydrate=38,3g, davon Zucker=7,5g, Ballaststoffe=2,8g, Eiweiß=42,4g, Salz=5,1g,\nMensa Vechta\t21.01.2022\t2130\t10518\tKM 5 veget./vegan,+1,35 €\tHauptgericht\t3183\tPommes frites groß (21)\t\t\t\t\t\tPommes frites large (21)\t\t\t\t\t\t1,00\t2,35\t3,15\tc\t2\t\t21, 0\tvegan, zusatzstoff- und allergenfrei\t-\tBrennwert=2194 kJ (524 kcal), Fett=24,2g, davon gesättigte Fettsäuren=8,8g, Kohlenhydrate=66,0g, davon Zucker=1,5g, Ballaststoffe=6,0g, Eiweiß=7,5g, Salz=1,6g,\nMensa Vechta\t21.01.2022\t2130\t4388\tKM 1 veget./vegan,+1,35 €\tHauptgericht\t2914\tGemüse-Chilli mit Kokos und Linsen (3,17,21)\t\t\t\t\t\tVegetable chili with coconut and lentils (3,17,21)\t\t\t\t\t\t1,80\t3,15\t3,95\tg\t2\t\t17, 21, 0\tKnoblauch, vegan, zusatzstoff- und allergenfrei\t-\tBrennwert=2454 kJ (586 kcal), Fett=23,0g, davon gesättigte Fettsäuren=11,2g, Kohlenhydrate=54,1g, davon Zucker=14,9g, Ballaststoffe=20,8g, Eiweiß=25,3g, Salz=2,4g,\nMensa Vechta\t21.01.2022\t1714\t3614\tEintopf (Terrine, Teller)\tEintopf Terrine\t1350\tChinesischer Bratnudeleintopf mit Wokgemüse und Tofu (2,16,21,a,m,f)\tLaugenecke (3,20,a,c,g)\t\t\t\t\tChinese fried noodle stew with wok vegetables and tofu (2,16,21,a,m,f)\tPretzel roll (3,20,a,c,g)\t\t\t\t\t1,80\t3,40\t4,20\tc\t2\t\t2, 3, 16, 20, 21, a, c, g, m, f, 0\tmit Konservierungsstoff, mit Antioxidationsmittel, KlimaTeller, vegetarisch, vegan, Glutenhaltiges Getreide (a), Hühnerei (c), Milch und Laktose (g), Sesam (m), Soja (f), zusatzstoff- und allergenfrei\t-\tBrennwert=2958 kJ (707 kcal), Fett=31,8g, davon gesättigte Fettsäuren=12,4g, Kohlenhydrate=77,0g, davon Zucker=19,4g, Ballaststoffe=6,0g, Eiweiß=23,2g, Salz=8,0g,\nMensa Vechta\t21.01.2022\t1701\t3648\tStärkebeilage 3\tBeilagen\t525\tPommes frites klein (21)\t\t\t\t\t\tPommes frites small (21)\t\t\t\t\t\t0,55\t1,05\t1,25\tc\t2\t\t21, 0\tvegan, zusatzstoff- und allergenfrei\t-\tBrennwert=1097 kJ (262 kcal), Fett=12,1g, davon gesättigte Fettsäuren=4,4g, Kohlenhydrate=33,0g, davon Zucker=0,8g, Ballaststoffe=3,0g, Eiweiß=3,8g, Salz=1,0g,\nMensa Vechta\t21.01.2022\t2130\t4389\tKM 2 Fleisch/Fisc,+1,55 €\tHauptgericht\t1362\tAlaska-Seelachsfilet mit Pfefferkruste (24,d,a,g,c,i,43)\tTomatenschmelze (21)\tBio-Schnittlauchkartoffeln (19,21)\t\t\t\tPepper-crusted Alaska pollock fillet (24,d,a,g,c,i,43)\tTomato concassee (21)\tOrganic chive potatoes (19,21)\t\t\t\t2,60\t4,15\t4,95\tc\t2\t\t19, 21, 24, d, a, g, i, 43, 0\tBio-Erzeugnis DE-ÖKO-039, vegan, Fisch aus nachhaltiger Fischerei, Fisch (d), Glutenhaltiges Getreide (a), Milch und Laktose (g), Sellerie (i), Fisch, zusatzstoff- und allergenfrei\t-\tBrennwert=2437 kJ (582 kcal), Fett=27,7g, davon gesättigte Fettsäuren=8,0g, Kohlenhydrate=38,3g, davon Zucker=7,5g, Ballaststoffe=2,8g, Eiweiß=42,4g, Salz=5,1g,\nMensa Vechta\t21.01.2022\t1714\t3614\tEintopf (Terrine, Teller)\tEintopf Terrine\t2976\tChinesischer Bratnudeleintopf mit Wokgemüse und Tofu (2,16,21,a,m,f)\tLaugenecke (3,20,a,c,g)\t\t\t\t\tChinese fried noodle stew with wok vegetables and tofu (2,16,21,a,m,f)\tPretzel roll (3,20,a,c,g)\t\t\t\t\t1,80\t3,40\t4,20\tc\t2\t\t2, 3, 16, 20, 21, a, c, g, m, f, 0\tmit Konservierungsstoff, mit Antioxidationsmittel, KlimaTeller, vegetarisch, vegan, Glutenhaltiges Getreide (a), Hühnerei (c), Milch und Laktose (g), Sesam (m), Soja (f), zusatzstoff- und allergenfrei\t-\tBrennwert=2958 kJ (707 kcal), Fett=31,8g, davon gesättigte Fettsäuren=12,4g, Kohlenhydrate=77,0g, davon Zucker=19,4g, Ballaststoffe=6,0g, Eiweiß=23,2g, Salz=8,0g,\nMensa Westerberg\t21.01.2022\t2097\t3665\tDessert 1\tDessert\t461\tQuark (20,g)\tAprikosensauce\t\t\t\t\tQuark dessert (20,g)\tApricot sauce\t\t\t\t\t0,50\t1,00\t1,20\tc\t\t\t20, g, 0\tvegetarisch, Milch und Laktose (g), zusatzstoff- und allergenfrei\t-\tBrennwert=595 kJ (142 kcal), Fett=1,0g, davon gesättigte Fettsäuren=0,6g, Kohlenhydrate=19,3g, davon Zucker=18,1g, Ballaststoffe=0,0g, Eiweiß=12,8g, Salz=0,1g,\nMensa Westerberg\t21.01.2022\t2130\t4389\tKM 2 Fleisch/Fisc,+1,55 €\tHauptgericht\t1057\tAlaska-Seelachsfilet mit Pfefferkruste (24,d,a,g,i,43)\tSauce Hollandaise (20,c,g,i)\tBio-Schnittlauchkartoffeln (19,21)\t\t\t\tPepper-crusted Alaska pollock fillet (24,d,a,g,i,43)\tHollandaise sauce (20,c,g,i)\tOrganic chive potatoes (19,21)\t\t\t\t2,60\t4,15\t4,95\tc\t\t\t19, 20, 21, 24, d, a, c, g, i, 43, 0\tBio-Erzeugnis DE-ÖKO-039, vegetarisch, vegan, Fisch aus nachhaltiger Fischerei, Fisch (d), Glutenhaltiges Getreide (a), Hühnerei (c), Milch und Laktose (g), Sellerie (i), Fisch, zusatzstoff- und allergenfrei\t-\tBrennwert=2290 kJ (547 kcal), Fett=26,6g, davon gesättigte Fettsäuren=8,8g, Kohlenhydrate=33,0g, davon Zucker=3,4g, Ballaststoffe=1,0g, Eiweiß=40,9g, Salz=4,9g,\nMensa Westerberg\t21.01.2022\t2130\t4388\tKM 1 veget./vegan,+1,35 €\tHauptgericht\t2914\tGemüse-Chilli mit Kokos und Linsen (3,17,21)\t\t\t\t\t\tVegetable chili with coconut and lentils (3,17,21)\t\t\t\t\t\t1,80\t3,15\t3,95\tg\t\t\t17, 21, 0\tKnoblauch, vegan, zusatzstoff- und allergenfrei\t-\tBrennwert=2451 kJ (586 kcal), Fett=23,0g, davon gesättigte Fettsäuren=11,2g, Kohlenhydrate=54,1g, davon Zucker=14,9g, Ballaststoffe=20,8g, Eiweiß=25,3g, Salz=2,4g,\nMensa Westerberg\t21.01.2022\t2130\t4389\tKM 2 Fleisch/Fisc,+1,55 €\tHauptgericht\t521\tAlaska-Seelachsfilet mit Pfefferkruste (24,d,a,g,i,43)\tSauce Hollandaise (20,c,g,i)\tBio-Schnittlauchkartoffeln (19,21)\t\t\t\tPepper-crusted Alaska pollock fillet (24,d,a,g,i,43)\tHollandaise sauce (20,c,g,i)\tOrganic chive potatoes (19,21)\t\t\t\t2,60\t4,15\t4,95\tc\t\t\t19, 20, 21, 24, d, a, c, g, i, 43, 0\tBio-Erzeugnis DE-ÖKO-039, vegetarisch, vegan, Fisch aus nachhaltiger Fischerei, Fisch (d), Glutenhaltiges Getreide (a), Hühnerei (c), Milch und Laktose (g), Sellerie (i), Fisch, zusatzstoff- und allergenfrei\t-\tBrennwert=2290 kJ (547 kcal), Fett=26,6g, davon gesättigte Fettsäuren=8,8g, Kohlenhydrate=33,0g, davon Zucker=3,4g, Ballaststoffe=1,0g, Eiweiß=40,9g, Salz=4,9g,\nMensa Westerberg\t21.01.2022\t2130\t4389\tKM 2 Fleisch/Fisc,+1,55 €\tHauptgericht\t2662\tAlaska-Seelachsfilet mit Pfefferkruste (24,d,a,g,i,43)\tSauce Hollandaise (20,c,g,i)\tBio-Schnittlauchkartoffeln (19,21)\t\t\t\tPepper-crusted Alaska pollock fillet (24,d,a,g,i,43)\tHollandaise sauce (20,c,g,i)\tOrganic chive potatoes (19,21)\t\t\t\t2,60\t4,15\t4,95\tc\t\t\t19, 20, 21, 24, d, a, c, g, i, 43, 0\tBio-Erzeugnis DE-ÖKO-039, vegetarisch, vegan, Fisch aus nachhaltiger Fischerei, Fisch (d), Glutenhaltiges Getreide (a), Hühnerei (c), Milch und Laktose (g), Sellerie (i), Fisch, zusatzstoff- und allergenfrei\t-\tBrennwert=2290 kJ (547 kcal), Fett=26,6g, davon gesättigte Fettsäuren=8,8g, Kohlenhydrate=33,0g, davon Zucker=3,4g, Ballaststoffe=1,0g, Eiweiß=40,9g, Salz=4,9g,\nMensa Westerberg\t21.01.2022\t1714\t3614\tEintopf (Terrine, Teller)\tEintopf Terrine\t2045\tChinesischer Bratnudeleintopf mit Wokgemüse und Tofu (2,16,21,a,m,f)\tWeizenbrötchen (1,21,a,f)\t\t\t\t\tChinese fried noodle stew with wok vegetables and tofu (2,16,21,a,m,f)\tBread roll (1,21,a,f)\t\t\t\t\t1,80\t3,40\t4,20\tg\t\t\t1, 2, 16, 21, a, m, f, 0\tmit Farbstoff, mit Konservierungsstoff, KlimaTeller, vegan, Glutenhaltiges Getreide (a), Sesam (m), Soja (f), zusatzstoff- und allergenfrei\t-\tBrennwert=2397 kJ (572 kcal), Fett=16,6g, davon gesättigte Fettsäuren=2,3g, Kohlenhydrate=78,7g, davon Zucker=18,9g, Ballaststoffe=6,0g, Eiweiß=21,9g, Salz=8,4g,\nMensa Westerberg\t21.01.2022\t1701\t3646\tGemüsebeilage 3/Tagessala\tTagessalat\t477\tMensa-Salatmix (3,21,k,j)\t\t\t\t\t\tMixed salad (3,21,k,j)\t\t\t\t\t\t0,50\t1,00\t1,20\ta\t\t\t3, 21, k, j, 0\tmit Antioxidationsmittel, vegan, Schwefeldioxid u. Sulfite (k), Senf (j), zusatzstoff- und allergenfrei\t-\tBrennwert=624 kJ (149 kcal), Fett=9,5g, davon gesättigte Fettsäuren=0,8g, Kohlenhydrate=8,9g, davon Zucker=6,7g, Ballaststoffe=4,8g, Eiweiß=2,7g, Salz=0,2g,\nMensa Westerberg\t21.01.2022\t2097\t3665\tDessert 1\tDessert\t249\tQuark (20,g)\tAprikosensauce\t\t\t\t\tQuark dessert (20,g)\tApricot sauce\t\t\t\t\t0,50\t1,00\t1,20\tc\t\t\t20, g, 0\tvegetarisch, Milch und Laktose (g), zusatzstoff- und allergenfrei\t-\tBrennwert=595 kJ (142 kcal), Fett=1,0g, davon gesättigte Fettsäuren=0,6g, Kohlenhydrate=19,3g, davon Zucker=18,1g, Ballaststoffe=0,0g, Eiweiß=12,8g, Salz=0,1g,\nMensa Westerberg\t21.01.2022\t2130\t10518\tKM 5 veget./vegan,+1,35 €\tHauptgericht\t3183\tPommes frites groß (21)\t\t\t\t\t\tPommes frites large (21)\t\t\t\t\t\t1,00\t2,35\t3,15\tc\t\t\t21, 0\tvegan, zusatzstoff- und allergenfrei\t-\tBrennwert=2194 kJ (524 kcal), Fett=24,2g, davon gesättigte Fettsäuren=8,8g, Kohlenhydrate=66,0g, davon Zucker=1,5g, Ballaststoffe=6,0g, Eiweiß=7,5g, Salz=1,6g,\nMensa Westerberg\t21.01.2022\t1714\t3614\tEintopf (Terrine, Teller)\tEintopf Terrine\t1350\tChinesischer Bratnudeleintopf mit Wokgemüse und Tofu (2,16,21,a,m,f)\tWeizenbrötchen (1,21,a,f)\t\t\t\t\tChinese fried noodle stew with wok vegetables and tofu (2,16,21,a,m,f)\tBread roll (1,21,a,f)\t\t\t\t\t1,80\t3,40\t4,20\tg\t\t\t1, 2, 16, 21, a, m, f, 0\tmit Farbstoff, mit Konservierungsstoff, KlimaTeller, vegan, Glutenhaltiges Getreide (a), Sesam (m), Soja (f), zusatzstoff- und allergenfrei\t-\tBrennwert=2397 kJ (572 kcal), Fett=16,6g, davon gesättigte Fettsäuren=2,3g, Kohlenhydrate=78,7g, davon Zucker=18,9g, Ballaststoffe=6,0g, Eiweiß=21,9g, Salz=8,4g,\nMensa Westerberg\t21.01.2022\t1701\t3648\tStärkebeilage 3\tBeilagen\t525\tPommes frites klein (21)\t\t\t\t\t\tPommes frites small (21)\t\t\t\t\t\t0,55\t1,05\t1,25\tc\t\t\t21, 0\tvegan, zusatzstoff- und allergenfrei\t-\tBrennwert=1097 kJ (262 kcal), Fett=12,1g, davon gesättigte Fettsäuren=4,4g, Kohlenhydrate=33,0g, davon Zucker=0,8g, Ballaststoffe=3,0g, Eiweiß=3,8g, Salz=1,0g,\nMensa Schlossgarten\t22.01.2022\t2130\t10518\tKM 5 veget./vegan,+1,35 €\tHauptgericht\t3183\t\t\t\t\t\t\t\t\t\t\t\t\t1,00\t2,35\t3,15\tc\t\t\t21, 0\tvegan, zusatzstoff- und allergenfrei\t-\tBrennwert=2194 kJ (524 kcal), Fett=24,2g, davon gesättigte Fettsäuren=8,8g, Kohlenhydrate=66,0g, davon Zucker=1,5g, Ballaststoffe=6,0g, Eiweiß=7,5g, Salz=1,6g,\nMensa Schlossgarten\t22.01.2022\t2130\t4389\tKM 2 Fleisch/Fisc,+1,55 €\tHauptgericht\t2422\t\t\t\t\t\t\t\t\t\t\t\t\t3,20\t4,75\t5,55\tc\t\t\t1, 2, 3, 17, a, 40, 0\tmit Farbstoff, mit Konservierungsstoff, mit Antioxidationsmittel, Knoblauch, Glutenhaltiges Getreide (a), Geflügel, zusatzstoff- und allergenfrei\t-\tBrennwert=2139 kJ (511 kcal), Fett=18,9g, davon gesättigte Fettsäuren=2,1g, Kohlenhydrate=54,0g, davon Zucker=7,5g, Ballaststoffe=1,8g, Eiweiß=29,1g, Salz=2,3g,\nMensa Schlossgarten\t22.01.2022\t2130\t4388\tKM 1 veget./vegan,+1,35 €\tHauptgericht\t700\t\t\t\t\t\t\t\t\t\t\t\t\t1,80\t3,15\t3,95\tg\t\t\t21, a, 0\tvegan, Glutenhaltiges Getreide (a), zusatzstoff- und allergenfrei\t-\tBrennwert=1497 kJ (358 kcal), Fett=5,7g, davon gesättigte Fettsäuren=0,8g, Kohlenhydrate=63,0g, davon Zucker=5,7g, Ballaststoffe=2,8g, Eiweiß=11,0g, Salz=3,4g,\nMensa Schlossgarten\t22.01.2022\t2097\t3665\tDessert 1\tDessert\t302\t\t\t\t\t\t\t\t\t\t\t\t\t0,70\t1,20\t1,40\tc\t\t\t25, g\tmit Gelatine, Milch und Laktose (g)\t-\tBrennwert=958 kJ (229 kcal), Fett=14,2g, davon gesättigte Fettsäuren=9,9g, Kohlenhydrate=18,7g, davon Zucker=15,4g, Ballaststoffe=0,0g, Eiweiß=4,6g, Salz=0,2g,\nMensa Schlossgarten\t22.01.2022\t1701\t3646\tGemüsebeilage 3/Tagessala\tTagessalat\t1449\t\t\t\t\t\t\t\t\t\t\t\t\t0,50\t1,00\t1,20\ta\t\t\t20, g, 0\tvegetarisch, Milch und Laktose (g), zusatzstoff- und allergenfrei\t-\tBrennwert=206 kJ (49 kcal), Fett=1,1g, davon gesättigte Fettsäuren=0,7g, Kohlenhydrate=6,8g, davon Zucker=6,4g, Ballaststoffe=1,2g, Eiweiß=1,8g, Salz=0,8g,\nMensa Schlossgarten\t22.01.2022\t1701\t3648\tStärkebeilage 3\tBeilagen\t525\t\t\t\t\t\t\t\t\t\t\t\t\t0,55\t1,05\t1,25\tc\t\t\t21, 0\tvegan, zusatzstoff- und allergenfrei\t-\tBrennwert=1097 kJ (262 kcal), Fett=12,1g, davon gesättigte Fettsäuren=4,4g, Kohlenhydrate=33,0g, davon Zucker=0,8g, Ballaststoffe=3,0g, Eiweiß=3,8g, Salz=1,0g,\nMensa Schlossgarten\t22.01.2022\t1701\t3646\tGemüsebeilage 3/Tagessala\tTagessalat\t1673\t\t\t\t\t\t\t\t\t\t\t\t\t0,50\t1,00\t1,20\ta\t\t\t20, g, 0\tvegetarisch, Milch und Laktose (g), zusatzstoff- und allergenfrei\t-\tBrennwert=206 kJ (49 kcal), Fett=1,1g, davon gesättigte Fettsäuren=0,7g, Kohlenhydrate=6,8g, davon Zucker=6,4g, Ballaststoffe=1,2g, Eiweiß=1,8g, Salz=0,8g,\nMensa Haste\t24.01.2022\t2130\t10518\tKM 5 veget./vegan,+1,35 €\tHauptgericht\t3183\tPommes frites groß (21)\t\t\t\t\t\tPommes frites large (21)\t\t\t\t\t\t1,00\t2,35\t3,15\tc\t2\t\t21, 0\tvegan, zusatzstoff- und allergenfrei\t-\tBrennwert=2194 kJ (524 kcal), Fett=24,2g, davon gesättigte Fettsäuren=8,8g, Kohlenhydrate=66,0g, davon Zucker=1,5g, Ballaststoffe=6,0g, Eiweiß=7,5g, Salz=1,6g,\nMensa Haste\t24.01.2022\t2097\t3666\tDessert 2\tDessert\t461\tQuark (20,g)\tErdbeersauce\t\t\t\t\tQuark dessert (20,g)\tStrawberry sauce\t\t\t\t\t0,50\t1,00\t1,20\tc\t\t\t20, g, 0\tvegetarisch, Milch und Laktose (g), zusatzstoff- und allergenfrei\t-\tBrennwert=612 kJ (146 kcal), Fett=1,1g, davon gesättigte Fettsäuren=0,6g, Kohlenhydrate=19,8g, davon Zucker=18,8g, Ballaststoffe=0,0g, Eiweiß=12,8g, Salz=0,1g,\nMensa Haste\t24.01.2022\t2097\t3666\tDessert 2\tDessert\t253\tQuark (20,g)\tErdbeersauce\t\t\t\t\tQuark dessert (20,g)\tStrawberry sauce\t\t\t\t\t0,50\t1,00\t1,20\tc\t\t\t20, g, 0\tvegetarisch, Milch und Laktose (g), zusatzstoff- und allergenfrei\t-\tBrennwert=612 kJ (146 kcal), Fett=1,1g, davon gesättigte Fettsäuren=0,6g, Kohlenhydrate=19,8g, davon Zucker=18,8g, Ballaststoffe=0,0g, Eiweiß=12,8g, Salz=0,1g,\nMensa Haste\t24.01.2022\t1701\t3648\tStärkebeilage 3\tBeilagen\t525\tPommes frites klein (21)\t\t\t\t\t\tPommes frites small (21)\t\t\t\t\t\t0,55\t1,05\t1,25\tc\t2\t\t21, 0\tvegan, zusatzstoff- und allergenfrei\t-\tBrennwert=1097 kJ (262 kcal), Fett=12,1g, davon gesättigte Fettsäuren=4,4g, Kohlenhydrate=33,0g, davon Zucker=0,8g, Ballaststoffe=3,0g, Eiweiß=3,8g, Salz=1,0g,\nMensa Haste\t24.01.2022\t1714\t3614\tEintopf (Terrine, Teller)\tEintopf Terrine\t1559\tBio-Möhreneintopf mit roten Linsen (16,19,21,23,i)\tBio-Dinkelbrötchen (19,21,a)\t\t\t\t\tOrganic carrot stew with red lentils (16,19,21,23,i)\tOrganic spelt roll (19,21,a)\t\t\t\t\t1,80\t3,40\t4,20\tg\t2\t\t16, 19, 21, 23, a, i, 0\tKlimaTeller, Bio-Erzeugnis DE-ÖKO-039, vegan, Bio-Menü, Glutenhaltiges Getreide (a), Sellerie (i), zusatzstoff- und allergenfrei\t-\tBrennwert=2137 kJ (510 kcal), Fett=5,4g, davon gesättigte Fettsäuren=0,7g, Kohlenhydrate=80,2g, davon Zucker=15,1g, Ballaststoffe=19,6g, Eiweiß=21,2g, Salz=6,1g,\nMensa Haste\t24.01.2022\t2130\t4388\tKM 1 veget./vegan,+1,35 €\tHauptgericht\t2893\tCouscous mit Datteln, Mandeln und Minze (16,21,a,h)\t\t\t\t\t\tCouscous with dates, almonds and mint (16,21,a,h)\t\t\t\t\t\t1,80\t3,15\t3,95\tg\t2\t\t16, 21, a, h, 0\tKlimaTeller, vegan, Glutenhaltiges Getreide (a), Schalenfrüchte (Nüsse) (h), zusatzstoff- und allergenfrei\t-\tBrennwert=2162 kJ (516 kcal), Fett=13,5g, davon gesättigte Fettsäuren=1,3g, Kohlenhydrate=78,0g, davon Zucker=18,8g, Ballaststoffe=7,4g, Eiweiß=15,0g, Salz=3,9g,\nMensa Haste\t24.01.2022\t2130\t4389\tKM 2 Fleisch/Fisc,+1,55 €\tHauptgericht\t1244\tJägerschnitzel (1,3,13,17,a,c,g)\tKroketten (21,a)\t\t\t\t\tPork cutlet with mushroom sauce (1,3,13,17,a,c,g)\tCroquettes (21,a)\t\t\t\t\t2,45\t4,00\t4,80\tc\t2\t\t1, 3, 13, 17, 21, 22, a, c, g, 0\tmit Farbstoff, mit Antioxidationsmittel, Schweinefleisch, Knoblauch, vegan, nicht vegan/vegetarisch (tierische Hilfsstoffe), Glutenhaltiges Getreide (a), Hühnerei (c), Milch und Laktose (g), zusatzstoff- und allergenfrei\t-\tBrennwert=2336 kJ (558 kcal), Fett=31,3g, davon gesättigte Fettsäuren=4,5g, Kohlenhydrate=40,4g, davon Zucker=3,7g, Ballaststoffe=1,9g, Eiweiß=28,2g, Salz=5,6g,\nMensa Haste\t24.01.2022\t2130\t4389\tKM 2 Fleisch/Fisc,+1,55 €\tHauptgericht\t22\tJägerschnitzel (1,3,13,17,a,c,g)\tKroketten (21,a)\t\t\t\t\tPork cutlet with mushroom sauce (1,3,13,17,a,c,g)\tCroquettes (21,a)\t\t\t\t\t2,45\t4,00\t4,80\tc\t2\t\t1, 3, 13, 17, 21, 22, a, c, g, 0\tmit Farbstoff, mit Antioxidationsmittel, Schweinefleisch, Knoblauch, vegan, nicht vegan/vegetarisch (tierische Hilfsstoffe), Glutenhaltiges Getreide (a), Hühnerei (c), Milch und Laktose (g), zusatzstoff- und allergenfrei\t-\tBrennwert=2336 kJ (558 kcal), Fett=31,3g, davon gesättigte Fettsäuren=4,5g, Kohlenhydrate=40,4g, davon Zucker=3,7g, Ballaststoffe=1,9g, Eiweiß=28,2g, Salz=5,6g,\nMensa Haste\t24.01.2022\t1714\t3614\tEintopf (Terrine, Teller)\tEintopf Terrine\t3157\tBio-Möhreneintopf mit roten Linsen (16,19,21,23,i)\tBio-Dinkelbrötchen (19,21,a)\t\t\t\t\tOrganic carrot stew with red lentils (16,19,21,23,i)\tOrganic spelt roll (19,21,a)\t\t\t\t\t1,80\t3,40\t4,20\tg\t2\t\t16, 19, 21, 23, a, i, 0\tKlimaTeller, Bio-Erzeugnis DE-ÖKO-039, vegan, Bio-Menü, Glutenhaltiges Getreide (a), Sellerie (i), zusatzstoff- und allergenfrei\t-\tBrennwert=2137 kJ (510 kcal), Fett=5,4g, davon gesättigte Fettsäuren=0,7g, Kohlenhydrate=80,2g, davon Zucker=15,1g, Ballaststoffe=19,6g, Eiweiß=21,2g, Salz=6,1g,\nMensa Lingen\t24.01.2022\t2130\t4388\tKM 1 veget./vegan,+1,35 €\tHauptgericht\t2893\tCouscous mit Datteln, Mandeln und Minze (16,21,a,h)\t\t\t\t\t\tCouscous with dates, almonds and mint (16,21,a,h)\t\t\t\t\t\t1,80\t3,15\t3,95\tg\t2\t\t16, 21, a, h, 0\tKlimaTeller, vegan, Glutenhaltiges Getreide (a), Schalenfrüchte (Nüsse) (h), zusatzstoff- und allergenfrei\t-\tBrennwert=2162 kJ (516 kcal), Fett=13,5g, davon gesättigte Fettsäuren=1,3g, Kohlenhydrate=78,0g, davon Zucker=18,8g, Ballaststoffe=7,4g, Eiweiß=15,0g, Salz=3,9g,\nMensa Lingen\t24.01.2022\t2130\t4389\tKM 2 Fleisch/Fisc,+1,55 €\tHauptgericht\t22\tJägerschnitzel (1,3,13,17,a,c,g)\tKroketten (21,a)\t\t\t\t\tPork cutlet with mushroom sauce (1,3,13,17,a,c,g)\tCroquettes (21,a)\t\t\t\t\t2,45\t4,00\t4,80\tc\t2\t\t1, 3, 13, 17, 21, 22, a, c, g, 0\tmit Farbstoff, mit Antioxidationsmittel, Schweinefleisch, Knoblauch, vegan, nicht vegan/vegetarisch (tierische Hilfsstoffe), Glutenhaltiges Getreide (a), Hühnerei (c), Milch und Laktose (g), zusatzstoff- und allergenfrei\t-\tBrennwert=2338 kJ (558 kcal), Fett=31,3g, davon gesättigte Fettsäuren=4,5g, Kohlenhydrate=40,4g, davon Zucker=3,7g, Ballaststoffe=1,9g, Eiweiß=28,2g, Salz=5,6g,\nMensa Lingen\t24.01.2022\t2130\t4389\tKM 2 Fleisch/Fisc,+1,55 €\tHauptgericht\t1244\tJägerschnitzel (1,3,13,17,a,c,g)\tKroketten (21,a)\t\t\t\t\tPork cutlet with mushroom sauce (1,3,13,17,a,c,g)\tCroquettes (21,a)\t\t\t\t\t2,45\t4,00\t4,80\tc\t2\t\t1, 3, 13, 17, 21, 22, a, c, g, 0\tmit Farbstoff, mit Antioxidationsmittel, Schweinefleisch, Knoblauch, vegan, nicht vegan/vegetarisch (tierische Hilfsstoffe), Glutenhaltiges Getreide (a), Hühnerei (c), Milch und Laktose (g), zusatzstoff- und allergenfrei\t-\tBrennwert=2338 kJ (558 kcal), Fett=31,3g, davon gesättigte Fettsäuren=4,5g, Kohlenhydrate=40,4g, davon Zucker=3,7g, Ballaststoffe=1,9g, Eiweiß=28,2g, Salz=5,6g,\nMensa Lingen\t24.01.2022\t2130\t10518\tKM 5 veget./vegan,+1,35 €\tHauptgericht\t3183\tPommes frites groß (21)\t\t\t\t\t\tPommes frites large (21)\t\t\t\t\t\t1,00\t2,35\t3,15\tc\t2\t\t21, 0\tvegan, zusatzstoff- und allergenfrei\t-\tBrennwert=2194 kJ (524 kcal), Fett=24,2g, davon gesättigte Fettsäuren=8,8g, Kohlenhydrate=66,0g, davon Zucker=1,5g, Ballaststoffe=6,0g, Eiweiß=7,5g, Salz=1,6g,\nMensa Lingen\t24.01.2022\t1701\t3648\tStärkebeilage 3\tBeilagen\t525\tPommes frites klein (21)\t\t\t\t\t\tPommes frites small (21)\t\t\t\t\t\t0,55\t1,05\t1,25\tc\t2\t\t21, 0\tvegan, zusatzstoff- und allergenfrei\t-\tBrennwert=1097 kJ (262 kcal), Fett=12,1g, davon gesättigte Fettsäuren=4,4g, Kohlenhydrate=33,0g, davon Zucker=0,8g, Ballaststoffe=3,0g, Eiweiß=3,8g, Salz=1,0g,\nMensa Schlossgarten\t24.01.2022\t1714\t3614\tEintopf (Terrine, Teller)\tEintopf Terrine\t3157\tBio-Möhreneintopf mit roten Linsen (16,19,21,23,i)\tBio-Dinkelbrötchen (19,21,a)\t\t\t\t\tOrganic carrot stew with red lentils (16,19,21,23,i)\tOrganic spelt roll (19,21,a)\t\t\t\t\t1,80\t3,40\t4,20\tg\t\t\t16, 19, 21, 23, a, i, 0\tKlimaTeller, Bio-Erzeugnis DE-ÖKO-039, vegan, Bio-Menü, Glutenhaltiges Getreide (a), Sellerie (i), zusatzstoff- und allergenfrei\t-\tBrennwert=2142 kJ (512 kcal), Fett=5,5g, davon gesättigte Fettsäuren=0,7g, Kohlenhydrate=80,4g, davon Zucker=15,3g, Ballaststoffe=19,7g, Eiweiß=21,2g, Salz=6,1g,\nMensa Schlossgarten\t24.01.2022\t1701\t3646\tGemüsebeilage 3/Tagessala\tTagessalat\t490\tBunter Zucchinisalat (3,21,k,j)\t\t\t\t\t\tColourful courgette salad (3,21,k,j)\t\t\t\t\t\t0,50\t1,00\t1,20\ta\t\t\t3, 21, k, j, 0\tmit Antioxidationsmittel, vegan, Schwefeldioxid u. Sulfite (k), Senf (j), zusatzstoff- und allergenfrei\t-\tBrennwert=576 kJ (138 kcal), Fett=8,7g, davon gesättigte Fettsäuren=0,8g, Kohlenhydrate=9,7g, davon Zucker=7,3g, Ballaststoffe=2,5g, Eiweiß=3,1g, Salz=1,0g,\nMensa Schlossgarten\t24.01.2022\t2097\t3665\tDessert 1\tDessert\t1151\tWeiße Schokoladenmousse (20,g)\t\t\t\t\t\tWhite chocolate mousse (20,g)\t\t\t\t\t\t0,70\t1,20\t1,40\tc\t\t\t20, g, 0\tvegetarisch, Milch und Laktose (g), zusatzstoff- und allergenfrei\t-\tBrennwert=991 kJ (237 kcal), Fett=13,2g, davon gesättigte Fettsäuren=10,1g, Kohlenhydrate=25,6g, davon Zucker=20,2g, Ballaststoffe=0,0g, Eiweiß=3,4g, Salz=0,2g,\nMensa Schlossgarten\t24.01.2022\t2130\t4389\tKM 2 Fleisch/Fisc,+1,55 €\tHauptgericht\t22\tJägerschnitzel (1,3,13,17,a,c,g)\tKroketten (21,a)\t\t\t\t\tPork cutlet with mushroom sauce (1,3,13,17,a,c,g)\tCroquettes (21,a)\t\t\t\t\t2,45\t4,00\t4,80\tc\t\t\t1, 3, 13, 17, 21, 22, a, c, g, 0\tmit Farbstoff, mit Antioxidationsmittel, Schweinefleisch, Knoblauch, vegan, nicht vegan/vegetarisch (tierische Hilfsstoffe), Glutenhaltiges Getreide (a), Hühnerei (c), Milch und Laktose (g), zusatzstoff- und allergenfrei\t-\tBrennwert=2336 kJ (558 kcal), Fett=31,3g, davon gesättigte Fettsäuren=4,5g, Kohlenhydrate=40,4g, davon Zucker=3,7g, Ballaststoffe=1,9g, Eiweiß=28,2g, Salz=5,7g,\nMensa Schlossgarten\t24.01.2022\t2130\t4389\tKM 2 Fleisch/Fisc,+1,55 €\tHauptgericht\t1244\tJägerschnitzel (1,3,13,17,a,c,g)\tKroketten (21,a)\t\t\t\t\tPork cutlet with mushroom sauce (1,3,13,17,a,c,g)\tCroquettes (21,a)\t\t\t\t\t2,45\t4,00\t4,80\tc\t\t\t1, 3, 13, 17, 21, 22, a, c, g, 0\tmit Farbstoff, mit Antioxidationsmittel, Schweinefleisch, Knoblauch, vegan, nicht vegan/vegetarisch (tierische Hilfsstoffe), Glutenhaltiges Getreide (a), Hühnerei (c), Milch und Laktose (g), zusatzstoff- und allergenfrei\t-\tBrennwert=2336 kJ (558 kcal), Fett=31,3g, davon gesättigte Fettsäuren=4,5g, Kohlenhydrate=40,4g, davon Zucker=3,7g, Ballaststoffe=1,9g, Eiweiß=28,2g, Salz=5,7g,\nMensa Schlossgarten\t24.01.2022\t1701\t3648\tStärkebeilage 3\tBeilagen\t525\t\t\t\t\t\t\t\t\t\t\t\t\t0,55\t1,05\t1,25\tc\t\t\t21, 0\tvegan, zusatzstoff- und allergenfrei\t-\t-\nMensa Schlossgarten\t24.01.2022\t2130\t10518\tKM 5 veget./vegan,+1,35 €\tHauptgericht\t3183\t\t\t\t\t\t\t\t\t\t\t\t\t1,00\t2,35\t3,15\tc\t\t\t21, 0\tvegan, zusatzstoff- und allergenfrei\t-\t-\nMensa Schlossgarten\t24.01.2022\t1714\t3614\tEintopf (Terrine, Teller)\tEintopf Terrine\t1559\tBio-Möhreneintopf mit roten Linsen (16,19,21,23,i)\tBio-Dinkelbrötchen (19,21,a)\t\t\t\t\tOrganic carrot stew with red lentils (16,19,21,23,i)\tOrganic spelt roll (19,21,a)\t\t\t\t\t1,80\t3,40\t4,20\tg\t\t\t16, 19, 21, 23, a, i, 0\tKlimaTeller, Bio-Erzeugnis DE-ÖKO-039, vegan, Bio-Menü, Glutenhaltiges Getreide (a), Sellerie (i), zusatzstoff- und allergenfrei\t-\tBrennwert=2142 kJ (512 kcal), Fett=5,5g, davon gesättigte Fettsäuren=0,7g, Kohlenhydrate=80,4g, davon Zucker=15,3g, Ballaststoffe=19,7g, Eiweiß=21,2g, Salz=6,1g,\nMensa Schlossgarten\t24.01.2022\t2130\t4388\tKM 1 veget./vegan,+1,35 €\tHauptgericht\t2893\tCouscous mit Datteln, Mandeln und Minze (16,21,a,h)\t\t\t\t\t\tCouscous with dates, almonds and mint (16,21,a,h)\t\t\t\t\t\t1,80\t3,15\t3,95\tg\t\t\t16, 21, a, h, 0\tKlimaTeller, vegan, Glutenhaltiges Getreide (a), Schalenfrüchte (Nüsse) (h), zusatzstoff- und allergenfrei\t-\tBrennwert=2165 kJ (517 kcal), Fett=13,5g, davon gesättigte Fettsäuren=1,3g, Kohlenhydrate=78,1g, davon Zucker=18,8g, Ballaststoffe=7,5g, Eiweiß=15,1g, Salz=3,9g,\nMensa Vechta\t24.01.2022\t2130\t4388\tKM 1 veget./vegan,+1,35 €\tHauptgericht\t3145\tPoutine Tex Mex mit Limettenmayo (1,3,21,a,i,j,f)\t\t\t\t\t\tPoutine Tex Mex with lime mayo (1,3,21,a,i,j,f)\t\t\t\t\t\t2,00\t3,35\t4,15\tg\t2\t\t21, a, i, j, f, 0\tvegan, Glutenhaltiges Getreide (a), Sellerie (i), Senf (j), Soja (f), zusatzstoff- und allergenfrei\t-\tBrennwert=4547 kJ (1086 kcal), Fett=71,4g, davon gesättigte Fettsäuren=10,2g, Kohlenhydrate=93,7g, davon Zucker=24,0g, Ballaststoffe=9,5g, Eiweiß=13,1g, Salz=3,4g,\nMensa Vechta\t24.01.2022\t1701\t3648\tStärkebeilage 3\tBeilagen\t525\tPommes frites klein (21)\t\t\t\t\t\tPommes frites small (21)\t\t\t\t\t\t0,55\t1,05\t1,25\tc\t2\t\t21, 0\tvegan, zusatzstoff- und allergenfrei\t-\tBrennwert=1097 kJ (262 kcal), Fett=12,1g, davon gesättigte Fettsäuren=4,4g, Kohlenhydrate=33,0g, davon Zucker=0,8g, Ballaststoffe=3,0g, Eiweiß=3,8g, Salz=1,0g,\nMensa Vechta\t24.01.2022\t2130\t10518\tKM 5 veget./vegan,+1,35 €\tHauptgericht\t3183\tPommes frites groß (21)\t\t\t\t\t\tPommes frites large (21)\t\t\t\t\t\t1,00\t2,35\t3,15\tc\t2\t\t21, 0\tvegan, zusatzstoff- und allergenfrei\t-\tBrennwert=2194 kJ (524 kcal), Fett=24,2g, davon gesättigte Fettsäuren=8,8g, Kohlenhydrate=66,0g, davon Zucker=1,5g, Ballaststoffe=6,0g, Eiweiß=7,5g, Salz=1,6g,\nMensa Vechta\t24.01.2022\t1714\t3614\tEintopf (Terrine, Teller)\tEintopf Terrine\t1559\tBio-Möhreneintopf mit roten Linsen (16,19,21,23,i)\tBio-Dinkelbrötchen (19,21,a)\t\t\t\t\tOrganic carrot stew with red lentils (16,19,21,23,i)\tOrganic spelt roll (19,21,a)\t\t\t\t\t1,80\t3,40\t4,20\tg\t2\t\t16, 19, 21, 23, a, i, 0\tKlimaTeller, Bio-Erzeugnis DE-ÖKO-039, vegan, Bio-Menü, Glutenhaltiges Getreide (a), Sellerie (i), zusatzstoff- und allergenfrei\t-\tBrennwert=2144 kJ (512 kcal), Fett=5,5g, davon gesättigte Fettsäuren=0,7g, Kohlenhydrate=80,5g, davon Zucker=15,3g, Ballaststoffe=19,7g, Eiweiß=21,3g, Salz=6,1g,\nMensa Vechta\t24.01.2022\t1714\t3614\tEintopf (Terrine, Teller)\tEintopf Terrine\t3157\tBio-Möhreneintopf mit roten Linsen (16,19,21,23,i)\tBio-Dinkelbrötchen (19,21,a)\t\t\t\t\tOrganic carrot stew with red lentils (16,19,21,23,i)\tOrganic spelt roll (19,21,a)\t\t\t\t\t1,80\t3,40\t4,20\tg\t2\t\t16, 19, 21, 23, a, i, 0\tKlimaTeller, Bio-Erzeugnis DE-ÖKO-039, vegan, Bio-Menü, Glutenhaltiges Getreide (a), Sellerie (i), zusatzstoff- und allergenfrei\t-\tBrennwert=2144 kJ (512 kcal), Fett=5,5g, davon gesättigte Fettsäuren=0,7g, Kohlenhydrate=80,5g, davon Zucker=15,3g, Ballaststoffe=19,7g, Eiweiß=21,3g, Salz=6,1g,\nMensa Vechta\t24.01.2022\t2130\t4389\tKM 2 Fleisch/Fisc,+1,55 €\tHauptgericht\t396\tPizza Salami (1,2,3,14,a,g,j,40)\t\t\t\t\t\tPizza salami (1,2,3,14,a,g,j,40)\t\t\t\t\t\t2,80\t4,35\t5,15\tc\t2\t\t1, 2, 3, 14, a, g, 40, 0\tmit Farbstoff, mit Konservierungsstoff, mit Antioxidationsmittel, Rindfleisch, Glutenhaltiges Getreide (a), Milch und Laktose (g), Geflügel, zusatzstoff- und allergenfrei\t-\tBrennwert=3517 kJ (840 kcal), Fett=40,7g, davon gesättigte Fettsäuren=21,6g, Kohlenhydrate=73,6g, davon Zucker=2,7g, Ballaststoffe=1,8g, Eiweiß=42,8g, Salz=6,4g,\nMensa Westerberg\t24.01.2022\t2130\t10518\tKM 5 veget./vegan,+1,35 €\tHauptgericht\t3183\tPommes frites groß (21)\t\t\t\t\t\tPommes frites large (21)\t\t\t\t\t\t1,00\t2,35\t3,15\tc\t\t\t21, 0\tvegan, zusatzstoff- und allergenfrei\t-\tBrennwert=2194 kJ (524 kcal), Fett=24,2g, davon gesättigte Fettsäuren=8,8g, Kohlenhydrate=66,0g, davon Zucker=1,5g, Ballaststoffe=6,0g, Eiweiß=7,5g, Salz=1,6g,\nMensa Westerberg\t24.01.2022\t2130\t4389\tKM 2 Fleisch/Fisc,+1,55 €\tHauptgericht\t22\tJägerschnitzel (1,3,13,17,a,c,g)\tKroketten (21,a)\t\t\t\t\tPork cutlet with mushroom sauce (1,3,13,17,a,c,g)\tCroquettes (21,a)\t\t\t\t\t2,45\t4,00\t4,80\tc\t\t\t1, 3, 13, 17, 21, 22, a, c, g, 0\tmit Farbstoff, mit Antioxidationsmittel, Schweinefleisch, Knoblauch, vegan, nicht vegan/vegetarisch (tierische Hilfsstoffe), Glutenhaltiges Getreide (a), Hühnerei (c), Milch und Laktose (g), zusatzstoff- und allergenfrei\t-\tBrennwert=2336 kJ (558 kcal), Fett=31,3g, davon gesättigte Fettsäuren=4,5g, Kohlenhydrate=40,4g, davon Zucker=3,7g, Ballaststoffe=1,9g, Eiweiß=28,2g, Salz=5,7g,\nMensa Westerberg\t24.01.2022\t2130\t4388\tKM 1 veget./vegan,+1,35 €\tHauptgericht\t2893\tCouscous mit Datteln, Mandeln und Minze (16,21,a,h)\t\t\t\t\t\tCouscous with dates, almonds and mint (16,21,a,h)\t\t\t\t\t\t1,80\t3,15\t3,95\tg\t\t\t16, 21, a, h, 0\tKlimaTeller, vegan, Glutenhaltiges Getreide (a), Schalenfrüchte (Nüsse) (h), zusatzstoff- und allergenfrei\t-\tBrennwert=2166 kJ (517 kcal), Fett=13,5g, davon gesättigte Fettsäuren=1,3g, Kohlenhydrate=78,1g, davon Zucker=18,8g, Ballaststoffe=7,5g, Eiweiß=15,1g, Salz=3,9g,\nMensa Westerberg\t24.01.2022\t1714\t3614\tEintopf (Terrine, Teller)\tEintopf Terrine\t3157\tBio-Möhreneintopf mit roten Linsen (16,19,21,23,i)\tBio-Dinkelbrötchen (19,21,a)\t\t\t\t\tOrganic carrot stew with red lentils (16,19,21,23,i)\tOrganic spelt roll (19,21,a)\t\t\t\t\t1,80\t3,40\t4,20\tg\t\t\t16, 19, 21, 23, a, i, 0\tKlimaTeller, Bio-Erzeugnis DE-ÖKO-039, vegan, Bio-Menü, Glutenhaltiges Getreide (a), Sellerie (i), zusatzstoff- und allergenfrei\t-\tBrennwert=2144 kJ (512 kcal), Fett=5,5g, davon gesättigte Fettsäuren=0,7g, Kohlenhydrate=80,4g, davon Zucker=15,3g, Ballaststoffe=19,7g, Eiweiß=21,2g, Salz=6,1g,\nMensa Westerberg\t24.01.2022\t1714\t3614\tEintopf (Terrine, Teller)\tEintopf Terrine\t1559\tBio-Möhreneintopf mit roten Linsen (16,19,21,23,i)\tBio-Dinkelbrötchen (19,21,a)\t\t\t\t\tOrganic carrot stew with red lentils (16,19,21,23,i)\tOrganic spelt roll (19,21,a)\t\t\t\t\t1,80\t3,40\t4,20\tg\t\t\t16, 19, 21, 23, a, i, 0\tKlimaTeller, Bio-Erzeugnis DE-ÖKO-039, vegan, Bio-Menü, Glutenhaltiges Getreide (a), Sellerie (i), zusatzstoff- und allergenfrei\t-\tBrennwert=2144 kJ (512 kcal), Fett=5,5g, davon gesättigte Fettsäuren=0,7g, Kohlenhydrate=80,4g, davon Zucker=15,3g, Ballaststoffe=19,7g, Eiweiß=21,2g, Salz=6,1g,\nMensa Westerberg\t24.01.2022\t2097\t3665\tDessert 1\tDessert\t1151\tWeiße Schokoladenmousse (20,g)\t\t\t\t\t\tWhite chocolate mousse (20,g)\t\t\t\t\t\t0,70\t1,20\t1,40\tc\t\t\t20, g, 0\tvegetarisch, Milch und Laktose (g), zusatzstoff- und allergenfrei\t-\tBrennwert=993 kJ (237 kcal), Fett=13,2g, davon gesättigte Fettsäuren=10,1g, Kohlenhydrate=25,6g, davon Zucker=20,2g, Ballaststoffe=0,0g, Eiweiß=3,4g, Salz=0,2g,\nMensa Westerberg\t24.01.2022\t2130\t4389\tKM 2 Fleisch/Fisc,+1,55 €\tHauptgericht\t1244\tJägerschnitzel (1,3,13,17,a,c,g)\tKroketten (21,a)\t\t\t\t\tPork cutlet with mushroom sauce (1,3,13,17,a,c,g)\tCroquettes (21,a)\t\t\t\t\t2,45\t4,00\t4,80\tc\t\t\t1, 3, 13, 17, 21, 22, a, c, g, 0\tmit Farbstoff, mit Antioxidationsmittel, Schweinefleisch, Knoblauch, vegan, nicht vegan/vegetarisch (tierische Hilfsstoffe), Glutenhaltiges Getreide (a), Hühnerei (c), Milch und Laktose (g), zusatzstoff- und allergenfrei\t-\tBrennwert=2336 kJ (558 kcal), Fett=31,3g, davon gesättigte Fettsäuren=4,5g, Kohlenhydrate=40,4g, davon Zucker=3,7g, Ballaststoffe=1,9g, Eiweiß=28,2g, Salz=5,7g,\nMensa Westerberg\t24.01.2022\t1701\t3648\tStärkebeilage 3\tBeilagen\t525\tPommes frites klein (21)\t\t\t\t\t\tPommes frites small (21)\t\t\t\t\t\t0,55\t1,05\t1,25\tc\t\t\t21, 0\tvegan, zusatzstoff- und allergenfrei\t-\tBrennwert=1097 kJ (262 kcal), Fett=12,1g, davon gesättigte Fettsäuren=4,4g, Kohlenhydrate=33,0g, davon Zucker=0,8g, Ballaststoffe=3,0g, Eiweiß=3,8g, Salz=1,0g,\nMensa Westerberg\t24.01.2022\t1701\t3646\tGemüsebeilage 3/Tagessala\tTagessalat\t490\tBunter Zucchinisalat (3,21,k,j)\t\t\t\t\t\tColourful courgette salad (3,21,k,j)\t\t\t\t\t\t0,50\t1,00\t1,20\ta\t\t\t3, 21, k, j, 0\tmit Antioxidationsmittel, vegan, Schwefeldioxid u. Sulfite (k), Senf (j), zusatzstoff- und allergenfrei\t-\tBrennwert=576 kJ (138 kcal), Fett=8,7g, davon gesättigte Fettsäuren=0,8g, Kohlenhydrate=9,7g, davon Zucker=7,3g, Ballaststoffe=2,4g, Eiweiß=3,1g, Salz=1,0g,\nMensa Haste\t25.01.2022\t2130\t10518\tKM 5 veget./vegan,+1,35 €\tHauptgericht\t3183\tPommes frites groß (21)\t\t\t\t\t\tPommes frites large (21)\t\t\t\t\t\t1,00\t2,35\t3,15\tc\t2\t\t21, 0\tvegan, zusatzstoff- und allergenfrei\t-\tBrennwert=2194 kJ (524 kcal), Fett=24,2g, davon gesättigte Fettsäuren=8,8g, Kohlenhydrate=66,0g, davon Zucker=1,5g, Ballaststoffe=6,0g, Eiweiß=7,5g, Salz=1,6g,\nMensa Haste\t25.01.2022\t2097\t3666\tDessert 2\tDessert\t253\tQuark (20,g)\tErdbeersauce\t\t\t\t\tQuark dessert (20,g)\tStrawberry sauce\t\t\t\t\t0,50\t1,00\t1,20\tc\t\t\t20, g, 0\tvegetarisch, Milch und Laktose (g), zusatzstoff- und allergenfrei\t-\tBrennwert=612 kJ (146 kcal), Fett=1,1g, davon gesättigte Fettsäuren=0,6g, Kohlenhydrate=19,8g, davon Zucker=18,8g, Ballaststoffe=0,0g, Eiweiß=12,8g, Salz=0,1g,\nMensa Haste\t25.01.2022\t1701\t3648\tStärkebeilage 3\tBeilagen\t525\tPommes frites klein (21)\t\t\t\t\t\tPommes frites small (21)\t\t\t\t\t\t0,55\t1,05\t1,25\tc\t2\t\t21, 0\tvegan, zusatzstoff- und allergenfrei\t-\tBrennwert=1097 kJ (262 kcal), Fett=12,1g, davon gesättigte Fettsäuren=4,4g, Kohlenhydrate=33,0g, davon Zucker=0,8g, Ballaststoffe=3,0g, Eiweiß=3,8g, Salz=1,0g,\nMensa Haste\t25.01.2022\t2130\t4388\tKM 1 veget./vegan,+1,35 €\tHauptgericht\t3145\tPoutine Tex Mex mit Limettenmayo (3,21,a,i,j,f)\t\t\t\t\t\tPoutine Tex Mex with lime mayo (3,21,a,i,j,f)\t\t\t\t\t\t2,00\t3,35\t4,15\tg\t2\t\t21, a, i, j, f, 0\tvegan, Glutenhaltiges Getreide (a), Sellerie (i), Senf (j), Soja (f), zusatzstoff- und allergenfrei\t-\tBrennwert=4534 kJ (1083 kcal), Fett=71,2g, davon gesättigte Fettsäuren=10,1g, Kohlenhydrate=93,4g, davon Zucker=24,0g, Ballaststoffe=9,2g, Eiweiß=13,0g, Salz=3,2g,\nMensa Haste\t25.01.2022\t2130\t10190\tKM 4 Fleisch/Fisc,+1,55 €\tHauptgericht\t1571\tRindergulasch mit Paprika und Kartoffelklößchen (14,18)\tDelikatessbohnen (21)\t\t\t\t\tBeef goulash with bell pepper and potato dumplings (14,18)\tPrincess beans (21)\t\t\t\t\t0,00\t1,55\t2,35\tc\t2\t\t14, 18, 21, 0\tRindfleisch, Fleisch aus artgerechter Tierhaltung, vegan, zusatzstoff- und allergenfrei\t-\tBrennwert=1889 kJ (451 kcal), Fett=6,4g, davon gesättigte Fettsäuren=2,8g, Kohlenhydrate=59,3g, davon Zucker=5,7g, Ballaststoffe=0,8g, Eiweiß=31,0g, Salz=6,4g,\nMensa Haste\t25.01.2022\t2130\t10190\tKM 4 Fleisch/Fisc,+1,55 €\tHauptgericht\t66\tRindergulasch mit Paprika und Kartoffelklößchen (14,18)\tDelikatessbohnen (21)\t\t\t\t\tBeef goulash with bell pepper and potato dumplings (14,18)\tPrincess beans (21)\t\t\t\t\t0,00\t1,55\t2,35\tc\t2\t\t14, 18, 21, 0\tRindfleisch, Fleisch aus artgerechter Tierhaltung, vegan, zusatzstoff- und allergenfrei\t-\tBrennwert=1889 kJ (451 kcal), Fett=6,4g, davon gesättigte Fettsäuren=2,8g, Kohlenhydrate=59,3g, davon Zucker=5,7g, Ballaststoffe=0,8g, Eiweiß=31,0g, Salz=6,4g,\nMensa Haste\t25.01.2022\t2130\t4389\tKM 2 Fleisch/Fisc,+1,55 €\tHauptgericht\t3143\tAvocado Pulled Chicken Burger mit Chili-Mayo und BBQ-Sauce (2,9,a,c,j,m,40)\t\t\t\t\t\tAvocado Pulled Chicken Burger with chili mayonnaise an BBQ sauce (2,9,a,c,j,m,40)\t\t\t\t\t\t3,60\t5,15\t5,95\tc\t2\t\t2, 9, a, c, j, m, 40, 0\tmit Konservierungsstoff, mit Süßungsmitteln, Glutenhaltiges Getreide (a), Hühnerei (c), Senf (j), Sesam (m), Geflügel, zusatzstoff- und allergenfrei\t-\tBrennwert=2556 kJ (611 kcal), Fett=35,1g, davon gesättigte Fettsäuren=5,1g, Kohlenhydrate=37,8g, davon Zucker=12,8g, Ballaststoffe=5,4g, Eiweiß=33,4g, Salz=4,2g,\nMensa Haste\t25.01.2022\t2097\t3666\tDessert 2\tDessert\t461\tQuark (20,g)\tErdbeersauce\t\t\t\t\tQuark dessert (20,g)\tStrawberry sauce\t\t\t\t\t0,50\t1,00\t1,20\tc\t\t\t20, g, 0\tvegetarisch, Milch und Laktose (g), zusatzstoff- und allergenfrei\t-\tBrennwert=612 kJ (146 kcal), Fett=1,1g, davon gesättigte Fettsäuren=0,6g, Kohlenhydrate=19,8g, davon Zucker=18,8g, Ballaststoffe=0,0g, Eiweiß=12,8g, Salz=0,1g,\nMensa Lingen\t25.01.2022\t2130\t4389\tKM 2 Fleisch/Fisc,+1,55 €\tHauptgericht\t3143\tAvocado Pulled Pork Burger mit Chili-Mayo und BBQ-Sauce (2,9,13,a,c,j,m)\t\t\t\t\t\tAvocado Pulled Pork Burger with chili mayonnaise an BBQ sauce (2,9,13,a,c,j,m)\t\t\t\t\t\t3,60\t5,15\t5,95\tc\t2\t\t2, 9, 13, a, c, j, m, 0\tmit Konservierungsstoff, mit Süßungsmitteln, Schweinefleisch, Glutenhaltiges Getreide (a), Hühnerei (c), Senf (j), Sesam (m), zusatzstoff- und allergenfrei\t-\tBrennwert=2677 kJ (639 kcal), Fett=37,4g, davon gesättigte Fettsäuren=6,2g, Kohlenhydrate=38,0g, davon Zucker=13,0g, Ballaststoffe=5,4g, Eiweiß=35,1g, Salz=4,6g,\nMensa Lingen\t25.01.2022\t2130\t10518\tKM 5 veget./vegan,+1,35 €\tHauptgericht\t3183\tPommes frites groß (21)\t\t\t\t\t\tPommes frites large (21)\t\t\t\t\t\t1,00\t2,35\t3,15\tc\t2\t\t21, 0\tvegan, zusatzstoff- und allergenfrei\t-\tBrennwert=2194 kJ (524 kcal), Fett=24,2g, davon gesättigte Fettsäuren=8,8g, Kohlenhydrate=66,0g, davon Zucker=1,5g, Ballaststoffe=6,0g, Eiweiß=7,5g, Salz=1,6g,\nMensa Lingen\t25.01.2022\t1701\t3648\tStärkebeilage 3\tBeilagen\t525\tPommes frites klein (21)\t\t\t\t\t\tPommes frites small (21)\t\t\t\t\t\t0,55\t1,05\t1,25\tc\t2\t\t21, 0\tvegan, zusatzstoff- und allergenfrei\t-\tBrennwert=1097 kJ (262 kcal), Fett=12,1g, davon gesättigte Fettsäuren=4,4g, Kohlenhydrate=33,0g, davon Zucker=0,8g, Ballaststoffe=3,0g, Eiweiß=3,8g, Salz=1,0g,\nMensa Lingen\t25.01.2022\t2130\t4388\tKM 1 veget./vegan,+1,35 €\tHauptgericht\t3145\tPoutine Tex Mex mit Limettenmayo (3,21,a,i,j,f)\t\t\t\t\t\tPoutine Tex Mex with lime mayo (3,21,a,i,j,f)\t\t\t\t\t\t2,00\t3,35\t4,15\tg\t2\t\t21, a, i, j, f, 0\tvegan, Glutenhaltiges Getreide (a), Sellerie (i), Senf (j), Soja (f), zusatzstoff- und allergenfrei\t-\tBrennwert=4534 kJ (1083 kcal), Fett=71,2g, davon gesättigte Fettsäuren=10,1g, Kohlenhydrate=93,4g, davon Zucker=24,0g, Ballaststoffe=9,2g, Eiweiß=13,0g, Salz=3,2g,\nMensa Lingen\t25.01.2022\t2130\t10190\tKM 4 Fleisch/Fisc,+1,55 €\tHauptgericht\t66\tRindergulasch mit Paprika und Kartoffelklößchen (14,18)\tDelikatessbohnen (21)\t\t\t\t\tBeef goulash with bell pepper and potato dumplings (14,18)\tPrincess beans (21)\t\t\t\t\t0,00\t1,55\t2,35\tc\t2\t\t14, 18, 21, 0\tRindfleisch, Fleisch aus artgerechter Tierhaltung, vegan, zusatzstoff- und allergenfrei\t-\tBrennwert=1889 kJ (451 kcal), Fett=6,4g, davon gesättigte Fettsäuren=2,8g, Kohlenhydrate=59,3g, davon Zucker=5,7g, Ballaststoffe=0,8g, Eiweiß=31,0g, Salz=6,4g,\nMensa Lingen\t25.01.2022\t2130\t10190\tKM 4 Fleisch/Fisc,+1,55 €\tHauptgericht\t1571\tRindergulasch mit Paprika und Kartoffelklößchen (14,18)\tDelikatessbohnen (21)\t\t\t\t\tBeef goulash with bell pepper and potato dumplings (14,18)\tPrincess beans (21)\t\t\t\t\t0,00\t1,55\t2,35\tc\t2\t\t14, 18, 21, 0\tRindfleisch, Fleisch aus artgerechter Tierhaltung, vegan, zusatzstoff- und allergenfrei\t-\tBrennwert=1889 kJ (451 kcal), Fett=6,4g, davon gesättigte Fettsäuren=2,8g, Kohlenhydrate=59,3g, davon Zucker=5,7g, Ballaststoffe=0,8g, Eiweiß=31,0g, Salz=6,4g,\nMensa Schlossgarten\t25.01.2022\t1701\t3648\tStärkebeilage 3\tBeilagen\t525\t\t\t\t\t\t\t\t\t\t\t\t\t0,55\t1,05\t1,25\tc\t\t\t21, 0\tvegan, zusatzstoff- und allergenfrei\t-\t-\nMensa Schlossgarten\t25.01.2022\t2130\t10518\tKM 5 veget./vegan,+1,35 €\tHauptgericht\t3183\t\t\t\t\t\t\t\t\t\t\t\t\t1,00\t2,35\t3,15\tc\t\t\t21, 0\tvegan, zusatzstoff- und allergenfrei\t-\t-\nMensa Schlossgarten\t25.01.2022\t2130\t4389\tKM 2 Fleisch/Fisc,+1,55 €\tHauptgericht\t3143\tAvocado Pulled Chicken Burger mit Chili-Mayo und BBQ-Sauce (2,9,a,c,j,m,40)\t\t\t\t\t\tAvocado Pulled Chicken Burger with chili mayonnaise an BBQ sauce (2,9,a,c,j,m,40)\t\t\t\t\t\t3,60\t5,15\t5,95\tc\t\t\t2, 9, a, c, j, m, 40, 0\tmit Konservierungsstoff, mit Süßungsmitteln, Glutenhaltiges Getreide (a), Hühnerei (c), Senf (j), Sesam (m), Geflügel, zusatzstoff- und allergenfrei\t-\tBrennwert=2588 kJ (618 kcal), Fett=35,3g, davon gesättigte Fettsäuren=5,2g, Kohlenhydrate=38,1g, davon Zucker=13,0g, Ballaststoffe=5,4g, Eiweiß=34,4g, Salz=4,3g,\nMensa Schlossgarten\t25.01.2022\t1701\t3646\tGemüsebeilage 3/Tagessala\tTagessalat\t1239\tGurkensalat mit roten Zwiebeln (21,j)\t\t\t\t\t\tCucumber salad with red onions (21,j)\t\t\t\t\t\t0,50\t1,00\t1,20\ta\t\t\t21, j, 0\tvegan, Senf (j), zusatzstoff- und allergenfrei\t-\tBrennwert=358 kJ (85 kcal), Fett=5,2g, davon gesättigte Fettsäuren=0,4g, Kohlenhydrate=6,7g, davon Zucker=6,4g, Ballaststoffe=1,2g, Eiweiß=1,7g, Salz=1,5g,\nMensa Schlossgarten\t25.01.2022\t2130\t4388\tKM 1 veget./vegan,+1,35 €\tHauptgericht\t3145\tPoutine Tex Mex mit Limettenmayo (3,21,a,i,j,f)\t\t\t\t\t\tPoutine Tex Mex with lime mayo (3,21,a,i,j,f)\t\t\t\t\t\t2,00\t3,35\t4,15\tg\t\t\t21, a, i, j, f, 0\tvegan, Glutenhaltiges Getreide (a), Sellerie (i), Senf (j), Soja (f), zusatzstoff- und allergenfrei\t-\tBrennwert=4543 kJ (1085 kcal), Fett=71,3g, davon gesättigte Fettsäuren=10,2g, Kohlenhydrate=93,6g, davon Zucker=24,0g, Ballaststoffe=9,4g, Eiweiß=13,1g, Salz=3,2g,\nMensa Schlossgarten\t25.01.2022\t2097\t3665\tDessert 1\tDessert\t299\tPudding mit Mandelgeschmack (20,g,h)\tBrombeersauce\t\t\t\t\tPudding Pudding with almond flavor (20,g,h)\tBlackberry sauce\t\t\t\t\t0,40\t0,90\t1,10\tc\t\t\t20, g, h, 0\tvegetarisch, Milch und Laktose (g), Schalenfrüchte (Nüsse) (h), zusatzstoff- und allergenfrei\t-\tBrennwert=782 kJ (187 kcal), Fett=5,9g, davon gesättigte Fettsäuren=3,3g, Kohlenhydrate=27,7g, davon Zucker=19,2g, Ballaststoffe=0,7g, Eiweiß=5,2g, Salz=0,2g,\nMensa Schlossgarten\t25.01.2022\t2097\t3665\tDessert 1\tDessert\t251\tPudding mit Mandelgeschmack (20,g,h)\tBrombeersauce\t\t\t\t\tPudding Pudding with almond flavor (20,g,h)\tBlackberry sauce\t\t\t\t\t0,40\t0,90\t1,10\tc\t\t\t20, g, h, 0\tvegetarisch, Milch und Laktose (g), Schalenfrüchte (Nüsse) (h), zusatzstoff- und allergenfrei\t-\tBrennwert=782 kJ (187 kcal), Fett=5,9g, davon gesättigte Fettsäuren=3,3g, Kohlenhydrate=27,7g, davon Zucker=19,2g, Ballaststoffe=0,7g, Eiweiß=5,2g, Salz=0,2g,\nMensa Schlossgarten\t25.01.2022\t2130\t10190\tKM 4 Fleisch/Fisc,+1,55 €\tHauptgericht\t1571\tRindergulasch mit Paprika und Kartoffelklößchen (14,18)\tDelikatessbohnen (21)\t\t\t\t\tBeef goulash with bell pepper and potato dumplings (14,18)\tPrincess beans (21)\t\t\t\t\t0,00\t1,55\t2,35\tc\t\t\t14, 18, 21, 0\tRindfleisch, Fleisch aus artgerechter Tierhaltung, vegan, zusatzstoff- und allergenfrei\t-\tBrennwert=1891 kJ (452 kcal), Fett=6,4g, davon gesättigte Fettsäuren=2,8g, Kohlenhydrate=59,4g, davon Zucker=5,7g, Ballaststoffe=0,9g, Eiweiß=31,1g, Salz=6,4g,\nMensa Schlossgarten\t25.01.2022\t2130\t10190\tKM 4 Fleisch/Fisc,+1,55 €\tHauptgericht\t66\tRindergulasch mit Paprika und Kartoffelklößchen (14,18)\tDelikatessbohnen (21)\t\t\t\t\tBeef goulash with bell pepper and potato dumplings (14,18)\tPrincess beans (21)\t\t\t\t\t0,00\t1,55\t2,35\tc\t\t\t14, 18, 21, 0\tRindfleisch, Fleisch aus artgerechter Tierhaltung, vegan, zusatzstoff- und allergenfrei\t-\tBrennwert=1891 kJ (452 kcal), Fett=6,4g, davon gesättigte Fettsäuren=2,8g, Kohlenhydrate=59,4g, davon Zucker=5,7g, Ballaststoffe=0,9g, Eiweiß=31,1g, Salz=6,4g,\nMensa Vechta\t25.01.2022\t2130\t4388\tKM 1 veget./vegan,+1,35 €\tHauptgericht\t2313\tCouscous mit Datteln und Mandeln (16,21,a,h)\tMinzcremedip (17,21,f)\t\t\t\t\tCouscous with dates and almonds (16,21,a,h)\tMint cream dip (17,21,f)\t\t\t\t\t2,00\t3,35\t4,15\tg\t2\t\t16, 17, 21, a, h, f, 0\tKlimaTeller, Knoblauch, vegan, Glutenhaltiges Getreide (a), Schalenfrüchte (Nüsse) (h), Soja (f), zusatzstoff- und allergenfrei\t-\tBrennwert=2491 kJ (595 kcal), Fett=16,9g, davon gesättigte Fettsäuren=1,7g, Kohlenhydrate=86,4g, davon Zucker=19,9g, Ballaststoffe=7,6g, Eiweiß=17,7g, Salz=6,4g,\nMensa Vechta\t25.01.2022\t2130\t10190\tKM 4 Fleisch/Fisc,+1,55 €\tHauptgericht\t22\tJägerschnitzel (1,3,13,17,a,c,g)\tKroketten (21,a)\t\t\t\t\tPork cutlet with mushroom sauce (1,3,13,17,a,c,g)\tCroquettes (21,a)\t\t\t\t\t0,00\t1,55\t2,35\tc\t2\t\t1, 3, 13, 17, 21, 22, a, c, g, 0\tmit Farbstoff, mit Antioxidationsmittel, Schweinefleisch, Knoblauch, vegan, nicht vegan/vegetarisch (tierische Hilfsstoffe), Glutenhaltiges Getreide (a), Hühnerei (c), Milch und Laktose (g), zusatzstoff- und allergenfrei\t-\tBrennwert=2336 kJ (558 kcal), Fett=31,3g, davon gesättigte Fettsäuren=4,5g, Kohlenhydrate=40,4g, davon Zucker=3,7g, Ballaststoffe=1,9g, Eiweiß=28,2g, Salz=5,7g,\nMensa Vechta\t25.01.2022\t2130\t4389\tKM 2 Fleisch/Fisc,+1,55 €\tHauptgericht\t3143\t\t\t\t\t\t\t\t\t\t\t\t\t2,45\t4,00\t4,80\ta\t2\t\t2, 3, 9, a, c, b, j, m, 0\tmit Konservierungsstoff, mit Antioxidationsmittel, mit Süßungsmitteln, Glutenhaltiges Getreide (a), Hühnerei (c), Krebstiere (b), Senf (j), Sesam (m), zusatzstoff- und allergenfrei\t-\tBrennwert=2783 kJ (665 kcal), Fett=46,1g, davon gesättigte Fettsäuren=5,0g, Kohlenhydrate=38,8g, davon Zucker=13,7g, Ballaststoffe=10,9g, Eiweiß=19,3g, Salz=2,9g,\nMensa Vechta\t25.01.2022\t2130\t4388\tKM 1 veget./vegan,+1,35 €\tHauptgericht\t2893\tCouscous mit Datteln und Mandeln (16,21,a,h)\tMinzcremedip (17,21,f)\t\t\t\t\tCouscous with dates and almonds (16,21,a,h)\tMint cream dip (17,21,f)\t\t\t\t\t2,00\t3,35\t4,15\tg\t2\t\t16, 17, 21, a, h, f, 0\tKlimaTeller, Knoblauch, vegan, Glutenhaltiges Getreide (a), Schalenfrüchte (Nüsse) (h), Soja (f), zusatzstoff- und allergenfrei\t-\tBrennwert=2491 kJ (595 kcal), Fett=16,9g, davon gesättigte Fettsäuren=1,7g, Kohlenhydrate=86,4g, davon Zucker=19,9g, Ballaststoffe=7,6g, Eiweiß=17,7g, Salz=6,4g,\nMensa Vechta\t25.01.2022\t2130\t10190\tKM 4 Fleisch/Fisc,+1,55 €\tHauptgericht\t1244\tJägerschnitzel (1,3,13,17,a,c,g)\tKroketten (21,a)\t\t\t\t\tPork cutlet with mushroom sauce (1,3,13,17,a,c,g)\tCroquettes (21,a)\t\t\t\t\t0,00\t1,55\t2,35\tc\t2\t\t1, 3, 13, 17, 21, 22, a, c, g, 0\tmit Farbstoff, mit Antioxidationsmittel, Schweinefleisch, Knoblauch, vegan, nicht vegan/vegetarisch (tierische Hilfsstoffe), Glutenhaltiges Getreide (a), Hühnerei (c), Milch und Laktose (g), zusatzstoff- und allergenfrei\t-\tBrennwert=2336 kJ (558 kcal), Fett=31,3g, davon gesättigte Fettsäuren=4,5g, Kohlenhydrate=40,4g, davon Zucker=3,7g, Ballaststoffe=1,9g, Eiweiß=28,2g, Salz=5,7g,\nMensa Vechta\t25.01.2022\t1701\t3648\tStärkebeilage 3\tBeilagen\t525\tPommes frites klein (21)\t\t\t\t\t\tPommes frites small (21)\t\t\t\t\t\t0,55\t1,05\t1,25\tc\t2\t\t21, 0\tvegan, zusatzstoff- und allergenfrei\t-\tBrennwert=1097 kJ (262 kcal), Fett=12,1g, davon gesättigte Fettsäuren=4,4g, Kohlenhydrate=33,0g, davon Zucker=0,8g, Ballaststoffe=3,0g, Eiweiß=3,8g, Salz=1,0g,\nMensa Vechta\t25.01.2022\t2130\t10518\tKM 5 veget./vegan,+1,35 €\tHauptgericht\t3183\tPommes frites groß (21)\t\t\t\t\t\tPommes frites large (21)\t\t\t\t\t\t1,00\t2,35\t3,15\tc\t2\t\t21, 0\tvegan, zusatzstoff- und allergenfrei\t-\tBrennwert=2194 kJ (524 kcal), Fett=24,2g, davon gesättigte Fettsäuren=8,8g, Kohlenhydrate=66,0g, davon Zucker=1,5g, Ballaststoffe=6,0g, Eiweiß=7,5g, Salz=1,6g,\nMensa Westerberg\t25.01.2022\t2130\t4389\tKM 2 Fleisch/Fisc,+1,55 €\tHauptgericht\t2916\tAvocado Beat Burger mit Buffalo-Insekten, Chili-Mayo und BBQ-Sauce (2,3,9,a,c,b,j,m)\t\t\t\t\t\tAvocado Beat Burger with buffalo insects, chili mayonnaise an BBQ sauce (2,3,9,a,c,b,j,m)\t\t\t\t\t\t3,60\t5,15\t5,95\ta\t\t\t2, 3, 9, a, c, b, j, m, 0\tmit Konservierungsstoff, mit Antioxidationsmittel, mit Süßungsmitteln, Glutenhaltiges Getreide (a), Hühnerei (c), Krebstiere (b), Senf (j), Sesam (m), zusatzstoff- und allergenfrei\t-\tBrennwert=2787 kJ (666 kcal), Fett=46,1g, davon gesättigte Fettsäuren=5,0g, Kohlenhydrate=38,9g, davon Zucker=13,8g, Ballaststoffe=11,0g, Eiweiß=19,4g, Salz=3,1g,\nMensa Westerberg\t25.01.2022\t1701\t3648\tStärkebeilage 3\tBeilagen\t525\tPommes frites klein (21)\t\t\t\t\t\tPommes frites small (21)\t\t\t\t\t\t0,55\t1,05\t1,25\tc\t\t\t21, 0\tvegan, zusatzstoff- und allergenfrei\t-\tBrennwert=1097 kJ (262 kcal), Fett=12,1g, davon gesättigte Fettsäuren=4,4g, Kohlenhydrate=33,0g, davon Zucker=0,8g, Ballaststoffe=3,0g, Eiweiß=3,8g, Salz=1,0g,\nMensa Westerberg\t25.01.2022\t2130\t10190\tKM 4 Fleisch/Fisc,+1,55 €\tHauptgericht\t1571\tRindergulasch mit Paprika und Kartoffelklößchen (14,18)\tDelikatessbohnen (21)\t\t\t\t\tBeef goulash with bell pepper and potato dumplings (14,18)\tPrincess beans (21)\t\t\t\t\t0,00\t1,55\t2,35\tc\t\t\t14, 18, 21, 0\tRindfleisch, Fleisch aus artgerechter Tierhaltung, vegan, zusatzstoff- und allergenfrei\t-\tBrennwert=1890 kJ (451 kcal), Fett=6,4g, davon gesättigte Fettsäuren=2,8g, Kohlenhydrate=59,4g, davon Zucker=5,7g, Ballaststoffe=0,9g, Eiweiß=31,1g, Salz=6,4g,\nMensa Westerberg\t25.01.2022\t2130\t10190\tKM 4 Fleisch/Fisc,+1,55 €\tHauptgericht\t66\tRindergulasch mit Paprika und Kartoffelklößchen (14,18)\tDelikatessbohnen (21)\t\t\t\t\tBeef goulash with bell pepper and potato dumplings (14,18)\tPrincess beans (21)\t\t\t\t\t0,00\t1,55\t2,35\tc\t\t\t14, 18, 21, 0\tRindfleisch, Fleisch aus artgerechter Tierhaltung, vegan, zusatzstoff- und allergenfrei\t-\tBrennwert=1890 kJ (451 kcal), Fett=6,4g, davon gesättigte Fettsäuren=2,8g, Kohlenhydrate=59,4g, davon Zucker=5,7g, Ballaststoffe=0,9g, Eiweiß=31,1g, Salz=6,4g,\nMensa Westerberg\t25.01.2022\t2097\t3665\tDessert 1\tDessert\t251\tPudding mit Mandelgeschmack (20,g,h)\tBrombeersauce\t\t\t\t\tPudding Pudding with almond flavor (20,g,h)\tBlackberry sauce\t\t\t\t\t0,40\t0,90\t1,10\tc\t\t\t20, g, h, 0\tvegetarisch, Milch und Laktose (g), Schalenfrüchte (Nüsse) (h), zusatzstoff- und allergenfrei\t-\tBrennwert=783 kJ (187 kcal), Fett=5,9g, davon gesättigte Fettsäuren=3,3g, Kohlenhydrate=27,8g, davon Zucker=19,2g, Ballaststoffe=0,7g, Eiweiß=5,2g, Salz=0,2g,\nMensa Westerberg\t25.01.2022\t2097\t3665\tDessert 1\tDessert\t299\tPudding mit Mandelgeschmack (20,g,h)\tBrombeersauce\t\t\t\t\tPudding Pudding with almond flavor (20,g,h)\tBlackberry sauce\t\t\t\t\t0,40\t0,90\t1,10\tc\t\t\t20, g, h, 0\tvegetarisch, Milch und Laktose (g), Schalenfrüchte (Nüsse) (h), zusatzstoff- und allergenfrei\t-\tBrennwert=783 kJ (187 kcal), Fett=5,9g, davon gesättigte Fettsäuren=3,3g, Kohlenhydrate=27,8g, davon Zucker=19,2g, Ballaststoffe=0,7g, Eiweiß=5,2g, Salz=0,2g,\nMensa Westerberg\t25.01.2022\t1701\t3646\tGemüsebeilage 3/Tagessala\tTagessalat\t1239\tGurkensalat mit roten Zwiebeln (21,j)\t\t\t\t\t\tCucumber salad with red onions (21,j)\t\t\t\t\t\t0,50\t1,00\t1,20\ta\t\t\t21, j, 0\tvegan, Senf (j), zusatzstoff- und allergenfrei\t-\tBrennwert=359 kJ (86 kcal), Fett=5,2g, davon gesättigte Fettsäuren=0,4g, Kohlenhydrate=6,7g, davon Zucker=6,4g, Ballaststoffe=1,2g, Eiweiß=1,7g, Salz=1,6g,\nMensa Westerberg\t25.01.2022\t2130\t4389\tKM 2 Fleisch/Fisc,+1,55 €\tHauptgericht\t3143\tAvocado Beat Burger mit Buffalo-Insekten, Chili-Mayo und BBQ-Sauce (2,3,9,a,c,b,j,m)\t\t\t\t\t\tAvocado Beat Burger with buffalo insects, chili mayonnaise an BBQ sauce (2,3,9,a,c,b,j,m)\t\t\t\t\t\t3,60\t5,15\t5,95\ta\t\t\t2, 3, 9, a, c, b, j, m, 0\tmit Konservierungsstoff, mit Antioxidationsmittel, mit Süßungsmitteln, Glutenhaltiges Getreide (a), Hühnerei (c), Krebstiere (b), Senf (j), Sesam (m), zusatzstoff- und allergenfrei\t-\tBrennwert=2787 kJ (666 kcal), Fett=46,1g, davon gesättigte Fettsäuren=5,0g, Kohlenhydrate=38,9g, davon Zucker=13,8g, Ballaststoffe=11,0g, Eiweiß=19,4g, Salz=3,1g,\nMensa Westerberg\t25.01.2022\t2130\t4388\tKM 1 veget./vegan,+1,35 €\tHauptgericht\t3145\tPoutine Tex Mex mit Limettenmayo (3,21,a,i,j,f)\t\t\t\t\t\tPoutine Tex Mex with lime mayo (3,21,a,i,j,f)\t\t\t\t\t\t2,00\t3,35\t4,15\tg\t\t\t21, a, i, j, f, 0\tvegan, Glutenhaltiges Getreide (a), Sellerie (i), Senf (j), Soja (f), zusatzstoff- und allergenfrei\t-\tBrennwert=4543 kJ (1085 kcal), Fett=71,3g, davon gesättigte Fettsäuren=10,2g, Kohlenhydrate=93,6g, davon Zucker=24,0g, Ballaststoffe=9,4g, Eiweiß=13,1g, Salz=3,2g,\nMensa Westerberg\t25.01.2022\t2130\t10518\tKM 5 veget./vegan,+1,35 €\tHauptgericht\t3183\tPommes frites groß (21)\t\t\t\t\t\tPommes frites large (21)\t\t\t\t\t\t1,00\t2,35\t3,15\tc\t\t\t21, 0\tvegan, zusatzstoff- und allergenfrei\t-\tBrennwert=2194 kJ (524 kcal), Fett=24,2g, davon gesättigte Fettsäuren=8,8g, Kohlenhydrate=66,0g, davon Zucker=1,5g, Ballaststoffe=6,0g, Eiweiß=7,5g, Salz=1,6g,\nMensa Haste\t26.01.2022\t2130\t10518\tKM 5 veget./vegan,+1,35 €\tHauptgericht\t3183\tPommes frites groß (21)\t\t\t\t\t\tPommes frites large (21)\t\t\t\t\t\t1,00\t2,35\t3,15\tc\t2\t\t21, 0\tvegan, zusatzstoff- und allergenfrei\t-\tBrennwert=2194 kJ (524 kcal), Fett=24,2g, davon gesättigte Fettsäuren=8,8g, Kohlenhydrate=66,0g, davon Zucker=1,5g, Ballaststoffe=6,0g, Eiweiß=7,5g, Salz=1,6g,\nMensa Haste\t26.01.2022\t2130\t6510\tKM 3 veget./vegan,+1,35 €\tHauptgericht\t3152\tMexikanische Kartoffel Bowl mit roter Paprika, Kidneybohnen, Peperoni, Cheddar und Tortilla-Chips (1,20,g)\t\t\t\t\t\tMexican Potato Bowl with red bell pepper, kidney beans, peppers, cheddar and tortilla chips (1,20,g)\t\t\t\t\t\t2,80\t4,15\t4,95\tc\t2\t\t1, 20, g, 0\tmit Farbstoff, vegetarisch, Milch und Laktose (g), zusatzstoff- und allergenfrei\t-\tBrennwert=2818 kJ (673 kcal), Fett=34,6g, davon gesättigte Fettsäuren=17,8g, Kohlenhydrate=55,6g, davon Zucker=10,4g, Ballaststoffe=6,8g, Eiweiß=27,2g, Salz=2,9g,\nMensa Haste\t26.01.2022\t2130\t4388\tKM 1 veget./vegan,+1,35 €\tHauptgericht\t2946\tBBQ Burger \"Pulled Jack\" mit Jackfruit, Rotkohl, gegrillter Paprika, Gurken, Zwiebeln und Cashews (3,16,17,21,a,h,k,j)\t\t\t\t\t\tBBBQ Burger \"Pulled Jack\" with jackfruit, red cabbage, grilled peppers, cucumbers, onions and cashew (3,16,17,21,a,h,k,j)\t\t\t\t\t\t3,60\t4,95\t5,75\tg\t2\t\t3, 16, 17, 21, a, h, k, j, 0\tmit Antioxidationsmittel, KlimaTeller, Knoblauch, vegan, Glutenhaltiges Getreide (a), Schalenfrüchte (Nüsse) (h), Schwefeldioxid u. Sulfite (k), Senf (j), zusatzstoff- und allergenfrei\t-\tBrennwert=3797 kJ (907 kcal), Fett=59,2g, davon gesättigte Fettsäuren=6,9g, Kohlenhydrate=77,2g, davon Zucker=21,1g, Ballaststoffe=4,2g, Eiweiß=15,0g, Salz=6,2g,\nMensa Haste\t26.01.2022\t1701\t3648\tStärkebeilage 3\tBeilagen\t525\tPommes frites klein (21)\t\t\t\t\t\tPommes frites small (21)\t\t\t\t\t\t0,55\t1,05\t1,25\tc\t2\t\t21, 0\tvegan, zusatzstoff- und allergenfrei\t-\tBrennwert=1097 kJ (262 kcal), Fett=12,1g, davon gesättigte Fettsäuren=4,4g, Kohlenhydrate=33,0g, davon Zucker=0,8g, Ballaststoffe=3,0g, Eiweiß=3,8g, Salz=1,0g,\nMensa Haste\t26.01.2022\t1714\t3614\tEintopf (Terrine, Teller)\tEintopf Terrine\t2045\tChili con Carne vom Bio-Rind (2,3,14)\tWeizenbrötchen (1,21,a,f)\t\t\t\t\tChili con carne with organic minced beef (2,3,14)\tBread roll (1,21,a,f)\t\t\t\t\t1,80\t3,40\t4,20\tc\t2\t\t1, 2, 14, 21, a, f, 0\tmit Farbstoff, mit Konservierungsstoff, Rindfleisch, vegan, Glutenhaltiges Getreide (a), Soja (f), zusatzstoff- und allergenfrei\t-\tBrennwert=3418 kJ (816 kcal), Fett=31,5g, davon gesättigte Fettsäuren=8,8g, Kohlenhydrate=95,3g, davon Zucker=13,2g, Ballaststoffe=6,4g, Eiweiß=32,4g, Salz=7,6g,\nMensa Haste\t26.01.2022\t1714\t3614\tEintopf (Terrine, Teller)\tEintopf Terrine\t173\tChili con Carne vom Bio-Rind (2,3,14)\tWeizenbrötchen (1,21,a,f)\t\t\t\t\tChili con carne with organic minced beef (2,3,14)\tBread roll (1,21,a,f)\t\t\t\t\t1,80\t3,40\t4,20\tc\t2\t\t1, 2, 14, 21, a, f, 0\tmit Farbstoff, mit Konservierungsstoff, Rindfleisch, vegan, Glutenhaltiges Getreide (a), Soja (f), zusatzstoff- und allergenfrei\t-\tBrennwert=3418 kJ (816 kcal), Fett=31,5g, davon gesättigte Fettsäuren=8,8g, Kohlenhydrate=95,3g, davon Zucker=13,2g, Ballaststoffe=6,4g, Eiweiß=32,4g, Salz=7,6g,\nMensa Lingen\t26.01.2022\t1714\t3614\tEintopf (Terrine, Teller)\tEintopf Terrine\t2045\tChili con Carne vom Bio-Rind (2,3,14)\tWeizenbrötchen (1,21,a,f)\t\t\t\t\tChili con carne with organic minced beef (2,3,14)\tBread roll (1,21,a,f)\t\t\t\t\t1,80\t3,40\t4,20\tc\t2\t\t1, 2, 14, 21, a, f, 0\tmit Farbstoff, mit Konservierungsstoff, Rindfleisch, vegan, Glutenhaltiges Getreide (a), Soja (f), zusatzstoff- und allergenfrei\t-\tBrennwert=3412 kJ (815 kcal), Fett=31,5g, davon gesättigte Fettsäuren=8,8g, Kohlenhydrate=95,1g, davon Zucker=13,1g, Ballaststoffe=6,3g, Eiweiß=32,3g, Salz=7,6g,\nMensa Lingen\t26.01.2022\t1714\t3614\tEintopf (Terrine, Teller)\tEintopf Terrine\t173\tChili con Carne vom Bio-Rind (2,3,14)\tWeizenbrötchen (1,21,a,f)\t\t\t\t\tChili con carne with organic minced beef (2,3,14)\tBread roll (1,21,a,f)\t\t\t\t\t1,80\t3,40\t4,20\tc\t2\t\t1, 2, 14, 21, a, f, 0\tmit Farbstoff, mit Konservierungsstoff, Rindfleisch, vegan, Glutenhaltiges Getreide (a), Soja (f), zusatzstoff- und allergenfrei\t-\tBrennwert=3412 kJ (815 kcal), Fett=31,5g, davon gesättigte Fettsäuren=8,8g, Kohlenhydrate=95,1g, davon Zucker=13,1g, Ballaststoffe=6,3g, Eiweiß=32,3g, Salz=7,6g,\nMensa Lingen\t26.01.2022\t2130\t6510\tKM 3 veget./vegan,+1,35 €\tHauptgericht\t3152\tMexikanische Kartoffel Bowl mit roter Paprika, Kidneybohnen, Peperoni, Cheddar und Tortilla-Chips (1,20,g)\t\t\t\t\t\tMexican Potato Bowl with red bell pepper, kidney beans, peppers, cheddar and tortilla chips (1,20,g)\t\t\t\t\t\t2,80\t4,15\t4,95\tc\t2\t\t1, 20, g, 0\tmit Farbstoff, vegetarisch, Milch und Laktose (g), zusatzstoff- und allergenfrei\t-\tBrennwert=2806 kJ (670 kcal), Fett=34,3g, davon gesättigte Fettsäuren=17,7g, Kohlenhydrate=55,5g, davon Zucker=10,4g, Ballaststoffe=6,8g, Eiweiß=27,2g, Salz=2,7g,\nMensa Lingen\t26.01.2022\t2130\t4388\tKM 1 veget./vegan,+1,35 €\tHauptgericht\t2946\tBBQ Burger \"Pulled Jack\" mit Jackfruit, Rotkohl, gegrillter Paprika, Gurken, Zwiebeln und Cashews (3,16,17,21,a,h,k,j)\t\t\t\t\t\tBBBQ Burger \"Pulled Jack\" with jackfruit, red cabbage, grilled peppers, cucumbers, onions and cashew (3,16,17,21,a,h,k,j)\t\t\t\t\t\t3,60\t4,95\t5,75\tg\t2\t\t3, 16, 17, 21, a, h, k, j, 0\tmit Antioxidationsmittel, KlimaTeller, Knoblauch, vegan, Glutenhaltiges Getreide (a), Schalenfrüchte (Nüsse) (h), Schwefeldioxid u. Sulfite (k), Senf (j), zusatzstoff- und allergenfrei\t-\tBrennwert=3797 kJ (907 kcal), Fett=59,2g, davon gesättigte Fettsäuren=6,9g, Kohlenhydrate=77,2g, davon Zucker=21,1g, Ballaststoffe=4,2g, Eiweiß=15,0g, Salz=6,2g,\nMensa Lingen\t26.01.2022\t2130\t10518\tKM 5 veget./vegan,+1,35 €\tHauptgericht\t3183\tPommes frites groß (21)\t\t\t\t\t\tPommes frites large (21)\t\t\t\t\t\t1,00\t2,35\t3,15\tc\t2\t\t21, 0\tvegan, zusatzstoff- und allergenfrei\t-\tBrennwert=2194 kJ (524 kcal), Fett=24,2g, davon gesättigte Fettsäuren=8,8g, Kohlenhydrate=66,0g, davon Zucker=1,5g, Ballaststoffe=6,0g, Eiweiß=7,5g, Salz=1,6g,\nMensa Lingen\t26.01.2022\t1701\t3648\tStärkebeilage 3\tBeilagen\t525\tPommes frites klein (21)\t\t\t\t\t\tPommes frites small (21)\t\t\t\t\t\t0,55\t1,05\t1,25\tc\t2\t\t21, 0\tvegan, zusatzstoff- und allergenfrei\t-\tBrennwert=1097 kJ (262 kcal), Fett=12,1g, davon gesättigte Fettsäuren=4,4g, Kohlenhydrate=33,0g, davon Zucker=0,8g, Ballaststoffe=3,0g, Eiweiß=3,8g, Salz=1,0g,\nMensa Schlossgarten\t26.01.2022\t1714\t3614\tEintopf (Terrine, Teller)\tEintopf Terrine\t2045\tChili con Carne vom Bio-Rind (2,3,14)\tWeizenbrötchen (1,21,a,f)\t\t\t\t\tChili con carne with organic minced beef (2,3,14)\tBread roll (1,21,a,f)\t\t\t\t\t1,80\t3,40\t4,20\tc\t\t\t1, 2, 14, 21, a, f, 0\tmit Farbstoff, mit Konservierungsstoff, Rindfleisch, vegan, Glutenhaltiges Getreide (a), Soja (f), zusatzstoff- und allergenfrei\t-\tBrennwert=3416 kJ (816 kcal), Fett=31,5g, davon gesättigte Fettsäuren=8,8g, Kohlenhydrate=95,3g, davon Zucker=13,1g, Ballaststoffe=6,4g, Eiweiß=32,4g, Salz=7,6g,\nMensa Schlossgarten\t26.01.2022\t2097\t3665\tDessert 1\tDessert\t2378\tBio-Milchreis (19,20,23,g)\tZimt und Zucker (19,21)\t\t\t\t\tOrganic rice pudding (19,20,23,g)\tCinnamon and sugar (19,21)\t\t\t\t\t0,70\t1,20\t1,40\tc\t\t\t19, 20, 21, 23, g, 0\tBio-Erzeugnis DE-ÖKO-039, vegetarisch, vegan, Bio-Menü, Milch und Laktose (g), zusatzstoff- und allergenfrei\t-\tBrennwert=1054 kJ (252 kcal), Fett=4,3g, davon gesättigte Fettsäuren=2,7g, Kohlenhydrate=48,9g, davon Zucker=35,7g, Ballaststoffe=2,9g, Eiweiß=5,0g, Salz=0,3g,\nMensa Schlossgarten\t26.01.2022\t1714\t3614\tEintopf (Terrine, Teller)\tEintopf Terrine\t173\tChili con Carne vom Bio-Rind (2,3,14)\tWeizenbrötchen (1,21,a,f)\t\t\t\t\tChili con carne with organic minced beef (2,3,14)\tBread roll (1,21,a,f)\t\t\t\t\t1,80\t3,40\t4,20\tc\t\t\t1, 2, 14, 21, a, f, 0\tmit Farbstoff, mit Konservierungsstoff, Rindfleisch, vegan, Glutenhaltiges Getreide (a), Soja (f), zusatzstoff- und allergenfrei\t-\tBrennwert=3416 kJ (816 kcal), Fett=31,5g, davon gesättigte Fettsäuren=8,8g, Kohlenhydrate=95,3g, davon Zucker=13,1g, Ballaststoffe=6,4g, Eiweiß=32,4g, Salz=7,6g,\nMensa Schlossgarten\t26.01.2022\t2097\t3665\tDessert 1\tDessert\t1903\tBio-Milchreis (19,20,23,g)\tZimt und Zucker (19,21)\t\t\t\t\tOrganic rice pudding (19,20,23,g)\tCinnamon and sugar (19,21)\t\t\t\t\t0,70\t1,20\t1,40\tc\t\t\t19, 20, 21, 23, g, 0\tBio-Erzeugnis DE-ÖKO-039, vegetarisch, vegan, Bio-Menü, Milch und Laktose (g), zusatzstoff- und allergenfrei\t-\tBrennwert=1054 kJ (252 kcal), Fett=4,3g, davon gesättigte Fettsäuren=2,7g, Kohlenhydrate=48,9g, davon Zucker=35,7g, Ballaststoffe=2,9g, Eiweiß=5,0g, Salz=0,3g,\nMensa Schlossgarten\t26.01.2022\t1701\t3648\tStärkebeilage 3\tBeilagen\t525\t\t\t\t\t\t\t\t\t\t\t\t\t0,55\t1,05\t1,25\tc\t\t\t21, 0\tvegan, zusatzstoff- und allergenfrei\t-\t-\nMensa Schlossgarten\t26.01.2022\t2130\t10518\tKM 5 veget./vegan,+1,35 €\tHauptgericht\t3183\t\t\t\t\t\t\t\t\t\t\t\t\t1,00\t2,35\t3,15\tc\t\t\t21, 0\tvegan, zusatzstoff- und allergenfrei\t-\t-\nMensa Schlossgarten\t26.01.2022\t2130\t4388\tKM 1 veget./vegan,+1,35 €\tHauptgericht\t2946\tBBQ Burger \"Pulled Jack\" mit Jackfruit, Rotkohl, gegrillter Paprika, Gurken, Zwiebeln und Cashews (3,16,17,21,a,h,k,j)\t\t\t\t\t\tBBBQ Burger \"Pulled Jack\" with jackfruit, red cabbage, grilled peppers, cucumbers, onions and cashew (3,16,17,21,a,h,k,j)\t\t\t\t\t\t3,60\t4,95\t5,75\tg\t\t\t3, 16, 17, 21, a, h, k, j, 0\tmit Antioxidationsmittel, KlimaTeller, Knoblauch, vegan, Glutenhaltiges Getreide (a), Schalenfrüchte (Nüsse) (h), Schwefeldioxid u. Sulfite (k), Senf (j), zusatzstoff- und allergenfrei\t-\tBrennwert=3788 kJ (905 kcal), Fett=59,2g, davon gesättigte Fettsäuren=6,9g, Kohlenhydrate=77,0g, davon Zucker=21,1g, Ballaststoffe=4,0g, Eiweiß=14,9g, Salz=6,2g,\nMensa Schlossgarten\t26.01.2022\t2130\t6510\tKM 3 veget./vegan,+1,35 €\tHauptgericht\t3152\tMexikanische Kartoffel Bowl mit roter Paprika, Kidneybohnen, Peperoni, Cheddar und Tortilla-Chips (1,20,g)\t\t\t\t\t\tMexican Potato Bowl with red bell pepper, kidney beans, peppers, cheddar and tortilla chips (1,20,g)\t\t\t\t\t\t2,80\t4,15\t4,95\tc\t\t\t1, 20, g, 0\tmit Farbstoff, vegetarisch, Milch und Laktose (g), zusatzstoff- und allergenfrei\t-\tBrennwert=2806 kJ (670 kcal), Fett=34,3g, davon gesättigte Fettsäuren=17,7g, Kohlenhydrate=55,5g, davon Zucker=10,4g, Ballaststoffe=6,8g, Eiweiß=27,2g, Salz=2,7g,\nMensa Schlossgarten\t26.01.2022\t1701\t3646\tGemüsebeilage 3/Tagessala\tTagessalat\t493\tBio-Möhrensalat (19,21,23)\t\t\t\t\t\tOrganic carrot salad (19,21,23)\t\t\t\t\t\t0,55\t1,05\t1,25\ta\t\t\t19, 21, 23, 0\tBio-Erzeugnis DE-ÖKO-039, vegan, Bio-Menü, zusatzstoff- und allergenfrei\t-\tBrennwert=516 kJ (123 kcal), Fett=4,6g, davon gesättigte Fettsäuren=0,5g, Kohlenhydrate=15,2g, davon Zucker=15,2g, Ballaststoffe=5,4g, Eiweiß=1,6g, Salz=0,2g,\nMensa Vechta\t26.01.2022\t1701\t3648\tStärkebeilage 3\tBeilagen\t525\tPommes frites klein (21)\t\t\t\t\t\tPommes frites small (21)\t\t\t\t\t\t0,55\t1,05\t1,25\tc\t2\t\t21, 0\tvegan, zusatzstoff- und allergenfrei\t-\tBrennwert=1097 kJ (262 kcal), Fett=12,1g, davon gesättigte Fettsäuren=4,4g, Kohlenhydrate=33,0g, davon Zucker=0,8g, Ballaststoffe=3,0g, Eiweiß=3,8g, Salz=1,0g,\nMensa Vechta\t26.01.2022\t2130\t6510\tKM 3 veget./vegan,+1,35 €\tHauptgericht\t3152\tMexikanische Kartoffel Bowl mit roter Paprika, Kidneybohnen, Peperoni, Cheddar und Tortilla-Chips (1,20,g)\t\t\t\t\t\tMexican Potato Bowl with red bell pepper, kidney beans, peppers, cheddar and tortilla chips (1,20,g)\t\t\t\t\t\t2,80\t4,15\t4,95\tc\t2\t\t1, 20, g, 0\tmit Farbstoff, vegetarisch, Milch und Laktose (g), zusatzstoff- und allergenfrei\t-\tBrennwert=2811 kJ (671 kcal), Fett=34,5g, davon gesättigte Fettsäuren=17,7g, Kohlenhydrate=55,5g, davon Zucker=10,4g, Ballaststoffe=6,9g, Eiweiß=27,2g, Salz=2,7g,\nMensa Vechta\t26.01.2022\t2130\t4388\tKM 1 veget./vegan,+1,35 €\tHauptgericht\t2946\tBBQ Burger \"Pulled Jack\" mit Jackfruit, Rotkohl, gegrillter Paprika, Gurken, Zwiebeln und Cashews (3,16,17,21,a,h,k,j)\t\t\t\t\t\tBBBQ Burger \"Pulled Jack\" with jackfruit, red cabbage, grilled peppers, cucumbers, onions and cashew (3,16,17,21,a,h,k,j)\t\t\t\t\t\t3,60\t4,95\t5,75\tg\t2\t\t3, 16, 17, 21, a, h, k, j, 0\tmit Antioxidationsmittel, KlimaTeller, Knoblauch, vegan, Glutenhaltiges Getreide (a), Schalenfrüchte (Nüsse) (h), Schwefeldioxid u. Sulfite (k), Senf (j), zusatzstoff- und allergenfrei\t-\tBrennwert=3789 kJ (905 kcal), Fett=59,2g, davon gesättigte Fettsäuren=6,9g, Kohlenhydrate=77,0g, davon Zucker=21,1g, Ballaststoffe=4,0g, Eiweiß=14,9g, Salz=6,2g,\nMensa Vechta\t26.01.2022\t2130\t10518\tKM 5 veget./vegan,+1,35 €\tHauptgericht\t3183\tPommes frites groß (21)\t\t\t\t\t\tPommes frites large (21)\t\t\t\t\t\t1,00\t2,35\t3,15\tc\t2\t\t21, 0\tvegan, zusatzstoff- und allergenfrei\t-\tBrennwert=2194 kJ (524 kcal), Fett=24,2g, davon gesättigte Fettsäuren=8,8g, Kohlenhydrate=66,0g, davon Zucker=1,5g, Ballaststoffe=6,0g, Eiweiß=7,5g, Salz=1,6g,\nMensa Vechta\t26.01.2022\t1714\t3614\tEintopf (Terrine, Teller)\tEintopf Terrine\t2959\tChili con Carne vom Bio-Rind (2,14)\tFinnen-Baguette (21,a,f)\t\t\t\t\tChili con carne with organic minced beef (2,14)\tFinn baguette (21,a,f)\t\t\t\t\t1,80\t3,40\t4,20\tc\t2\t\t2, 14, 21, a, f, 0\tmit Konservierungsstoff, Rindfleisch, vegan, Glutenhaltiges Getreide (a), Soja (f), zusatzstoff- und allergenfrei\t-\tBrennwert=3399 kJ (812 kcal), Fett=35,4g, davon gesättigte Fettsäuren=9,1g, Kohlenhydrate=85,1g, davon Zucker=13,3g, Ballaststoffe=6,5g, Eiweiß=33,7g, Salz=7,4g,\nMensa Vechta\t26.01.2022\t1714\t3614\tEintopf (Terrine, Teller)\tEintopf Terrine\t173\tChili con Carne vom Bio-Rind (2,14)\tFinnen-Baguette (21,a,f)\t\t\t\t\tChili con carne with organic minced beef (2,14)\tFinn baguette (21,a,f)\t\t\t\t\t1,80\t3,40\t4,20\tc\t2\t\t2, 14, 21, a, f, 0\tmit Konservierungsstoff, Rindfleisch, vegan, Glutenhaltiges Getreide (a), Soja (f), zusatzstoff- und allergenfrei\t-\tBrennwert=3399 kJ (812 kcal), Fett=35,4g, davon gesättigte Fettsäuren=9,1g, Kohlenhydrate=85,1g, davon Zucker=13,3g, Ballaststoffe=6,5g, Eiweiß=33,7g, Salz=7,4g,\nMensa Westerberg\t26.01.2022\t2097\t3665\tDessert 1\tDessert\t2378\tBio-Milchreis (19,20,23,g)\tZimt und Zucker (19,21)\t\t\t\t\tOrganic rice pudding (19,20,23,g)\tCinnamon and sugar (19,21)\t\t\t\t\t0,70\t1,20\t1,40\tc\t\t\t19, 20, 21, 23, g, 0\tBio-Erzeugnis DE-ÖKO-039, vegetarisch, vegan, Bio-Menü, Milch und Laktose (g), zusatzstoff- und allergenfrei\t-\tBrennwert=1054 kJ (252 kcal), Fett=4,3g, davon gesättigte Fettsäuren=2,7g, Kohlenhydrate=48,9g, davon Zucker=35,7g, Ballaststoffe=2,9g, Eiweiß=5,0g, Salz=0,3g,\nMensa Westerberg\t26.01.2022\t2097\t3665\tDessert 1\tDessert\t1903\tBio-Milchreis (19,20,23,g)\tZimt und Zucker (19,21)\t\t\t\t\tOrganic rice pudding (19,20,23,g)\tCinnamon and sugar (19,21)\t\t\t\t\t0,70\t1,20\t1,40\tc\t\t\t19, 20, 21, 23, g, 0\tBio-Erzeugnis DE-ÖKO-039, vegetarisch, vegan, Bio-Menü, Milch und Laktose (g), zusatzstoff- und allergenfrei\t-\tBrennwert=1054 kJ (252 kcal), Fett=4,3g, davon gesättigte Fettsäuren=2,7g, Kohlenhydrate=48,9g, davon Zucker=35,7g, Ballaststoffe=2,9g, Eiweiß=5,0g, Salz=0,3g,\nMensa Westerberg\t26.01.2022\t1701\t3646\tGemüsebeilage 3/Tagessala\tTagessalat\t493\tBio-Möhrensalat (19,21,23)\t\t\t\t\t\tOrganic carrot salad (19,21,23)\t\t\t\t\t\t0,55\t1,05\t1,25\ta\t\t\t19, 21, 23, 0\tBio-Erzeugnis DE-ÖKO-039, vegan, Bio-Menü, zusatzstoff- und allergenfrei\t-\tBrennwert=516 kJ (123 kcal), Fett=4,6g, davon gesättigte Fettsäuren=0,5g, Kohlenhydrate=15,2g, davon Zucker=15,2g, Ballaststoffe=5,4g, Eiweiß=1,6g, Salz=0,2g,\nMensa Westerberg\t26.01.2022\t1714\t3614\tEintopf (Terrine, Teller)\tEintopf Terrine\t173\tChili con Carne vom Bio-Rind (2,3,14)\tWeizenbrötchen (1,21,a,f)\t\t\t\t\tChili con carne with organic minced beef (2,3,14)\tBread roll (1,21,a,f)\t\t\t\t\t1,80\t3,40\t4,20\tc\t\t\t1, 2, 14, 21, a, f, 0\tmit Farbstoff, mit Konservierungsstoff, Rindfleisch, vegan, Glutenhaltiges Getreide (a), Soja (f), zusatzstoff- und allergenfrei\t-\tBrennwert=3417 kJ (816 kcal), Fett=31,5g, davon gesättigte Fettsäuren=8,8g, Kohlenhydrate=95,3g, davon Zucker=13,1g, Ballaststoffe=6,4g, Eiweiß=32,4g, Salz=7,6g,\nMensa Westerberg\t26.01.2022\t1714\t3614\tEintopf (Terrine, Teller)\tEintopf Terrine\t2045\tChili con Carne vom Bio-Rind (2,3,14)\tWeizenbrötchen (1,21,a,f)\t\t\t\t\tChili con carne with organic minced beef (2,3,14)\tBread roll (1,21,a,f)\t\t\t\t\t1,80\t3,40\t4,20\tc\t\t\t1, 2, 14, 21, a, f, 0\tmit Farbstoff, mit Konservierungsstoff, Rindfleisch, vegan, Glutenhaltiges Getreide (a), Soja (f), zusatzstoff- und allergenfrei\t-\tBrennwert=3417 kJ (816 kcal), Fett=31,5g, davon gesättigte Fettsäuren=8,8g, Kohlenhydrate=95,3g, davon Zucker=13,1g, Ballaststoffe=6,4g, Eiweiß=32,4g, Salz=7,6g,\nMensa Westerberg\t26.01.2022\t2130\t4388\tKM 1 veget./vegan,+1,35 €\tHauptgericht\t2946\tBBQ Burger \"Pulled Jack\" mit Jackfruit, Rotkohl, gegrillter Paprika, Gurken, Zwiebeln und Cashews (3,16,17,21,a,h,k,j)\t\t\t\t\t\tBBBQ Burger \"Pulled Jack\" with jackfruit, red cabbage, grilled peppers, cucumbers, onions and cashew (3,16,17,21,a,h,k,j)\t\t\t\t\t\t3,60\t4,95\t5,75\tg\t\t\t3, 16, 17, 21, a, h, k, j, 0\tmit Antioxidationsmittel, KlimaTeller, Knoblauch, vegan, Glutenhaltiges Getreide (a), Schalenfrüchte (Nüsse) (h), Schwefeldioxid u. Sulfite (k), Senf (j), zusatzstoff- und allergenfrei\t-\tBrennwert=3788 kJ (905 kcal), Fett=59,2g, davon gesättigte Fettsäuren=6,9g, Kohlenhydrate=77,0g, davon Zucker=21,1g, Ballaststoffe=4,0g, Eiweiß=14,9g, Salz=6,2g,\nMensa Westerberg\t26.01.2022\t1701\t3648\tStärkebeilage 3\tBeilagen\t525\tPommes frites klein (21)\t\t\t\t\t\tPommes frites small (21)\t\t\t\t\t\t0,55\t1,05\t1,25\tc\t\t\t21, 0\tvegan, zusatzstoff- und allergenfrei\t-\tBrennwert=1097 kJ (262 kcal), Fett=12,1g, davon gesättigte Fettsäuren=4,4g, Kohlenhydrate=33,0g, davon Zucker=0,8g, Ballaststoffe=3,0g, Eiweiß=3,8g, Salz=1,0g,\nMensa Westerberg\t26.01.2022\t2130\t6510\tKM 3 veget./vegan,+1,35 €\tHauptgericht\t3152\tMexikanische Kartoffel Bowl mit roter Paprika, Kidneybohnen, Peperoni, Cheddar und Tortilla-Chips (1,20,g)\t\t\t\t\t\tMexican Potato Bowl with red bell pepper, kidney beans, peppers, cheddar and tortilla chips (1,20,g)\t\t\t\t\t\t2,80\t4,15\t4,95\tc\t\t\t1, 20, g, 0\tmit Farbstoff, vegetarisch, Milch und Laktose (g), zusatzstoff- und allergenfrei\t-\tBrennwert=2806 kJ (670 kcal), Fett=34,3g, davon gesättigte Fettsäuren=17,7g, Kohlenhydrate=55,5g, davon Zucker=10,4g, Ballaststoffe=6,8g, Eiweiß=27,2g, Salz=2,7g,\nMensa Westerberg\t26.01.2022\t2130\t10518\tKM 5 veget./vegan,+1,35 €\tHauptgericht\t3183\tPommes frites groß (21)\t\t\t\t\t\tPommes frites large (21)\t\t\t\t\t\t1,00\t2,35\t3,15\tc\t\t\t21, 0\tvegan, zusatzstoff- und allergenfrei\t-\tBrennwert=2194 kJ (524 kcal), Fett=24,2g, davon gesättigte Fettsäuren=8,8g, Kohlenhydrate=66,0g, davon Zucker=1,5g, Ballaststoffe=6,0g, Eiweiß=7,5g, Salz=1,6g,\nMensa Haste\t27.01.2022\t1701\t3648\tStärkebeilage 3\tBeilagen\t525\tPommes frites klein (21)\t\t\t\t\t\tPommes frites small (21)\t\t\t\t\t\t0,55\t1,05\t1,25\tc\t2\t\t21, 0\tvegan, zusatzstoff- und allergenfrei\t-\tBrennwert=1097 kJ (262 kcal), Fett=12,1g, davon gesättigte Fettsäuren=4,4g, Kohlenhydrate=33,0g, davon Zucker=0,8g, Ballaststoffe=3,0g, Eiweiß=3,8g, Salz=1,0g,\nMensa Haste\t27.01.2022\t2130\t10518\tKM 5 veget./vegan,+1,35 €\tHauptgericht\t3183\tPommes frites groß (21)\t\t\t\t\t\tPommes frites large (21)\t\t\t\t\t\t1,00\t2,35\t3,15\tc\t2\t\t21, 0\tvegan, zusatzstoff- und allergenfrei\t-\tBrennwert=2194 kJ (524 kcal), Fett=24,2g, davon gesättigte Fettsäuren=8,8g, Kohlenhydrate=66,0g, davon Zucker=1,5g, Ballaststoffe=6,0g, Eiweiß=7,5g, Salz=1,6g,\nMensa Haste\t27.01.2022\t2130\t4388\tKM 1 veget./vegan,+1,35 €\tHauptgericht\t2924\tKumpir mit Paprika-Couscous, Rotkraut und Rucola (1,3,16,17,21,a,k,j,f)\t\t\t\t\t\tKumpir with paprika couscous, red cabbage and rocket salad (1,3,16,17,21,a,k,j,f)\t\t\t\t\t\t2,60\t3,95\t4,75\tg\t2\t\t1, 3, 16, 17, 21, a, k, j, f, 0\tmit Farbstoff, mit Antioxidationsmittel, KlimaTeller, Knoblauch, vegan, Glutenhaltiges Getreide (a), Schwefeldioxid u. Sulfite (k), Senf (j), Soja (f), zusatzstoff- und allergenfrei\t-\tBrennwert=3189 kJ (762 kcal), Fett=10,8g, davon gesättigte Fettsäuren=1,5g, Kohlenhydrate=130,5g, davon Zucker=17,6g, Ballaststoffe=14,9g, Eiweiß=25,2g, Salz=4,1g,\nMensa Haste\t27.01.2022\t2130\t10190\tKM 4 Fleisch/Fisc,+1,55 €\tHauptgericht\t2928\tMediterrane Hähnchenpfanne mit Mandelbrokkoli und Kurkumareis (3,6,17,g,h,40)\t\t\t\t\t\tMediterranean chicken pan with almond broccoli and turmeric rice (3,6,17,g,h,40)\t\t\t\t\t\t3,20\t4,75\t5,55\ta\t2\t\t3, 6, 17, g, h, 40, 0\tmit Antioxidationsmittel, geschwärzt, Knoblauch, Milch und Laktose (g), Schalenfrüchte (Nüsse) (h), Geflügel, zusatzstoff- und allergenfrei\t-\tBrennwert=2762 kJ (660 kcal), Fett=20,2g, davon gesättigte Fettsäuren=4,8g, Kohlenhydrate=72,0g, davon Zucker=7,6g, Ballaststoffe=8,7g, Eiweiß=45,5g, Salz=1,9g,\nMensa Haste\t27.01.2022\t2130\t6510\tKM 3 veget./vegan,+1,35 €\tHauptgericht\t3334\tHandbrot mit Cheddar, Champignons und frischem Kräuterquark (1,17,20,a,g)\t\t\t\t\t\tHand bread with cheddar cheese, champignons and fresh herb curd cheese (1,17,20,a,g)\t\t\t\t\t\t2,40\t3,75\t4,55\tc\t2\t\t1, 17, 20, 22, a, g, 0\tmit Farbstoff, Knoblauch, vegetarisch, nicht vegan/vegetarisch (tierische Hilfsstoffe), Glutenhaltiges Getreide (a), Milch und Laktose (g), zusatzstoff- und allergenfrei\t-\tBrennwert=2978 kJ (711 kcal), Fett=33,0g, davon gesättigte Fettsäuren=15,9g, Kohlenhydrate=63,7g, davon Zucker=5,6g, Ballaststoffe=3,8g, Eiweiß=35,3g, Salz=2,9g,\nMensa Lingen\t27.01.2022\t2130\t4388\tKM 1 veget./vegan,+1,35 €\tHauptgericht\t2924\tKumpir mit Paprika-Couscous, Rotkraut und Rucola (1,3,16,17,21,a,k,j,f)\t\t\t\t\t\tKumpir with paprika couscous, red cabbage and rocket salad (1,3,16,17,21,a,k,j,f)\t\t\t\t\t\t2,60\t3,95\t4,75\tg\t2\t\t1, 3, 16, 17, 21, a, k, j, f, 0\tmit Farbstoff, mit Antioxidationsmittel, KlimaTeller, Knoblauch, vegan, Glutenhaltiges Getreide (a), Schwefeldioxid u. Sulfite (k), Senf (j), Soja (f), zusatzstoff- und allergenfrei\t-\tBrennwert=3182 kJ (760 kcal), Fett=10,7g, davon gesättigte Fettsäuren=1,5g, Kohlenhydrate=130,3g, davon Zucker=17,6g, Ballaststoffe=14,8g, Eiweiß=25,1g, Salz=4,1g,\nMensa Lingen\t27.01.2022\t1701\t3648\tStärkebeilage 3\tBeilagen\t525\tPommes frites klein (21)\t\t\t\t\t\tPommes frites small (21)\t\t\t\t\t\t0,55\t1,05\t1,25\tc\t2\t\t21, 0\tvegan, zusatzstoff- und allergenfrei\t-\tBrennwert=1097 kJ (262 kcal), Fett=12,1g, davon gesättigte Fettsäuren=4,4g, Kohlenhydrate=33,0g, davon Zucker=0,8g, Ballaststoffe=3,0g, Eiweiß=3,8g, Salz=1,0g,\nMensa Lingen\t27.01.2022\t2130\t10190\tKM 4 Fleisch/Fisc,+1,55 €\tHauptgericht\t2928\tMediterrane Hähnchenpfanne mit Mandelbrokkoli und Kurkumareis (3,6,17,g,h,40)\t\t\t\t\t\tMediterranean chicken pan with almond broccoli and turmeric rice (3,6,17,g,h,40)\t\t\t\t\t\t3,20\t4,75\t5,55\ta\t2\t\t3, 6, 17, g, h, 40, 0\tmit Antioxidationsmittel, geschwärzt, Knoblauch, Milch und Laktose (g), Schalenfrüchte (Nüsse) (h), Geflügel, zusatzstoff- und allergenfrei\t-\tBrennwert=2762 kJ (660 kcal), Fett=20,2g, davon gesättigte Fettsäuren=4,8g, Kohlenhydrate=72,0g, davon Zucker=7,6g, Ballaststoffe=8,7g, Eiweiß=45,5g, Salz=1,9g,\nMensa Lingen\t27.01.2022\t2130\t10518\tKM 5 veget./vegan,+1,35 €\tHauptgericht\t3183\tPommes frites groß (21)\t\t\t\t\t\tPommes frites large (21)\t\t\t\t\t\t1,00\t2,35\t3,15\tc\t2\t\t21, 0\tvegan, zusatzstoff- und allergenfrei\t-\tBrennwert=2194 kJ (524 kcal), Fett=24,2g, davon gesättigte Fettsäuren=8,8g, Kohlenhydrate=66,0g, davon Zucker=1,5g, Ballaststoffe=6,0g, Eiweiß=7,5g, Salz=1,7g,\nMensa Schlossgarten\t27.01.2022\t1701\t3646\tGemüsebeilage 3/Tagessala\tTagessalat\t2342\tMediterraner Nudelsalat (3,21,a,k)\t\t\t\t\t\tMediterranean noodle salad (3,21,a,k)\t\t\t\t\t\t0,50\t1,00\t1,20\tc\t\t\t3, 21, a, k, 0\tmit Antioxidationsmittel, vegan, Glutenhaltiges Getreide (a), Schwefeldioxid u. Sulfite (k), zusatzstoff- und allergenfrei\t-\tBrennwert=1128 kJ (269 kcal), Fett=8,6g, davon gesättigte Fettsäuren=1,3g, Kohlenhydrate=38,9g, davon Zucker=4,8g, Ballaststoffe=2,0g, Eiweiß=6,6g, Salz=0,9g,\nMensa Schlossgarten\t27.01.2022\t1701\t3648\tStärkebeilage 3\tBeilagen\t525\t\t\t\t\t\t\t\t\t\t\t\t\t0,55\t1,05\t1,25\tc\t\t\t21, 0\tvegan, zusatzstoff- und allergenfrei\t-\t-\nMensa Schlossgarten\t27.01.2022\t2130\t10190\tKM 4 Fleisch/Fisc,+1,55 €\tHauptgericht\t2928\tMediterrane Hähnchenpfanne mit Mandelbrokkoli und Kurkumareis (3,6,17,g,h,40)\t\t\t\t\t\tMediterranean chicken pan with almond broccoli and turmeric rice (3,6,17,g,h,40)\t\t\t\t\t\t3,20\t4,75\t5,55\ta\t\t\t3, 6, 17, g, h, 40, 0\tmit Antioxidationsmittel, geschwärzt, Knoblauch, Milch und Laktose (g), Schalenfrüchte (Nüsse) (h), Geflügel, zusatzstoff- und allergenfrei\t-\tBrennwert=2770 kJ (662 kcal), Fett=20,3g, davon gesättigte Fettsäuren=4,8g, Kohlenhydrate=72,3g, davon Zucker=7,8g, Ballaststoffe=8,9g, Eiweiß=45,5g, Salz=2,0g,\nMensa Schlossgarten\t27.01.2022\t2097\t3665\tDessert 1\tDessert\t2882\tKirschcrumble (1,21,a)\tVanillesauce (21,f)\t\t\t\t\tCherry crumble (1,21,a)\tCustard sauce (21,f)\t\t\t\t\t0,70\t1,20\t1,40\tg\t\t\t1, 21, a, f, 0\tmit Farbstoff, vegan, Glutenhaltiges Getreide (a), Soja (f), zusatzstoff- und allergenfrei\t-\tBrennwert=545 kJ (130 kcal), Fett=3,3g, davon gesättigte Fettsäuren=0,8g, Kohlenhydrate=21,0g, davon Zucker=14,7g, Ballaststoffe=1,6g, Eiweiß=2,5g, Salz=0,0g,\nMensa Schlossgarten\t27.01.2022\t2097\t3665\tDessert 1\tDessert\t2311\tKirschcrumble (1,21,a)\tVanillesauce (21,f)\t\t\t\t\tCherry crumble (1,21,a)\tCustard sauce (21,f)\t\t\t\t\t0,70\t1,20\t1,40\tg\t\t\t1, 21, a, f, 0\tmit Farbstoff, vegan, Glutenhaltiges Getreide (a), Soja (f), zusatzstoff- und allergenfrei\t-\tBrennwert=545 kJ (130 kcal), Fett=3,3g, davon gesättigte Fettsäuren=0,8g, Kohlenhydrate=21,0g, davon Zucker=14,7g, Ballaststoffe=1,6g, Eiweiß=2,5g, Salz=0,0g,\nMensa Schlossgarten\t27.01.2022\t2130\t10518\tKM 5 veget./vegan,+1,35 €\tHauptgericht\t3183\t\t\t\t\t\t\t\t\t\t\t\t\t1,00\t2,35\t3,15\tc\t\t\t21, 0\tvegan, zusatzstoff- und allergenfrei\t-\tBrennwert=2194 kJ (524 kcal), Fett=24,2g, davon gesättigte Fettsäuren=8,8g, Kohlenhydrate=66,0g, davon Zucker=1,5g, Ballaststoffe=6,0g, Eiweiß=7,5g, Salz=1,6g,\nMensa Schlossgarten\t27.01.2022\t2130\t6510\tKM 3 veget./vegan,+1,35 €\tHauptgericht\t3334\tHandbrot mit Cheddar, Champignons und frischem Kräuterquark (1,17,20,a,g)\t\t\t\t\t\tHand bread with cheddar cheese, champignons and fresh herb curd cheese (1,17,20,a,g)\t\t\t\t\t\t2,40\t3,75\t4,55\tc\t\t\t1, 17, 20, 22, a, g, 0\tmit Farbstoff, Knoblauch, vegetarisch, nicht vegan/vegetarisch (tierische Hilfsstoffe), Glutenhaltiges Getreide (a), Milch und Laktose (g), zusatzstoff- und allergenfrei\t-\tBrennwert=2978 kJ (711 kcal), Fett=33,0g, davon gesättigte Fettsäuren=15,9g, Kohlenhydrate=63,7g, davon Zucker=5,6g, Ballaststoffe=3,8g, Eiweiß=35,3g, Salz=2,9g,\nMensa Schlossgarten\t27.01.2022\t2130\t4388\tKM 1 veget./vegan,+1,35 €\tHauptgericht\t2924\tKumpir mit Paprika-Couscous, Rotkraut und Rucola (1,3,16,17,21,a,k,j,f)\t\t\t\t\t\tKumpir with paprika couscous, red cabbage and rocket salad (1,3,16,17,21,a,k,j,f)\t\t\t\t\t\t2,60\t3,95\t4,75\tg\t\t\t1, 3, 16, 17, 21, a, k, j, f, 0\tmit Farbstoff, mit Antioxidationsmittel, KlimaTeller, Knoblauch, vegan, Glutenhaltiges Getreide (a), Schwefeldioxid u. Sulfite (k), Senf (j), Soja (f), zusatzstoff- und allergenfrei\t-\tBrennwert=3185 kJ (761 kcal), Fett=10,8g, davon gesättigte Fettsäuren=1,5g, Kohlenhydrate=130,4g, davon Zucker=17,6g, Ballaststoffe=14,8g, Eiweiß=25,1g, Salz=4,1g,\nMensa Vechta\t27.01.2022\t2130\t4388\tKM 1 veget./vegan,+1,35 €\tHauptgericht\t2924\tKumpir mit Paprika-Couscous, Rotkraut und Rucola (1,3,16,17,21,a,k,j,f)\t\t\t\t\t\tKumpir with paprika couscous, red cabbage and rocket salad (1,3,16,17,21,a,k,j,f)\t\t\t\t\t\t2,60\t3,95\t4,75\tg\t2\t\t1, 3, 16, 17, 21, a, k, j, f, 0\tmit Farbstoff, mit Antioxidationsmittel, KlimaTeller, Knoblauch, vegan, Glutenhaltiges Getreide (a), Schwefeldioxid u. Sulfite (k), Senf (j), Soja (f), zusatzstoff- und allergenfrei\t-\tBrennwert=3186 kJ (761 kcal), Fett=10,8g, davon gesättigte Fettsäuren=1,5g, Kohlenhydrate=130,4g, davon Zucker=17,6g, Ballaststoffe=14,8g, Eiweiß=25,1g, Salz=4,1g,\nMensa Vechta\t27.01.2022\t2130\t6510\tKM 3 veget./vegan,+1,35 €\tHauptgericht\t3334\tHandbrot mit Cheddar, Champignons und frischem Kräuterquark (1,17,20,a,g)\t\t\t\t\t\tHand bread with cheddar cheese, champignons and fresh herb curd cheese (1,17,20,a,g)\t\t\t\t\t\t2,40\t3,75\t4,55\tc\t2\t\t1, 17, 20, 22, a, g, 0\tmit Farbstoff, Knoblauch, vegetarisch, nicht vegan/vegetarisch (tierische Hilfsstoffe), Glutenhaltiges Getreide (a), Milch und Laktose (g), zusatzstoff- und allergenfrei\t-\tBrennwert=2978 kJ (711 kcal), Fett=33,0g, davon gesättigte Fettsäuren=15,9g, Kohlenhydrate=63,7g, davon Zucker=5,6g, Ballaststoffe=3,8g, Eiweiß=35,3g, Salz=2,9g,\nMensa Vechta\t27.01.2022\t2130\t10190\tKM 4 Fleisch/Fisc,+1,55 €\tHauptgericht\t2928\tMediterrane Hähnchenpfanne mit Mandelbrokkoli und Kurkumareis (3,6,17,g,h,40)\t\t\t\t\t\tMediterranean chicken pan with almond broccoli and turmeric rice (3,6,17,g,h,40)\t\t\t\t\t\t3,20\t4,75\t5,55\ta\t2\t\t3, 6, 17, g, h, 40, 0\tmit Antioxidationsmittel, geschwärzt, Knoblauch, Milch und Laktose (g), Schalenfrüchte (Nüsse) (h), Geflügel, zusatzstoff- und allergenfrei\t-\tBrennwert=2770 kJ (662 kcal), Fett=20,3g, davon gesättigte Fettsäuren=4,8g, Kohlenhydrate=72,3g, davon Zucker=7,7g, Ballaststoffe=8,8g, Eiweiß=45,5g, Salz=1,9g,\nMensa Vechta\t27.01.2022\t2130\t10518\tKM 5 veget./vegan,+1,35 €\tHauptgericht\t3183\tPommes frites groß (21)\t\t\t\t\t\tPommes frites large (21)\t\t\t\t\t\t1,00\t2,35\t3,15\tc\t2\t\t21, 0\tvegan, zusatzstoff- und allergenfrei\t-\tBrennwert=2194 kJ (524 kcal), Fett=24,2g, davon gesättigte Fettsäuren=8,8g, Kohlenhydrate=66,0g, davon Zucker=1,5g, Ballaststoffe=6,0g, Eiweiß=7,5g, Salz=1,6g,\nMensa Vechta\t27.01.2022\t1701\t3648\tStärkebeilage 3\tBeilagen\t525\tPommes frites klein (21)\t\t\t\t\t\tPommes frites small (21)\t\t\t\t\t\t0,55\t1,05\t1,25\tc\t2\t\t21, 0\tvegan, zusatzstoff- und allergenfrei\t-\tBrennwert=1097 kJ (262 kcal), Fett=12,1g, davon gesättigte Fettsäuren=4,4g, Kohlenhydrate=33,0g, davon Zucker=0,8g, Ballaststoffe=3,0g, Eiweiß=3,8g, Salz=1,0g,\nMensa Westerberg\t27.01.2022\t2130\t10190\tKM 4 Fleisch/Fisc,+1,55 €\tHauptgericht\t2928\tMediterrane Hähnchenpfanne mit Mandelbrokkoli und Kurkumareis (3,6,17,g,h,40)\t\t\t\t\t\tMediterranean chicken pan with almond broccoli and turmeric rice (3,6,17,g,h,40)\t\t\t\t\t\t3,20\t4,75\t5,55\ta\t\t\t3, 6, 17, g, h, 40, 0\tmit Antioxidationsmittel, geschwärzt, Knoblauch, Milch und Laktose (g), Schalenfrüchte (Nüsse) (h), Geflügel, zusatzstoff- und allergenfrei\t-\tBrennwert=2771 kJ (662 kcal), Fett=20,3g, davon gesättigte Fettsäuren=4,8g, Kohlenhydrate=72,4g, davon Zucker=7,8g, Ballaststoffe=8,9g, Eiweiß=45,5g, Salz=2,0g,\nMensa Westerberg\t27.01.2022\t2130\t10518\tKM 5 veget./vegan,+1,35 €\tHauptgericht\t3183\tPommes frites groß (21)\t\t\t\t\t\tPommes frites large (21)\t\t\t\t\t\t1,00\t2,35\t3,15\tc\t\t\t21, 0\tvegan, zusatzstoff- und allergenfrei\t-\tBrennwert=2194 kJ (524 kcal), Fett=24,2g, davon gesättigte Fettsäuren=8,8g, Kohlenhydrate=66,0g, davon Zucker=1,5g, Ballaststoffe=6,0g, Eiweiß=7,5g, Salz=1,6g,\nMensa Westerberg\t27.01.2022\t2097\t3665\tDessert 1\tDessert\t2882\tKirschcrumble (1,21,a)\tVanillesauce (21,f)\t\t\t\t\tCherry crumble (1,21,a)\tCustard sauce (21,f)\t\t\t\t\t0,70\t1,20\t1,40\tg\t\t\t1, 21, a, f, 0\tmit Farbstoff, vegan, Glutenhaltiges Getreide (a), Soja (f), zusatzstoff- und allergenfrei\t-\tBrennwert=546 kJ (130 kcal), Fett=3,3g, davon gesättigte Fettsäuren=0,8g, Kohlenhydrate=21,0g, davon Zucker=14,8g, Ballaststoffe=1,6g, Eiweiß=2,5g, Salz=0,0g,\nMensa Westerberg\t27.01.2022\t1701\t3648\tStärkebeilage 3\tBeilagen\t525\tPommes frites klein (21)\t\t\t\t\t\tPommes frites small (21)\t\t\t\t\t\t0,55\t1,05\t1,25\tc\t\t\t21, 0\tvegan, zusatzstoff- und allergenfrei\t-\tBrennwert=1097 kJ (262 kcal), Fett=12,1g, davon gesättigte Fettsäuren=4,4g, Kohlenhydrate=33,0g, davon Zucker=0,8g, Ballaststoffe=3,0g, Eiweiß=3,8g, Salz=1,0g,\nMensa Westerberg\t27.01.2022\t2130\t6510\tKM 3 veget./vegan,+1,35 €\tHauptgericht\t3334\tHandbrot mit Cheddar, Champignons und frischem Kräuterquark (1,17,20,a,g)\t\t\t\t\t\tHand bread with cheddar cheese, champignons and fresh herb curd cheese (1,17,20,a,g)\t\t\t\t\t\t2,40\t3,75\t4,55\tc\t\t\t1, 17, 20, 22, a, g, 0\tmit Farbstoff, Knoblauch, vegetarisch, nicht vegan/vegetarisch (tierische Hilfsstoffe), Glutenhaltiges Getreide (a), Milch und Laktose (g), zusatzstoff- und allergenfrei\t-\tBrennwert=2979 kJ (712 kcal), Fett=33,0g, davon gesättigte Fettsäuren=15,9g, Kohlenhydrate=63,8g, davon Zucker=5,6g, Ballaststoffe=3,8g, Eiweiß=35,3g, Salz=2,9g,\nMensa Westerberg\t27.01.2022\t2097\t3665\tDessert 1\tDessert\t2311\tKirschcrumble (1,21,a)\tVanillesauce (21,f)\t\t\t\t\tCherry crumble (1,21,a)\tCustard sauce (21,f)\t\t\t\t\t0,70\t1,20\t1,40\tg\t\t\t1, 21, a, f, 0\tmit Farbstoff, vegan, Glutenhaltiges Getreide (a), Soja (f), zusatzstoff- und allergenfrei\t-\tBrennwert=546 kJ (130 kcal), Fett=3,3g, davon gesättigte Fettsäuren=0,8g, Kohlenhydrate=21,0g, davon Zucker=14,8g, Ballaststoffe=1,6g, Eiweiß=2,5g, Salz=0,0g,\nMensa Westerberg\t27.01.2022\t1701\t3646\tGemüsebeilage 3/Tagessala\tTagessalat\t2342\tMediterraner Nudelsalat (3,21,a,k)\t\t\t\t\t\tMediterranean noodle salad (3,21,a,k)\t\t\t\t\t\t0,50\t1,00\t1,20\tc\t\t\t3, 21, a, k, 0\tmit Antioxidationsmittel, vegan, Glutenhaltiges Getreide (a), Schwefeldioxid u. Sulfite (k), zusatzstoff- und allergenfrei\t-\tBrennwert=1128 kJ (269 kcal), Fett=8,6g, davon gesättigte Fettsäuren=1,3g, Kohlenhydrate=38,9g, davon Zucker=4,8g, Ballaststoffe=2,0g, Eiweiß=6,6g, Salz=1,0g,\nMensa Westerberg\t27.01.2022\t2130\t4388\tKM 1 veget./vegan,+1,35 €\tHauptgericht\t2924\tKumpir mit Paprika-Couscous, Rotkraut und Rucola (1,3,16,17,21,a,k,j,f)\t\t\t\t\t\tKumpir with paprika couscous, red cabbage and rocket salad (1,3,16,17,21,a,k,j,f)\t\t\t\t\t\t2,60\t3,95\t4,75\tg\t\t\t1, 3, 16, 17, 21, a, k, j, f, 0\tmit Farbstoff, mit Antioxidationsmittel, KlimaTeller, Knoblauch, vegan, Glutenhaltiges Getreide (a), Schwefeldioxid u. Sulfite (k), Senf (j), Soja (f), zusatzstoff- und allergenfrei\t-\tBrennwert=3185 kJ (761 kcal), Fett=10,8g, davon gesättigte Fettsäuren=1,5g, Kohlenhydrate=130,4g, davon Zucker=17,6g, Ballaststoffe=14,8g, Eiweiß=25,1g, Salz=4,1g,\nMensa Haste\t28.01.2022\t2130\t10518\tKM 5 veget./vegan,+1,35 €\tHauptgericht\t3183\tPommes frites groß (21)\t\t\t\t\t\tPommes frites large (21)\t\t\t\t\t\t1,00\t2,35\t3,15\tc\t2\t\t21, 0\tvegan, zusatzstoff- und allergenfrei\t-\tBrennwert=2194 kJ (524 kcal), Fett=24,2g, davon gesättigte Fettsäuren=8,8g, Kohlenhydrate=66,0g, davon Zucker=1,5g, Ballaststoffe=6,0g, Eiweiß=7,5g, Salz=1,6g,\nMensa Haste\t28.01.2022\t1714\t3614\tEintopf (Terrine, Teller)\tEintopf Terrine\t2045\tGrünkohleintopf Bollywood mit Kichererbsen und Kokosmilch (1,16,21)\tWeizenbrötchen (1,21,a,f)\t\t\t\t\tBollywood curly kale casserole with chickpeas and coconut milk (1,16,21)\tBread roll (1,21,a,f)\t\t\t\t\t1,80\t3,40\t4,20\tg\t2\t\t1, 16, 21, a, f, 0\tmit Farbstoff, KlimaTeller, vegan, Glutenhaltiges Getreide (a), Soja (f), zusatzstoff- und allergenfrei\t-\tBrennwert=2416 kJ (577 kcal), Fett=15,3g, davon gesättigte Fettsäuren=7,9g, Kohlenhydrate=75,8g, davon Zucker=13,0g, Ballaststoffe=6,0g, Eiweiß=24,4g, Salz=6,9g,\nMensa Haste\t28.01.2022\t1701\t3648\tStärkebeilage 3\tBeilagen\t525\tPommes frites klein (21)\t\t\t\t\t\tPommes frites small (21)\t\t\t\t\t\t0,55\t1,05\t1,25\tc\t2\t\t21, 0\tvegan, zusatzstoff- und allergenfrei\t-\tBrennwert=1097 kJ (262 kcal), Fett=12,1g, davon gesättigte Fettsäuren=4,4g, Kohlenhydrate=33,0g, davon Zucker=0,8g, Ballaststoffe=3,0g, Eiweiß=3,8g, Salz=1,0g,\nMensa Haste\t28.01.2022\t2130\t4388\tKM 1 veget./vegan,+1,35 €\tHauptgericht\t2637\tHalloumisteak mit Grillgemüse und Rosmarinkartoffeln (2,20,g)\t\t\t\t\t\tHalloumi steak with grilled vegetables and rosemary potatoes (2,20,g)\t\t\t\t\t\t3,50\t4,85\t5,65\ta\t2\t\t2, 20, g, 0\tmit Konservierungsstoff, vegetarisch, Milch und Laktose (g), zusatzstoff- und allergenfrei\t-\tBrennwert=3133 kJ (748 kcal), Fett=44,7g, davon gesättigte Fettsäuren=17,4g, Kohlenhydrate=53,7g, davon Zucker=12,1g, Ballaststoffe=8,4g, Eiweiß=29,6g, Salz=2,9g,\nMensa Haste\t28.01.2022\t2130\t4389\tKM 2 Fleisch/Fisc,+1,55 €\tHauptgericht\t1624\tFish & Chips mit dänischer Remoulade (2,3,8,9,24,d,a,c,g,k,i,j,43)\t\t\t\t\t\tFish & chips with Danish remoulade sauce (2,3,8,9,24,d,a,c,g,k,i,j,43)\t\t\t\t\t\t2,65\t4,20\t5,00\tc\t2\t\t2, 3, 8, 9, 24, d, a, c, g, k, i, j, 43, 0\tmit Konservierungsstoff, mit Antioxidationsmittel, mit Phosphat, mit Süßungsmitteln, Fisch aus nachhaltiger Fischerei, Fisch (d), Glutenhaltiges Getreide (a), Hühnerei (c), Milch und Laktose (g), Schwefeldioxid u. Sulfite (k), Sellerie (i), Senf (j), Fisch, zusatzstoff- und allergenfrei\t-\tBrennwert=4115 kJ (983 kcal), Fett=69,4g, davon gesättigte Fettsäuren=5,8g, Kohlenhydrate=60,0g, davon Zucker=5,6g, Ballaststoffe=4,2g, Eiweiß=28,0g, Salz=5,1g,\nMensa Haste\t28.01.2022\t1714\t3614\tEintopf (Terrine, Teller)\tEintopf Terrine\t2208\tGrünkohleintopf Bollywood mit Kichererbsen und Kokosmilch (1,16,21)\tWeizenbrötchen (1,21,a,f)\t\t\t\t\tBollywood curly kale casserole with chickpeas and coconut milk (1,16,21)\tBread roll (1,21,a,f)\t\t\t\t\t1,80\t3,40\t4,20\tg\t2\t\t1, 16, 21, a, f, 0\tmit Farbstoff, KlimaTeller, vegan, Glutenhaltiges Getreide (a), Soja (f), zusatzstoff- und allergenfrei\t-\tBrennwert=2416 kJ (577 kcal), Fett=15,3g, davon gesättigte Fettsäuren=7,9g, Kohlenhydrate=75,8g, davon Zucker=13,0g, Ballaststoffe=6,0g, Eiweiß=24,4g, Salz=6,9g,\nMensa Lingen\t28.01.2022\t2130\t4389\tKM 2 Fleisch/Fisc,+1,55 €\tHauptgericht\t1624\tFish & Chips mit dänischer Remoulade (2,3,8,9,24,d,a,c,g,k,i,j,43)\t\t\t\t\t\tFish & chips with Danish remoulade sauce (2,3,8,9,24,d,a,c,g,k,i,j,43)\t\t\t\t\t\t2,65\t4,20\t5,00\tc\t2\t\t2, 3, 8, 9, 24, d, a, c, g, k, i, j, 43, 0\tmit Konservierungsstoff, mit Antioxidationsmittel, mit Phosphat, mit Süßungsmitteln, Fisch aus nachhaltiger Fischerei, Fisch (d), Glutenhaltiges Getreide (a), Hühnerei (c), Milch und Laktose (g), Schwefeldioxid u. Sulfite (k), Sellerie (i), Senf (j), Fisch, zusatzstoff- und allergenfrei\t-\tBrennwert=4112 kJ (982 kcal), Fett=69,4g, davon gesättigte Fettsäuren=5,8g, Kohlenhydrate=59,9g, davon Zucker=5,6g, Ballaststoffe=4,2g, Eiweiß=28,0g, Salz=5,1g,\nMensa Lingen\t28.01.2022\t2130\t10518\tKM 5 veget./vegan,+1,35 €\tHauptgericht\t3183\tPommes frites groß (21)\t\t\t\t\t\tPommes frites large (21)\t\t\t\t\t\t1,00\t2,35\t3,15\tc\t2\t\t21, 0\tvegan, zusatzstoff- und allergenfrei\t-\tBrennwert=2194 kJ (524 kcal), Fett=24,2g, davon gesättigte Fettsäuren=8,8g, Kohlenhydrate=66,0g, davon Zucker=1,5g, Ballaststoffe=6,0g, Eiweiß=7,5g, Salz=1,6g,\nMensa Lingen\t28.01.2022\t1714\t3614\tEintopf (Terrine, Teller)\tEintopf Terrine\t2045\tGrünkohleintopf Bollywood mit Kichererbsen und Kokosmilch (1,16,21)\tWeizenbrötchen (1,21,a,f)\t\t\t\t\tBollywood curly kale casserole with chickpeas and coconut milk (1,16,21)\tBread roll (1,21,a,f)\t\t\t\t\t1,80\t3,40\t4,20\tg\t2\t\t1, 16, 21, a, f, 0\tmit Farbstoff, KlimaTeller, vegan, Glutenhaltiges Getreide (a), Soja (f), zusatzstoff- und allergenfrei\t-\tBrennwert=2431 kJ (581 kcal), Fett=15,5g, davon gesättigte Fettsäuren=7,9g, Kohlenhydrate=76,2g, davon Zucker=13,4g, Ballaststoffe=5,9g, Eiweiß=24,4g, Salz=7,2g,\nMensa Lingen\t28.01.2022\t1701\t3648\tStärkebeilage 3\tBeilagen\t525\tPommes frites klein (21)\t\t\t\t\t\tPommes frites small (21)\t\t\t\t\t\t0,55\t1,05\t1,25\tc\t2\t\t21, 0\tvegan, zusatzstoff- und allergenfrei\t-\tBrennwert=1097 kJ (262 kcal), Fett=12,1g, davon gesättigte Fettsäuren=4,4g, Kohlenhydrate=33,0g, davon Zucker=0,8g, Ballaststoffe=3,0g, Eiweiß=3,8g, Salz=1,0g,\nMensa Lingen\t28.01.2022\t1714\t3614\tEintopf (Terrine, Teller)\tEintopf Terrine\t2208\tGrünkohleintopf Bollywood mit Kichererbsen und Kokosmilch (1,16,21)\tWeizenbrötchen (1,21,a,f)\t\t\t\t\tBollywood curly kale casserole with chickpeas and coconut milk (1,16,21)\tBread roll (1,21,a,f)\t\t\t\t\t1,80\t3,40\t4,20\tg\t2\t\t1, 16, 21, a, f, 0\tmit Farbstoff, KlimaTeller, vegan, Glutenhaltiges Getreide (a), Soja (f), zusatzstoff- und allergenfrei\t-\tBrennwert=2431 kJ (581 kcal), Fett=15,5g, davon gesättigte Fettsäuren=7,9g, Kohlenhydrate=76,2g, davon Zucker=13,4g, Ballaststoffe=5,9g, Eiweiß=24,4g, Salz=7,2g,\nMensa Schlossgarten\t28.01.2022\t1714\t3614\tEintopf (Terrine, Teller)\tEintopf Terrine\t2045\tGrünkohleintopf Bollywood mit Kichererbsen und Kokosmilch (1,16,21)\tWeizenbrötchen (1,21,a,f)\t\t\t\t\tBollywood curly kale casserole with chickpeas and coconut milk (1,16,21)\tBread roll (1,21,a,f)\t\t\t\t\t1,80\t3,40\t4,20\tg\t\t\t1, 16, 21, a, f, 0\tmit Farbstoff, KlimaTeller, vegan, Glutenhaltiges Getreide (a), Soja (f), zusatzstoff- und allergenfrei\t-\tBrennwert=2416 kJ (577 kcal), Fett=15,3g, davon gesättigte Fettsäuren=7,9g, Kohlenhydrate=75,8g, davon Zucker=13,0g, Ballaststoffe=6,0g, Eiweiß=24,4g, Salz=6,9g,\nMensa Schlossgarten\t28.01.2022\t2130\t4388\tKM 1 veget./vegan,+1,35 €\tHauptgericht\t2637\tHalloumisteak mit Grillgemüse und Rosmarinkartoffeln (2,20,g)\t\t\t\t\t\tHalloumi steak with grilled vegetables and rosemary potatoes (2,20,g)\t\t\t\t\t\t3,50\t4,85\t5,65\ta\t\t\t2, 20, g, 0\tmit Konservierungsstoff, vegetarisch, Milch und Laktose (g), zusatzstoff- und allergenfrei\t-\tBrennwert=3135 kJ (749 kcal), Fett=44,7g, davon gesättigte Fettsäuren=17,4g, Kohlenhydrate=53,7g, davon Zucker=12,2g, Ballaststoffe=8,5g, Eiweiß=29,6g, Salz=2,8g,\nMensa Schlossgarten\t28.01.2022\t1701\t3648\tStärkebeilage 3\tBeilagen\t525\t\t\t\t\t\t\t\t\t\t\t\t\t0,55\t1,05\t1,25\tc\t\t\t21, 0\tvegan, zusatzstoff- und allergenfrei\t-\t-\nMensa Schlossgarten\t28.01.2022\t2130\t4389\tKM 2 Fleisch/Fisc,+1,55 €\tHauptgericht\t1624\tFish & Chips mit dänischer Remoulade (2,3,8,9,24,d,a,c,g,k,i,j,43)\t\t\t\t\t\tFish & chips with Danish remoulade sauce (2,3,8,9,24,d,a,c,g,k,i,j,43)\t\t\t\t\t\t2,65\t4,20\t5,00\tc\t\t\t2, 3, 8, 9, 24, d, a, c, g, k, i, j, 43, 0\tmit Konservierungsstoff, mit Antioxidationsmittel, mit Phosphat, mit Süßungsmitteln, Fisch aus nachhaltiger Fischerei, Fisch (d), Glutenhaltiges Getreide (a), Hühnerei (c), Milch und Laktose (g), Schwefeldioxid u. Sulfite (k), Sellerie (i), Senf (j), Fisch, zusatzstoff- und allergenfrei\t-\tBrennwert=4115 kJ (983 kcal), Fett=69,4g, davon gesättigte Fettsäuren=5,8g, Kohlenhydrate=60,0g, davon Zucker=5,6g, Ballaststoffe=4,2g, Eiweiß=28,0g, Salz=5,1g,\nMensa Schlossgarten\t28.01.2022\t2097\t3665\tDessert 1\tDessert\t461\tQuark (20,g)\tWaldbeersauce\t\t\t\t\tQuark dessert (20,g)\tForest berry sauce\t\t\t\t\t0,50\t1,00\t1,20\tc\t\t\t20, g, 0\tvegetarisch, Milch und Laktose (g), zusatzstoff- und allergenfrei\t-\tBrennwert=605 kJ (144 kcal), Fett=1,1g, davon gesättigte Fettsäuren=0,6g, Kohlenhydrate=19,0g, davon Zucker=18,3g, Ballaststoffe=0,1g, Eiweiß=12,8g, Salz=0,1g,\nMensa Schlossgarten\t28.01.2022\t2097\t3665\tDessert 1\tDessert\t280\tQuark (20,g)\tWaldbeersauce\t\t\t\t\tQuark dessert (20,g)\tForest berry sauce\t\t\t\t\t0,50\t1,00\t1,20\tc\t\t\t20, g, 0\tvegetarisch, Milch und Laktose (g), zusatzstoff- und allergenfrei\t-\tBrennwert=605 kJ (144 kcal), Fett=1,1g, davon gesättigte Fettsäuren=0,6g, Kohlenhydrate=19,0g, davon Zucker=18,3g, Ballaststoffe=0,1g, Eiweiß=12,8g, Salz=0,1g,\nMensa Schlossgarten\t28.01.2022\t1714\t3614\tEintopf (Terrine, Teller)\tEintopf Terrine\t2208\tGrünkohleintopf Bollywood mit Kichererbsen und Kokosmilch (1,16,21)\tWeizenbrötchen (1,21,a,f)\t\t\t\t\tBollywood curly kale casserole with chickpeas and coconut milk (1,16,21)\tBread roll (1,21,a,f)\t\t\t\t\t1,80\t3,40\t4,20\tg\t\t\t1, 16, 21, a, f, 0\tmit Farbstoff, KlimaTeller, vegan, Glutenhaltiges Getreide (a), Soja (f), zusatzstoff- und allergenfrei\t-\tBrennwert=2416 kJ (577 kcal), Fett=15,3g, davon gesättigte Fettsäuren=7,9g, Kohlenhydrate=75,8g, davon Zucker=13,0g, Ballaststoffe=6,0g, Eiweiß=24,4g, Salz=6,9g,\nMensa Schlossgarten\t28.01.2022\t2130\t10518\tKM 5 veget./vegan,+1,35 €\tHauptgericht\t3183\t\t\t\t\t\t\t\t\t\t\t\t\t1,00\t2,35\t3,15\tc\t\t\t21, 0\tvegan, zusatzstoff- und allergenfrei\t-\t-\nMensa Schlossgarten\t28.01.2022\t1701\t3646\tGemüsebeilage 3/Tagessala\tTagessalat\t477\tMensa-Salatmix (3,21,k,j)\t\t\t\t\t\tMixed salad (3,21,k,j)\t\t\t\t\t\t0,50\t1,00\t1,20\ta\t\t\t3, 21, k, j, 0\tmit Antioxidationsmittel, vegan, Schwefeldioxid u. Sulfite (k), Senf (j), zusatzstoff- und allergenfrei\t-\tBrennwert=624 kJ (149 kcal), Fett=9,5g, davon gesättigte Fettsäuren=0,8g, Kohlenhydrate=8,9g, davon Zucker=6,7g, Ballaststoffe=4,8g, Eiweiß=2,7g, Salz=0,2g,\nMensa Vechta\t28.01.2022\t1714\t3614\tEintopf (Terrine, Teller)\tEintopf Terrine\t2208\tGrünkohleintopf Bollywood mit Kichererbsen und Kokosmilch (1,16,21)\tFinnen-Baguette (21,a,f)\t\t\t\t\tBollywood curly kale casserole with chickpeas and coconut milk (1,16,21)\tFinn baguette (21,a,f)\t\t\t\t\t1,80\t3,40\t4,20\tg\t2\t\t1, 16, 21, a, f, 0\tmit Farbstoff, KlimaTeller, vegan, Glutenhaltiges Getreide (a), Soja (f), zusatzstoff- und allergenfrei\t-\tBrennwert=2391 kJ (571 kcal), Fett=19,1g, davon gesättigte Fettsäuren=8,1g, Kohlenhydrate=65,3g, davon Zucker=13,1g, Ballaststoffe=5,8g, Eiweiß=25,7g, Salz=6,6g,\nMensa Vechta\t28.01.2022\t1714\t3614\tEintopf (Terrine, Teller)\tEintopf Terrine\t2959\tGrünkohleintopf Bollywood mit Kichererbsen und Kokosmilch (1,16,21)\tFinnen-Baguette (21,a,f)\t\t\t\t\tBollywood curly kale casserole with chickpeas and coconut milk (1,16,21)\tFinn baguette (21,a,f)\t\t\t\t\t1,80\t3,40\t4,20\tg\t2\t\t1, 16, 21, a, f, 0\tmit Farbstoff, KlimaTeller, vegan, Glutenhaltiges Getreide (a), Soja (f), zusatzstoff- und allergenfrei\t-\tBrennwert=2391 kJ (571 kcal), Fett=19,1g, davon gesättigte Fettsäuren=8,1g, Kohlenhydrate=65,3g, davon Zucker=13,1g, Ballaststoffe=5,8g, Eiweiß=25,7g, Salz=6,6g,\nMensa Vechta\t28.01.2022\t2130\t4388\tKM 1 veget./vegan,+1,35 €\tHauptgericht\t2637\tHalloumisteak mit Grillgemüse und Rosmarinkartoffeln (2,20,g)\t\t\t\t\t\tHalloumi steak with grilled vegetables and rosemary potatoes (2,20,g)\t\t\t\t\t\t3,50\t4,85\t5,65\ta\t2\t\t2, 20, g, 0\tmit Konservierungsstoff, vegetarisch, Milch und Laktose (g), zusatzstoff- und allergenfrei\t-\tBrennwert=3133 kJ (748 kcal), Fett=44,7g, davon gesättigte Fettsäuren=17,4g, Kohlenhydrate=53,6g, davon Zucker=12,1g, Ballaststoffe=8,4g, Eiweiß=29,5g, Salz=2,8g,\nMensa Vechta\t28.01.2022\t1701\t3648\tStärkebeilage 3\tBeilagen\t525\tPommes frites klein (21)\t\t\t\t\t\tPommes frites small (21)\t\t\t\t\t\t0,55\t1,05\t1,25\tc\t2\t\t21, 0\tvegan, zusatzstoff- und allergenfrei\t-\tBrennwert=1097 kJ (262 kcal), Fett=12,1g, davon gesättigte Fettsäuren=4,4g, Kohlenhydrate=33,0g, davon Zucker=0,8g, Ballaststoffe=3,0g, Eiweiß=3,8g, Salz=1,0g,\nMensa Vechta\t28.01.2022\t2130\t10518\tKM 5 veget./vegan,+1,35 €\tHauptgericht\t3183\tPommes frites groß (21)\t\t\t\t\t\tPommes frites large (21)\t\t\t\t\t\t1,00\t2,35\t3,15\tc\t2\t\t21, 0\tvegan, zusatzstoff- und allergenfrei\t-\tBrennwert=2194 kJ (524 kcal), Fett=24,2g, davon gesättigte Fettsäuren=8,8g, Kohlenhydrate=66,0g, davon Zucker=1,5g, Ballaststoffe=6,0g, Eiweiß=7,5g, Salz=1,6g,\nMensa Vechta\t28.01.2022\t2130\t4389\tKM 2 Fleisch/Fisc,+1,55 €\tHauptgericht\t1624\tFish & Chips mit dänischer Remoulade (2,3,8,9,24,d,a,c,g,k,i,j,43)\t\t\t\t\t\tFish & chips with Danish remoulade sauce (2,3,8,9,24,d,a,c,g,k,i,j,43)\t\t\t\t\t\t2,65\t4,20\t5,00\tc\t2\t\t2, 3, 8, 9, 24, d, a, c, g, k, i, j, 43, 0\tmit Konservierungsstoff, mit Antioxidationsmittel, mit Phosphat, mit Süßungsmitteln, Fisch aus nachhaltiger Fischerei, Fisch (d), Glutenhaltiges Getreide (a), Hühnerei (c), Milch und Laktose (g), Schwefeldioxid u. Sulfite (k), Sellerie (i), Senf (j), Fisch, zusatzstoff- und allergenfrei\t-\tBrennwert=4115 kJ (983 kcal), Fett=69,4g, davon gesättigte Fettsäuren=5,8g, Kohlenhydrate=60,0g, davon Zucker=5,7g, Ballaststoffe=4,2g, Eiweiß=28,0g, Salz=5,1g,\nMensa Westerberg\t28.01.2022\t2097\t3665\tDessert 1\tDessert\t461\tQuark (20,g)\tWaldbeersauce\t\t\t\t\tQuark dessert (20,g)\tForest berry sauce\t\t\t\t\t0,50\t1,00\t1,20\tc\t\t\t20, g, 0\tvegetarisch, Milch und Laktose (g), zusatzstoff- und allergenfrei\t-\tBrennwert=605 kJ (144 kcal), Fett=1,1g, davon gesättigte Fettsäuren=0,6g, Kohlenhydrate=19,0g, davon Zucker=18,3g, Ballaststoffe=0,1g, Eiweiß=12,8g, Salz=0,1g,\nMensa Westerberg\t28.01.2022\t2130\t4389\tKM 2 Fleisch/Fisc,+1,55 €\tHauptgericht\t1624\tFish & Chips mit dänischer Remoulade (2,3,8,9,24,d,a,c,g,k,i,j,43)\t\t\t\t\t\tFish & chips with Danish remoulade sauce (2,3,8,9,24,d,a,c,g,k,i,j,43)\t\t\t\t\t\t2,65\t4,20\t5,00\tc\t\t\t2, 3, 8, 9, 24, d, a, c, g, k, i, j, 43, 0\tmit Konservierungsstoff, mit Antioxidationsmittel, mit Phosphat, mit Süßungsmitteln, Fisch aus nachhaltiger Fischerei, Fisch (d), Glutenhaltiges Getreide (a), Hühnerei (c), Milch und Laktose (g), Schwefeldioxid u. Sulfite (k), Sellerie (i), Senf (j), Fisch, zusatzstoff- und allergenfrei\t-\tBrennwert=4116 kJ (983 kcal), Fett=69,5g, davon gesättigte Fettsäuren=5,8g, Kohlenhydrate=60,0g, davon Zucker=5,7g, Ballaststoffe=4,2g, Eiweiß=28,0g, Salz=5,2g,\nMensa Westerberg\t28.01.2022\t1714\t3614\tEintopf (Terrine, Teller)\tEintopf Terrine\t2208\tGrünkohleintopf Bollywood mit Kichererbsen und Kokosmilch (1,16,21)\tWeizenbrötchen (1,21,a,f)\t\t\t\t\tBollywood curly kale casserole with chickpeas and coconut milk (1,16,21)\tBread roll (1,21,a,f)\t\t\t\t\t1,80\t3,40\t4,20\tg\t\t\t1, 16, 21, a, f, 0\tmit Farbstoff, KlimaTeller, vegan, Glutenhaltiges Getreide (a), Soja (f), zusatzstoff- und allergenfrei\t-\tBrennwert=2416 kJ (577 kcal), Fett=15,3g, davon gesättigte Fettsäuren=7,9g, Kohlenhydrate=75,8g, davon Zucker=13,0g, Ballaststoffe=6,0g, Eiweiß=24,4g, Salz=6,9g,\nMensa Westerberg\t28.01.2022\t1714\t3614\tEintopf (Terrine, Teller)\tEintopf Terrine\t2045\tGrünkohleintopf Bollywood mit Kichererbsen und Kokosmilch (1,16,21)\tWeizenbrötchen (1,21,a,f)\t\t\t\t\tBollywood curly kale casserole with chickpeas and coconut milk (1,16,21)\tBread roll (1,21,a,f)\t\t\t\t\t1,80\t3,40\t4,20\tg\t\t\t1, 16, 21, a, f, 0\tmit Farbstoff, KlimaTeller, vegan, Glutenhaltiges Getreide (a), Soja (f), zusatzstoff- und allergenfrei\t-\tBrennwert=2416 kJ (577 kcal), Fett=15,3g, davon gesättigte Fettsäuren=7,9g, Kohlenhydrate=75,8g, davon Zucker=13,0g, Ballaststoffe=6,0g, Eiweiß=24,4g, Salz=6,9g,\nMensa Westerberg\t28.01.2022\t2130\t4388\tKM 1 veget./vegan,+1,35 €\tHauptgericht\t2637\tHalloumisteak mit Grillgemüse und Rosmarinkartoffeln (2,20,g)\t\t\t\t\t\tHalloumi steak with grilled vegetables and rosemary potatoes (2,20,g)\t\t\t\t\t\t3,50\t4,85\t5,65\ta\t\t\t2, 20, g, 0\tmit Konservierungsstoff, vegetarisch, Milch und Laktose (g), zusatzstoff- und allergenfrei\t-\tBrennwert=3135 kJ (749 kcal), Fett=44,7g, davon gesättigte Fettsäuren=17,4g, Kohlenhydrate=53,7g, davon Zucker=12,2g, Ballaststoffe=8,5g, Eiweiß=29,6g, Salz=2,8g,\nMensa Westerberg\t28.01.2022\t2130\t10518\tKM 5 veget./vegan,+1,35 €\tHauptgericht\t3183\tPommes frites groß (21)\t\t\t\t\t\tPommes frites large (21)\t\t\t\t\t\t1,00\t2,35\t3,15\tc\t\t\t21, 0\tvegan, zusatzstoff- und allergenfrei\t-\tBrennwert=2194 kJ (524 kcal), Fett=24,2g, davon gesättigte Fettsäuren=8,8g, Kohlenhydrate=66,0g, davon Zucker=1,5g, Ballaststoffe=6,0g, Eiweiß=7,5g, Salz=1,6g,\nMensa Westerberg\t28.01.2022\t1701\t3646\tGemüsebeilage 3/Tagessala\tTagessalat\t477\tMensa-Salatmix (3,21,k,j)\t\t\t\t\t\tMixed salad (3,21,k,j)\t\t\t\t\t\t0,50\t1,00\t1,20\ta\t\t\t3, 21, k, j, 0\tmit Antioxidationsmittel, vegan, Schwefeldioxid u. Sulfite (k), Senf (j), zusatzstoff- und allergenfrei\t-\tBrennwert=624 kJ (149 kcal), Fett=9,5g, davon gesättigte Fettsäuren=0,8g, Kohlenhydrate=8,9g, davon Zucker=6,7g, Ballaststoffe=4,8g, Eiweiß=2,7g, Salz=0,2g,\nMensa Westerberg\t28.01.2022\t1701\t3648\tStärkebeilage 3\tBeilagen\t525\tPommes frites klein (21)\t\t\t\t\t\tPommes frites small (21)\t\t\t\t\t\t0,55\t1,05\t1,25\tc\t\t\t21, 0\tvegan, zusatzstoff- und allergenfrei\t-\tBrennwert=1097 kJ (262 kcal), Fett=12,1g, davon gesättigte Fettsäuren=4,4g, Kohlenhydrate=33,0g, davon Zucker=0,8g, Ballaststoffe=3,0g, Eiweiß=3,8g, Salz=1,0g,\nMensa Westerberg\t28.01.2022\t2097\t3665\tDessert 1\tDessert\t280\tQuark (20,g)\tWaldbeersauce\t\t\t\t\tQuark dessert (20,g)\tForest berry sauce\t\t\t\t\t0,50\t1,00\t1,20\tc\t\t\t20, g, 0\tvegetarisch, Milch und Laktose (g), zusatzstoff- und allergenfrei\t-\tBrennwert=605 kJ (144 kcal), Fett=1,1g, davon gesättigte Fettsäuren=0,6g, Kohlenhydrate=19,0g, davon Zucker=18,3g, Ballaststoffe=0,1g, Eiweiß=12,8g, Salz=0,1g,\nMensa Schlossgarten\t29.01.2022\t2130\t10518\tKM 5 veget./vegan,+1,35 €\tHauptgericht\t3183\t\t\t\t\t\t\t\t\t\t\t\t\t1,00\t2,35\t3,15\tc\t\t\t21, 0\tvegan, zusatzstoff- und allergenfrei\t-\t-\nMensa Schlossgarten\t29.01.2022\t2130\t4389\tKM 2 Fleisch/Fisc,+1,55 €\tHauptgericht\t933\tHähnchenkebab mit Joghurtdip und Salat im Pitabrötchen (17,a,g,m,f,40)\t\t\t\t\t\tChicken kebab with yogurt dip and salad in pita bread (17,a,g,m,f,40)\t\t\t\t\t\t3,00\t4,55\t5,35\tc\t\t\t17, a, g, m, f, 40, 0\tKnoblauch, Glutenhaltiges Getreide (a), Milch und Laktose (g), Sesam (m), Soja (f), Geflügel, zusatzstoff- und allergenfrei\t-\tBrennwert=2455 kJ (586 kcal), Fett=12,7g, davon gesättigte Fettsäuren=3,1g, Kohlenhydrate=67,9g, davon Zucker=11,2g, Ballaststoffe=4,7g, Eiweiß=28,7g, Salz=3,7g,\nMensa Schlossgarten\t29.01.2022\t2097\t3665\tDessert 1\tDessert\t458\tStracciatellapudding (20,g)\t\t\t\t\t\tStracciatella pudding (20,g)\t\t\t\t\t\t0,40\t0,90\t1,10\tc\t\t\t20, g, 0\tvegetarisch, Milch und Laktose (g), zusatzstoff- und allergenfrei\t-\tBrennwert=738 kJ (176 kcal), Fett=6,3g, davon gesättigte Fettsäuren=4,1g, Kohlenhydrate=24,6g, davon Zucker=17,6g, Eiweiß=4,9g, Salz=0,2g,\nMensa Schlossgarten\t29.01.2022\t1701\t3646\tGemüsebeilage 3/Tagessala\tTagessalat\t731\tBunter Chinakohlsalat (21,j)\t\t\t\t\t\tColourful Chinese cabbage salad (21,j)\t\t\t\t\t\t0,45\t0,95\t1,15\ta\t\t\t21, j, 0\tvegan, Senf (j), zusatzstoff- und allergenfrei\t-\tBrennwert=516 kJ (123 kcal), Fett=6,4g, davon gesättigte Fettsäuren=0,7g, Kohlenhydrate=9,2g, davon Zucker=5,6g, Ballaststoffe=4,9g, Eiweiß=3,0g, Salz=1,3g,\nMensa Schlossgarten\t29.01.2022\t1701\t3648\tStärkebeilage 3\tBeilagen\t525\t\t\t\t\t\t\t\t\t\t\t\t\t0,55\t1,05\t1,25\tc\t\t\t21, 0\tvegan, zusatzstoff- und allergenfrei\t-\t-\nMensa Schlossgarten\t29.01.2022\t2130\t4388\tKM 1 veget./vegan,+1,35 €\tHauptgericht\t718\tGebratene Udonnudeln mit Pilzen und Gemüse (21,a,m,f)\t\t\t\t\t\tFried Udon noodles with mushrooms and vegetables (21,a,m,f)\t\t\t\t\t\t2,00\t3,35\t4,15\tg\t\t\t21, a, m, f, 0\tvegan, Glutenhaltiges Getreide (a), Sesam (m), Soja (f), zusatzstoff- und allergenfrei\t-\tBrennwert=2044 kJ (488 kcal), Fett=8,7g, davon gesättigte Fettsäuren=0,8g, Kohlenhydrate=80,7g, davon Zucker=5,5g, Ballaststoffe=5,9g, Eiweiß=19,4g, Salz=3,5g,\nMensa Haste\t31.01.2022\t2130\t10518\tKM 5 veget./vegan,+1,35 €\tHauptgericht\t3183\tPommes frites groß (21)\t\t\t\t\t\tPommes frites large (21)\t\t\t\t\t\t1,00\t2,35\t3,15\tc\t2\t\t21, 0\tvegan, zusatzstoff- und allergenfrei\t-\t-\nMensa Haste\t31.01.2022\t1714\t3614\tEintopf (Terrine, Teller)\tEintopf Terrine\t2950\tErdnuss-Laucheintopf mit Rindfleisch und Kokos (14,18,e,g)\tMehrkornbrötchen (20,a,g,m,f)\t\t\t\t\tPeanut and leek stew with beef and coconut (14,18,e,g)\tMulti-seed roll (20,a,g,m,f)\t\t\t\t\t1,80\t3,40\t4,20\tc\t2\t\t14, 18, 20, 22, e, a, g, m, f, 0\tRindfleisch, Fleisch aus artgerechter Tierhaltung, vegetarisch, nicht vegan/vegetarisch (tierische Hilfsstoffe), Erdnüsse (e), Glutenhaltiges Getreide (a), Milch und Laktose (g), Sesam (m), Soja (f), zusatzstoff- und allergenfrei\t-\tBrennwert=3056 kJ (730 kcal), Fett=31,6g, davon gesättigte Fettsäuren=16,3g, Kohlenhydrate=71,0g, davon Zucker=20,2g, Ballaststoffe=5,9g, Eiweiß=32,8g, Salz=6,9g,\nMensa Haste\t31.01.2022\t1701\t3648\tStärkebeilage 3\tBeilagen\t525\tPommes frites klein (21)\t\t\t\t\t\tPommes frites small (21)\t\t\t\t\t\t0,55\t1,05\t1,25\tc\t2\t\t21, 0\tvegan, zusatzstoff- und allergenfrei\t-\t-\nMensa Haste\t31.01.2022\t2130\t4388\tKM 1 veget./vegan,+1,35 €\tHauptgericht\t3169\tSüßkartoffelpfanne mit Quinoa, Wirsing und Cranberries (1,16,21,h)\tMinzcremedip (17,21,f)\t\t\t\t\tSweet potato pan with quinoa, savoy cabbage and cranberries (1,16,21,h)\tMint cream dip (17,21,f)\t\t\t\t\t1,80\t3,15\t3,95\tg\t2\t\t1, 16, 17, 21, h, f, 0\tmit Farbstoff, KlimaTeller, Knoblauch, vegan, Schalenfrüchte (Nüsse) (h), Soja (f), zusatzstoff- und allergenfrei\t-\tBrennwert=2847 kJ (680 kcal), Fett=18,6g, davon gesättigte Fettsäuren=3,2g, Kohlenhydrate=105,6g, davon Zucker=23,4g, Ballaststoffe=15,1g, Eiweiß=15,7g, Salz=6,1g,\nMensa Haste\t31.01.2022\t2130\t4388\tKM 1 veget./vegan,+1,35 €\tHauptgericht\t2313\tSüßkartoffelpfanne mit Quinoa, Wirsing und Cranberries (1,16,21,h)\tMinzcremedip (17,21,f)\t\t\t\t\tSweet potato pan with quinoa, savoy cabbage and cranberries (1,16,21,h)\tMint cream dip (17,21,f)\t\t\t\t\t1,80\t3,15\t3,95\tg\t2\t\t1, 16, 17, 21, h, f, 0\tmit Farbstoff, KlimaTeller, Knoblauch, vegan, Schalenfrüchte (Nüsse) (h), Soja (f), zusatzstoff- und allergenfrei\t-\tBrennwert=2847 kJ (680 kcal), Fett=18,6g, davon gesättigte Fettsäuren=3,2g, Kohlenhydrate=105,6g, davon Zucker=23,4g, Ballaststoffe=15,1g, Eiweiß=15,7g, Salz=6,1g,\nMensa Haste\t31.01.2022\t2130\t6510\tKM 3 veget./vegan,+1,35 €\tHauptgericht\t113\tLasagne verde al forno - Grüner Nudelauflauf (1,20,a,g,i)\t\t\t\t\t\tLasagne verde al forno - Green pasta bake (1,20,a,g,i)\t\t\t\t\t\t0,00\t1,35\t2,15\tc\t\t\t1, 20, 22, a, g, i, 0\tmit Farbstoff, vegetarisch, nicht vegan/vegetarisch (tierische Hilfsstoffe), Glutenhaltiges Getreide (a), Milch und Laktose (g), Sellerie (i), zusatzstoff- und allergenfrei\t-\tBrennwert=1686 kJ (403 kcal), Fett=19,2g, davon gesättigte Fettsäuren=8,8g, Kohlenhydrate=37,3g, davon Zucker=8,1g, Ballaststoffe=2,2g, Eiweiß=17,1g, Salz=5,9g,\nMensa Haste\t31.01.2022\t1714\t3614\tEintopf (Terrine, Teller)\tEintopf Terrine\t1682\tErdnuss-Laucheintopf mit Rindfleisch und Kokos (14,18,e,g)\tMehrkornbrötchen (20,a,g,m,f)\t\t\t\t\tPeanut and leek stew with beef and coconut (14,18,e,g)\tMulti-seed roll (20,a,g,m,f)\t\t\t\t\t1,80\t3,40\t4,20\tc\t2\t\t14, 18, 20, 22, e, a, g, m, f, 0\tRindfleisch, Fleisch aus artgerechter Tierhaltung, vegetarisch, nicht vegan/vegetarisch (tierische Hilfsstoffe), Erdnüsse (e), Glutenhaltiges Getreide (a), Milch und Laktose (g), Sesam (m), Soja (f), zusatzstoff- und allergenfrei\t-\tBrennwert=3056 kJ (730 kcal), Fett=31,6g, davon gesättigte Fettsäuren=16,3g, Kohlenhydrate=71,0g, davon Zucker=20,2g, Ballaststoffe=5,9g, Eiweiß=32,8g, Salz=6,9g,\nMensa Lingen\t31.01.2022\t2130\t10518\tKM 5 veget./vegan,+1,35 €\tHauptgericht\t3183\tPommes frites groß (21)\t\t\t\t\t\tPommes frites large (21)\t\t\t\t\t\t1,00\t2,35\t3,15\tc\t2\t\t21, 0\tvegan, zusatzstoff- und allergenfrei\t-\t-\nMensa Lingen\t31.01.2022\t1714\t3614\tEintopf (Terrine, Teller)\tEintopf Terrine\t1682\tErdnuss-Laucheintopf mit Rindfleisch und Kokos (14,18,e,g)\tMehrkornbrötchen (20,a,g,m,f)\t\t\t\t\tPeanut and leek stew with beef and coconut (14,18,e,g)\tMulti-seed roll (20,a,g,m,f)\t\t\t\t\t1,80\t3,40\t4,20\tc\t2\t\t14, 18, 20, 22, e, a, g, m, f, 0\tRindfleisch, Fleisch aus artgerechter Tierhaltung, vegetarisch, nicht vegan/vegetarisch (tierische Hilfsstoffe), Erdnüsse (e), Glutenhaltiges Getreide (a), Milch und Laktose (g), Sesam (m), Soja (f), zusatzstoff- und allergenfrei\t-\tBrennwert=3060 kJ (731 kcal), Fett=31,6g, davon gesättigte Fettsäuren=16,3g, Kohlenhydrate=71,0g, davon Zucker=20,2g, Ballaststoffe=6,0g, Eiweiß=32,9g, Salz=6,9g,\nMensa Lingen\t31.01.2022\t1714\t3614\tEintopf (Terrine, Teller)\tEintopf Terrine\t2950\tErdnuss-Laucheintopf mit Rindfleisch und Kokos (14,18,e,g)\tMehrkornbrötchen (20,a,g,m,f)\t\t\t\t\tPeanut and leek stew with beef and coconut (14,18,e,g)\tMulti-seed roll (20,a,g,m,f)\t\t\t\t\t1,80\t3,40\t4,20\tc\t2\t\t14, 18, 20, 22, e, a, g, m, f, 0\tRindfleisch, Fleisch aus artgerechter Tierhaltung, vegetarisch, nicht vegan/vegetarisch (tierische Hilfsstoffe), Erdnüsse (e), Glutenhaltiges Getreide (a), Milch und Laktose (g), Sesam (m), Soja (f), zusatzstoff- und allergenfrei\t-\tBrennwert=3060 kJ (731 kcal), Fett=31,6g, davon gesättigte Fettsäuren=16,3g, Kohlenhydrate=71,0g, davon Zucker=20,2g, Ballaststoffe=6,0g, Eiweiß=32,9g, Salz=6,9g,\nMensa Lingen\t31.01.2022\t1701\t3648\tStärkebeilage 3\tBeilagen\t525\tPommes frites klein (21)\t\t\t\t\t\tPommes frites small (21)\t\t\t\t\t\t0,55\t1,05\t1,25\tc\t2\t\t21, 0\tvegan, zusatzstoff- und allergenfrei\t-\t-\nMensa Lingen\t31.01.2022\t2130\t4388\tKM 1 veget./vegan,+1,35 €\tHauptgericht\t3169\tSüßkartoffelpfanne mit Quinoa, Wirsing und Cranberries (1,16,21,h)\tMinzcremedip (17,21,f)\t\t\t\t\tSweet potato pan with quinoa, savoy cabbage and cranberries (1,16,21,h)\tMint cream dip (17,21,f)\t\t\t\t\t1,80\t3,15\t3,95\tg\t2\t\t1, 16, 17, 21, h, f, 0\tmit Farbstoff, KlimaTeller, Knoblauch, vegan, Schalenfrüchte (Nüsse) (h), Soja (f), zusatzstoff- und allergenfrei\t-\tBrennwert=2847 kJ (680 kcal), Fett=18,6g, davon gesättigte Fettsäuren=3,2g, Kohlenhydrate=105,6g, davon Zucker=23,4g, Ballaststoffe=15,1g, Eiweiß=15,7g, Salz=6,1g,\nMensa Lingen\t31.01.2022\t2130\t4388\tKM 1 veget./vegan,+1,35 €\tHauptgericht\t2313\tSüßkartoffelpfanne mit Quinoa, Wirsing und Cranberries (1,16,21,h)\tMinzcremedip (17,21,f)\t\t\t\t\tSweet potato pan with quinoa, savoy cabbage and cranberries (1,16,21,h)\tMint cream dip (17,21,f)\t\t\t\t\t1,80\t3,15\t3,95\tg\t2\t\t1, 16, 17, 21, h, f, 0\tmit Farbstoff, KlimaTeller, Knoblauch, vegan, Schalenfrüchte (Nüsse) (h), Soja (f), zusatzstoff- und allergenfrei\t-\tBrennwert=2847 kJ (680 kcal), Fett=18,6g, davon gesättigte Fettsäuren=3,2g, Kohlenhydrate=105,6g, davon Zucker=23,4g, Ballaststoffe=15,1g, Eiweiß=15,7g, Salz=6,1g,\nMensa Schlossgarten\t31.01.2022\t2130\t4388\tKM 1 veget./vegan,+1,35 €\tHauptgericht\t3169\tSüßkartoffelpfanne mit Quinoa, Wirsing und Cranberries (1,16,21,h)\tMinzcremedip (17,21,f)\t\t\t\t\tSweet potato pan with quinoa, savoy cabbage and cranberries (1,16,21,h)\tMint cream dip (17,21,f)\t\t\t\t\t1,80\t3,15\t3,95\tg\t\t\t1, 16, 17, 21, h, f, 0\tmit Farbstoff, KlimaTeller, Knoblauch, vegan, Schalenfrüchte (Nüsse) (h), Soja (f), zusatzstoff- und allergenfrei\t-\tBrennwert=2846 kJ (680 kcal), Fett=18,5g, davon gesättigte Fettsäuren=3,2g, Kohlenhydrate=105,6g, davon Zucker=23,3g, Ballaststoffe=15,1g, Eiweiß=15,7g, Salz=5,9g,\nMensa Schlossgarten\t31.01.2022\t2130\t4388\tKM 1 veget./vegan,+1,35 €\tHauptgericht\t2313\tSüßkartoffelpfanne mit Quinoa, Wirsing und Cranberries (1,16,21,h)\tMinzcremedip (17,21,f)\t\t\t\t\tSweet potato pan with quinoa, savoy cabbage and cranberries (1,16,21,h)\tMint cream dip (17,21,f)\t\t\t\t\t1,80\t3,15\t3,95\tg\t\t\t1, 16, 17, 21, h, f, 0\tmit Farbstoff, KlimaTeller, Knoblauch, vegan, Schalenfrüchte (Nüsse) (h), Soja (f), zusatzstoff- und allergenfrei\t-\tBrennwert=2846 kJ (680 kcal), Fett=18,5g, davon gesättigte Fettsäuren=3,2g, Kohlenhydrate=105,6g, davon Zucker=23,3g, Ballaststoffe=15,1g, Eiweiß=15,7g, Salz=5,9g,\nMensa Schlossgarten\t31.01.2022\t1701\t3648\tStärkebeilage 3\tBeilagen\t525\tPommes frites klein (21)\t\t\t\t\t\tPommes frites small (21)\t\t\t\t\t\t0,55\t1,05\t1,25\tc\t\t\t21, 0\tvegan, zusatzstoff- und allergenfrei\t-\t-\nMensa Schlossgarten\t31.01.2022\t1701\t3646\tGemüsebeilage 3/Tagessala\tTagessalat\t470\tFarmersalat (20,c,g,i,j)\t\t\t\t\t\tFarmer’s salad (20,c,g,i,j)\t\t\t\t\t\t0,50\t1,00\t1,20\tc\t\t\t20, c, g, i, j, 0\tvegetarisch, Hühnerei (c), Milch und Laktose (g), Sellerie (i), Senf (j), zusatzstoff- und allergenfrei\t-\tBrennwert=1393 kJ (333 kcal), Fett=28,5g, davon gesättigte Fettsäuren=4,2g, Kohlenhydrate=13,5g, davon Zucker=11,9g, Ballaststoffe=4,1g, Eiweiß=2,9g, Salz=2,2g,\nMensa Schlossgarten\t31.01.2022\t1714\t3614\tEintopf (Terrine, Teller)\tEintopf Terrine\t1682\tErdnuss-Laucheintopf mit Rindfleisch und Kokos (14,18,e,g)\tMehrkornbrötchen (20,a,g,m,f)\t\t\t\t\tPeanut and leek stew with beef and coconut (14,18,e,g)\tMulti-seed roll (20,a,g,m,f)\t\t\t\t\t1,80\t3,40\t4,20\tc\t\t\t14, 18, 20, 22, e, a, g, m, f, 0\tRindfleisch, Fleisch aus artgerechter Tierhaltung, vegetarisch, nicht vegan/vegetarisch (tierische Hilfsstoffe), Erdnüsse (e), Glutenhaltiges Getreide (a), Milch und Laktose (g), Sesam (m), Soja (f), zusatzstoff- und allergenfrei\t-\tBrennwert=3061 kJ (731 kcal), Fett=31,6g, davon gesättigte Fettsäuren=16,3g, Kohlenhydrate=71,1g, davon Zucker=20,2g, Ballaststoffe=6,0g, Eiweiß=32,9g, Salz=6,9g,\nMensa Schlossgarten\t31.01.2022\t1714\t3614\tEintopf (Terrine, Teller)\tEintopf Terrine\t2950\tErdnuss-Laucheintopf mit Rindfleisch und Kokos (14,18,e,g)\tMehrkornbrötchen (20,a,g,m,f)\t\t\t\t\tPeanut and leek stew with beef and coconut (14,18,e,g)\tMulti-seed roll (20,a,g,m,f)\t\t\t\t\t1,80\t3,40\t4,20\tc\t\t\t14, 18, 20, 22, e, a, g, m, f, 0\tRindfleisch, Fleisch aus artgerechter Tierhaltung, vegetarisch, nicht vegan/vegetarisch (tierische Hilfsstoffe), Erdnüsse (e), Glutenhaltiges Getreide (a), Milch und Laktose (g), Sesam (m), Soja (f), zusatzstoff- und allergenfrei\t-\tBrennwert=3061 kJ (731 kcal), Fett=31,6g, davon gesättigte Fettsäuren=16,3g, Kohlenhydrate=71,1g, davon Zucker=20,2g, Ballaststoffe=6,0g, Eiweiß=32,9g, Salz=6,9g,\nMensa Schlossgarten\t31.01.2022\t2130\t10190\tKM 4 Fleisch/Fisc,+1,55 €\tHauptgericht\t3328\tAlpen Burger mit Weißwurst-Patty, Obazda, Salzbrezeln und Apfelkraut (1,3,8,13,14,a,c,g,k,j)\t\t\t\t\t\tAlpine burger with white sausage patty, Obazda, salted pretzels and apple slaw (1,3,8,13,14,a,c,g,k,j)\t\t\t\t\t\t0,00\t1,55\t2,35\tc\t\t\t1, 3, 8, 13, 14, 22, a, c, g, k, j, 0\tmit Farbstoff, mit Antioxidationsmittel, mit Phosphat, Schweinefleisch, Rindfleisch, nicht vegan/vegetarisch (tierische Hilfsstoffe), Glutenhaltiges Getreide (a), Hühnerei (c), Milch und Laktose (g), Schwefeldioxid u. Sulfite (k), Senf (j), zusatzstoff- und allergenfrei\t-\tBrennwert=3701 kJ (884 kcal), Fett=41,0g, davon gesättigte Fettsäuren=11,4g, Kohlenhydrate=101,1g, davon Zucker=18,8g, Ballaststoffe=5,1g, Eiweiß=22,5g, Salz=3,9g,\nMensa Schlossgarten\t31.01.2022\t2130\t6510\tKM 3 veget./vegan,+1,35 €\tHauptgericht\t113\tLasagne verde al forno - Grüner Nudelauflauf (1,20,a,g,i)\t\t\t\t\t\tLasagne verde al forno - Green pasta bake (1,20,a,g,i)\t\t\t\t\t\t0,00\t1,35\t2,15\tc\t\t\t1, 20, 22, a, g, i, 0\tmit Farbstoff, vegetarisch, nicht vegan/vegetarisch (tierische Hilfsstoffe), Glutenhaltiges Getreide (a), Milch und Laktose (g), Sellerie (i), zusatzstoff- und allergenfrei\t-\tBrennwert=1683 kJ (402 kcal), Fett=19,1g, davon gesättigte Fettsäuren=8,7g, Kohlenhydrate=37,4g, davon Zucker=8,1g, Ballaststoffe=2,1g, Eiweiß=17,1g, Salz=5,9g,\nMensa Schlossgarten\t31.01.2022\t2097\t3665\tDessert 1\tDessert\t289\tNougatquark (20,g,h)\t\t\t\t\t\tNougat quark (20,g,h)\t\t\t\t\t\t0,50\t1,00\t1,20\tc\t\t\t20, g, h, 0\tvegetarisch, Milch und Laktose (g), Schalenfrüchte (Nüsse) (h), zusatzstoff- und allergenfrei\t-\tBrennwert=872 kJ (208 kcal), Fett=6,7g, davon gesättigte Fettsäuren=3,2g, Kohlenhydrate=19,5g, davon Zucker=19,4g, Ballaststoffe=0,1g, Eiweiß=15,6g, Salz=0,2g,\nMensa Schlossgarten\t31.01.2022\t2130\t10518\tKM 5 veget./vegan,+1,35 €\tHauptgericht\t3183\tPommes frites groß (21)\t\t\t\t\t\tPommes frites large (21)\t\t\t\t\t\t1,00\t2,35\t3,15\tc\t\t\t21, 0\tvegan, zusatzstoff- und allergenfrei\t-\tBrennwert=2194 kJ (524 kcal), Fett=24,2g, davon gesättigte Fettsäuren=8,8g, Kohlenhydrate=66,0g, davon Zucker=1,5g, Ballaststoffe=6,0g, Eiweiß=7,5g, Salz=1,6g,\nMensa Vechta\t31.01.2022\t1701\t3648\tStärkebeilage 3\tBeilagen\t525\tPommes frites klein (21)\t\t\t\t\t\tPommes frites small (21)\t\t\t\t\t\t0,55\t1,05\t1,25\tc\t2\t\t21, 0\tvegan, zusatzstoff- und allergenfrei\t-\t-\nMensa Vechta\t31.01.2022\t2130\t6510\tKM 3 veget./vegan,+1,35 €\tHauptgericht\t342\tLasagne verde al forno - Grüner Nudelauflauf (1,20,a,g,i)\tTomatensauce (21)\t\t\t\t\tLasagne verde al forno - Green pasta bake (1,20,a,g,i)\tTomato sauce (21)\t\t\t\t\t0,00\t1,35\t2,15\tc\t\t\t1, 20, 21, 22, a, g, i, 0\tmit Farbstoff, vegetarisch, vegan, nicht vegan/vegetarisch (tierische Hilfsstoffe), Glutenhaltiges Getreide (a), Milch und Laktose (g), Sellerie (i), zusatzstoff- und allergenfrei\t-\tBrennwert=1924 kJ (459 kcal), Fett=22,1g, davon gesättigte Fettsäuren=9,0g, Kohlenhydrate=43,5g, davon Zucker=12,4g, Ballaststoffe=2,4g, Eiweiß=18,3g, Salz=7,7g,\nMensa Vechta\t31.01.2022\t1714\t3614\tEintopf (Terrine, Teller)\tEintopf Terrine\t1682\tErdnuss-Laucheintopf mit Rindfleisch und Kokos (14,18,e,g)\tBaguette (21,a)\t\t\t\t\tPeanut and leek stew with beef and coconut (14,18,e,g)\tBaguette (21,a)\t\t\t\t\t1,80\t3,40\t4,20\tc\t2\t\t14, 18, 21, 22, e, a, g, 0\tRindfleisch, Fleisch aus artgerechter Tierhaltung, vegan, nicht vegan/vegetarisch (tierische Hilfsstoffe), Erdnüsse (e), Glutenhaltiges Getreide (a), Milch und Laktose (g), zusatzstoff- und allergenfrei\t-\tBrennwert=2702 kJ (645 kcal), Fett=27,9g, davon gesättigte Fettsäuren=15,6g, Kohlenhydrate=63,5g, davon Zucker=19,5g, Ballaststoffe=5,9g, Eiweiß=28,2g, Salz=6,6g,\nMensa Vechta\t31.01.2022\t2130\t4388\tKM 1 veget./vegan,+1,35 €\tHauptgericht\t2313\tSüßkartoffelpfanne mit Quinoa, Wirsing und Cranberries (1,16,21,h)\tMinzcremedip (17,21,f)\t\t\t\t\tSweet potato pan with quinoa, savoy cabbage and cranberries (1,16,21,h)\tMint cream dip (17,21,f)\t\t\t\t\t1,80\t3,15\t3,95\tg\t2\t\t1, 16, 17, 21, h, f, 0\tmit Farbstoff, KlimaTeller, Knoblauch, vegan, Schalenfrüchte (Nüsse) (h), Soja (f), zusatzstoff- und allergenfrei\t-\tBrennwert=2849 kJ (680 kcal), Fett=18,5g, davon gesättigte Fettsäuren=3,2g, Kohlenhydrate=105,7g, davon Zucker=23,3g, Ballaststoffe=15,2g, Eiweiß=15,7g, Salz=5,9g,\nMensa Vechta\t31.01.2022\t2130\t4388\tKM 1 veget./vegan,+1,35 €\tHauptgericht\t3169\tSüßkartoffelpfanne mit Quinoa, Wirsing und Cranberries (1,16,21,h)\tMinzcremedip (17,21,f)\t\t\t\t\tSweet potato pan with quinoa, savoy cabbage and cranberries (1,16,21,h)\tMint cream dip (17,21,f)\t\t\t\t\t1,80\t3,15\t3,95\tg\t2\t\t1, 16, 17, 21, h, f, 0\tmit Farbstoff, KlimaTeller, Knoblauch, vegan, Schalenfrüchte (Nüsse) (h), Soja (f), zusatzstoff- und allergenfrei\t-\tBrennwert=2849 kJ (680 kcal), Fett=18,5g, davon gesättigte Fettsäuren=3,2g, Kohlenhydrate=105,7g, davon Zucker=23,3g, Ballaststoffe=15,2g, Eiweiß=15,7g, Salz=5,9g,\nMensa Vechta\t31.01.2022\t2130\t10518\tKM 5 veget./vegan,+1,35 €\tHauptgericht\t3183\tPommes frites groß (21)\t\t\t\t\t\tPommes frites large (21)\t\t\t\t\t\t1,00\t2,35\t3,15\tc\t2\t\t21, 0\tvegan, zusatzstoff- und allergenfrei\t-\t-\nMensa Vechta\t31.01.2022\t2130\t6510\tKM 3 veget./vegan,+1,35 €\tHauptgericht\t113\tLasagne verde al forno - Grüner Nudelauflauf (1,20,a,g,i)\tTomatensauce (21)\t\t\t\t\tLasagne verde al forno - Green pasta bake (1,20,a,g,i)\tTomato sauce (21)\t\t\t\t\t0,00\t1,35\t2,15\tc\t\t\t1, 20, 21, 22, a, g, i, 0\tmit Farbstoff, vegetarisch, vegan, nicht vegan/vegetarisch (tierische Hilfsstoffe), Glutenhaltiges Getreide (a), Milch und Laktose (g), Sellerie (i), zusatzstoff- und allergenfrei\t-\tBrennwert=1924 kJ (459 kcal), Fett=22,1g, davon gesättigte Fettsäuren=9,0g, Kohlenhydrate=43,5g, davon Zucker=12,4g, Ballaststoffe=2,4g, Eiweiß=18,3g, Salz=7,7g,\nMensa Vechta\t31.01.2022\t1714\t3614\tEintopf (Terrine, Teller)\tEintopf Terrine\t513\tErdnuss-Laucheintopf mit Rindfleisch und Kokos (14,18,e,g)\tBaguette (21,a)\t\t\t\t\tPeanut and leek stew with beef and coconut (14,18,e,g)\tBaguette (21,a)\t\t\t\t\t1,80\t3,40\t4,20\tc\t2\t\t14, 18, 21, 22, e, a, g, 0\tRindfleisch, Fleisch aus artgerechter Tierhaltung, vegan, nicht vegan/vegetarisch (tierische Hilfsstoffe), Erdnüsse (e), Glutenhaltiges Getreide (a), Milch und Laktose (g), zusatzstoff- und allergenfrei\t-\tBrennwert=2702 kJ (645 kcal), Fett=27,9g, davon gesättigte Fettsäuren=15,6g, Kohlenhydrate=63,5g, davon Zucker=19,5g, Ballaststoffe=5,9g, Eiweiß=28,2g, Salz=6,6g,\nMensa Westerberg\t31.01.2022\t2097\t3665\tDessert 1\tDessert\t289\tNougatquark (20,g,h)\t\t\t\t\t\tNougat quark (20,g,h)\t\t\t\t\t\t0,50\t1,00\t1,20\tc\t\t\t20, g, h, 0\tvegetarisch, Milch und Laktose (g), Schalenfrüchte (Nüsse) (h), zusatzstoff- und allergenfrei\t-\tBrennwert=872 kJ (208 kcal), Fett=6,7g, davon gesättigte Fettsäuren=3,2g, Kohlenhydrate=19,5g, davon Zucker=19,4g, Ballaststoffe=0,1g, Eiweiß=15,6g, Salz=0,2g,\nMensa Westerberg\t31.01.2022\t2130\t10518\tKM 5 veget./vegan,+1,35 €\tHauptgericht\t3183\tPommes frites groß (21)\t\t\t\t\t\tPommes frites large (21)\t\t\t\t\t\t1,00\t2,35\t3,15\tc\t\t\t21, 0\tvegan, zusatzstoff- und allergenfrei\t-\t-\nMensa Westerberg\t31.01.2022\t2130\t4388\tKM 1 veget./vegan,+1,35 €\tHauptgericht\t2313\tSüßkartoffelpfanne mit Quinoa, Wirsing und Cranberries (1,16,21,h)\tMinzcremedip (17,21,f)\t\t\t\t\tSweet potato pan with quinoa, savoy cabbage and cranberries (1,16,21,h)\tMint cream dip (17,21,f)\t\t\t\t\t1,80\t3,15\t3,95\tg\t\t\t1, 16, 17, 21, h, f, 0\tmit Farbstoff, KlimaTeller, Knoblauch, vegan, Schalenfrüchte (Nüsse) (h), Soja (f), zusatzstoff- und allergenfrei\t-\tBrennwert=2847 kJ (680 kcal), Fett=18,5g, davon gesättigte Fettsäuren=3,2g, Kohlenhydrate=105,7g, davon Zucker=23,3g, Ballaststoffe=15,1g, Eiweiß=15,7g, Salz=5,9g,\nMensa Westerberg\t31.01.2022\t2130\t6510\tKM 3 veget./vegan,+1,35 €\tHauptgericht\t113\tLasagne verde al forno - Grüner Nudelauflauf (1,20,a,g,i)\t\t\t\t\t\tLasagne verde al forno - Green pasta bake (1,20,a,g,i)\t\t\t\t\t\t0,00\t1,35\t2,15\tc\t\t\t1, 20, 22, a, g, i, 0\tmit Farbstoff, vegetarisch, nicht vegan/vegetarisch (tierische Hilfsstoffe), Glutenhaltiges Getreide (a), Milch und Laktose (g), Sellerie (i), zusatzstoff- und allergenfrei\t-\tBrennwert=1683 kJ (402 kcal), Fett=19,1g, davon gesättigte Fettsäuren=8,7g, Kohlenhydrate=37,4g, davon Zucker=8,1g, Ballaststoffe=2,1g, Eiweiß=17,1g, Salz=5,9g,\nMensa Westerberg\t31.01.2022\t1701\t3646\tGemüsebeilage 3/Tagessala\tTagessalat\t470\tFarmersalat (20,c,g,i,j)\t\t\t\t\t\tFarmer’s salad (20,c,g,i,j)\t\t\t\t\t\t0,50\t1,00\t1,20\tc\t\t\t20, c, g, i, j, 0\tvegetarisch, Hühnerei (c), Milch und Laktose (g), Sellerie (i), Senf (j), zusatzstoff- und allergenfrei\t-\tBrennwert=1393 kJ (333 kcal), Fett=28,5g, davon gesättigte Fettsäuren=4,2g, Kohlenhydrate=13,5g, davon Zucker=11,9g, Ballaststoffe=4,1g, Eiweiß=2,9g, Salz=2,2g,\nMensa Westerberg\t31.01.2022\t1714\t3614\tEintopf (Terrine, Teller)\tEintopf Terrine\t2950\tErdnuss-Laucheintopf mit Rindfleisch und Kokos (14,18,e,g)\tMehrkornbrötchen (20,a,g,m,f)\t\t\t\t\tPeanut and leek stew with beef and coconut (14,18,e,g)\tMulti-seed roll (20,a,g,m,f)\t\t\t\t\t1,80\t3,40\t4,20\tc\t\t\t14, 18, 20, 22, e, a, g, m, f, 0\tRindfleisch, Fleisch aus artgerechter Tierhaltung, vegetarisch, nicht vegan/vegetarisch (tierische Hilfsstoffe), Erdnüsse (e), Glutenhaltiges Getreide (a), Milch und Laktose (g), Sesam (m), Soja (f), zusatzstoff- und allergenfrei\t-\tBrennwert=3061 kJ (731 kcal), Fett=31,6g, davon gesättigte Fettsäuren=16,3g, Kohlenhydrate=71,1g, davon Zucker=20,2g, Ballaststoffe=6,0g, Eiweiß=32,9g, Salz=6,9g,\nMensa Westerberg\t31.01.2022\t1701\t3648\tStärkebeilage 3\tBeilagen\t525\tPommes frites klein (21)\t\t\t\t\t\tPommes frites small (21)\t\t\t\t\t\t0,55\t1,05\t1,25\tc\t\t\t21, 0\tvegan, zusatzstoff- und allergenfrei\t-\t-\nMensa Westerberg\t31.01.2022\t1714\t3614\tEintopf (Terrine, Teller)\tEintopf Terrine\t1682\tErdnuss-Laucheintopf mit Rindfleisch und Kokos (14,18,e,g)\tMehrkornbrötchen (20,a,g,m,f)\t\t\t\t\tPeanut and leek stew with beef and coconut (14,18,e,g)\tMulti-seed roll (20,a,g,m,f)\t\t\t\t\t1,80\t3,40\t4,20\tc\t\t\t14, 18, 20, 22, e, a, g, m, f, 0\tRindfleisch, Fleisch aus artgerechter Tierhaltung, vegetarisch, nicht vegan/vegetarisch (tierische Hilfsstoffe), Erdnüsse (e), Glutenhaltiges Getreide (a), Milch und Laktose (g), Sesam (m), Soja (f), zusatzstoff- und allergenfrei\t-\tBrennwert=3061 kJ (731 kcal), Fett=31,6g, davon gesättigte Fettsäuren=16,3g, Kohlenhydrate=71,1g, davon Zucker=20,2g, Ballaststoffe=6,0g, Eiweiß=32,9g, Salz=6,9g,\nMensa Westerberg\t31.01.2022\t2130\t4388\tKM 1 veget./vegan,+1,35 €\tHauptgericht\t3169\tSüßkartoffelpfanne mit Quinoa, Wirsing und Cranberries (1,16,21,h)\tMinzcremedip (17,21,f)\t\t\t\t\tSweet potato pan with quinoa, savoy cabbage and cranberries (1,16,21,h)\tMint cream dip (17,21,f)\t\t\t\t\t1,80\t3,15\t3,95\tg\t\t\t1, 16, 17, 21, h, f, 0\tmit Farbstoff, KlimaTeller, Knoblauch, vegan, Schalenfrüchte (Nüsse) (h), Soja (f), zusatzstoff- und allergenfrei\t-\tBrennwert=2847 kJ (680 kcal), Fett=18,5g, davon gesättigte Fettsäuren=3,2g, Kohlenhydrate=105,7g, davon Zucker=23,3g, Ballaststoffe=15,1g, Eiweiß=15,7g, Salz=5,9g,\nMensa Haste\t01.02.2022\t1701\t3648\tStärkebeilage 3\tBeilagen\t525\tPommes frites klein (21)\t\t\t\t\t\tPommes frites small (21)\t\t\t\t\t\t0,55\t1,05\t1,25\tc\t2\t\t21, 0\tvegan, zusatzstoff- und allergenfrei\t-\t-\nMensa Haste\t01.02.2022\t2130\t4388\tKM 1 veget./vegan,+1,35 €\tHauptgericht\t2890\tRote Bio-Linsen-Bolognese mit Bio-Spaghetti (16,17,19,21,23,a,i)\t\t\t\t\t\tRed organic lentil bolognese with organic spaghetti (16,17,19,21,23,a,i)\t\t\t\t\t\t1,80\t3,15\t3,95\tg\t2\t\t16, 17, 19, 21, 23, a, i, 0\tKlimaTeller, Knoblauch, Bio-Erzeugnis DE-ÖKO-039, vegan, Bio-Menü, Glutenhaltiges Getreide (a), Sellerie (i), zusatzstoff- und allergenfrei\t-\tBrennwert=2830 kJ (676 kcal), Fett=12,3g, davon gesättigte Fettsäuren=2,3g, Kohlenhydrate=102,4g, davon Zucker=12,7g, Ballaststoffe=17,2g, Eiweiß=28,3g, Salz=7,9g,\nMensa Haste\t01.02.2022\t2130\t10518\tKM 5 veget./vegan,+1,35 €\tHauptgericht\t3183\tPommes frites groß (21)\t\t\t\t\t\tPommes frites large (21)\t\t\t\t\t\t1,00\t2,35\t3,15\tc\t2\t\t21, 0\tvegan, zusatzstoff- und allergenfrei\t-\t-\nMensa Haste\t01.02.2022\t2130\t4389\tKM 2 Fleisch/Fisc,+1,55 €\tHauptgericht\t1098\tRindergulasch Firehouse (2,14,17,18)\tBio-Schnittlauchkartoffeln (19,21)\t\t\t\t\tFirehouse beef goulash (2,14,17,18)\tOrganic chive potatoes (19,21)\t\t\t\t\t2,60\t4,15\t4,95\tc\t2\t\t2, 14, 17, 18, 19, 21, 0\tmit Konservierungsstoff, Rindfleisch, Knoblauch, Fleisch aus artgerechter Tierhaltung, Bio-Erzeugnis DE-ÖKO-039, vegan, zusatzstoff- und allergenfrei\t-\tBrennwert=1370 kJ (327 kcal), Fett=5,0g, davon gesättigte Fettsäuren=1,9g, Kohlenhydrate=34,8g, davon Zucker=6,4g, Ballaststoffe=1,1g, Eiweiß=29,3g, Salz=4,7g,\nMensa Haste\t01.02.2022\t2130\t6510\tKM 3 veget./vegan,+1,35 €\tHauptgericht\t2123\tSalatteller mit gebratenen Champignons und Hirtenkäse (3,20,g,k,j)\t\t\t\t\t\tPlate of salad with fried mushrooms and herder’s cheese (3,20,g,k,j)\t\t\t\t\t\t2,40\t3,75\t4,55\ta\t2\t\t3, 20, g, k, j, 0\tmit Antioxidationsmittel, vegetarisch, Milch und Laktose (g), Schwefeldioxid u. Sulfite (k), Senf (j), zusatzstoff- und allergenfrei\t-\tBrennwert=1545 kJ (369 kcal), Fett=28,4g, davon gesättigte Fettsäuren=5,5g, Kohlenhydrate=14,7g, davon Zucker=13,2g, Ballaststoffe=7,1g, Eiweiß=8,9g, Salz=1,4g,\nMensa Haste\t01.02.2022\t2130\t4389\tKM 2 Fleisch/Fisc,+1,55 €\tHauptgericht\t521\tRindergulasch Firehouse (2,14,17,18)\tBio-Schnittlauchkartoffeln (19,21)\t\t\t\t\tFirehouse beef goulash (2,14,17,18)\tOrganic chive potatoes (19,21)\t\t\t\t\t2,60\t4,15\t4,95\tc\t2\t\t2, 14, 17, 18, 19, 21, 0\tmit Konservierungsstoff, Rindfleisch, Knoblauch, Fleisch aus artgerechter Tierhaltung, Bio-Erzeugnis DE-ÖKO-039, vegan, zusatzstoff- und allergenfrei\t-\tBrennwert=1370 kJ (327 kcal), Fett=5,0g, davon gesättigte Fettsäuren=1,9g, Kohlenhydrate=34,8g, davon Zucker=6,4g, Ballaststoffe=1,1g, Eiweiß=29,3g, Salz=4,7g,\nMensa Lingen\t01.02.2022\t1701\t3648\tStärkebeilage 3\tBeilagen\t525\tPommes frites klein (21)\t\t\t\t\t\tPommes frites small (21)\t\t\t\t\t\t0,55\t1,05\t1,25\tc\t2\t\t21, 0\tvegan, zusatzstoff- und allergenfrei\t-\t-\nMensa Lingen\t01.02.2022\t2130\t4388\tKM 1 veget./vegan,+1,35 €\tHauptgericht\t2890\tRote Bio-Linsen-Bolognese mit Bio-Spaghetti (16,17,19,21,23,a,i)\t\t\t\t\t\tRed organic lentil bolognese with organic spaghetti (16,17,19,21,23,a,i)\t\t\t\t\t\t1,80\t3,15\t3,95\tg\t2\t\t16, 17, 19, 21, 23, a, i, 0\tKlimaTeller, Knoblauch, Bio-Erzeugnis DE-ÖKO-039, vegan, Bio-Menü, Glutenhaltiges Getreide (a), Sellerie (i), zusatzstoff- und allergenfrei\t-\tBrennwert=2830 kJ (676 kcal), Fett=12,3g, davon gesättigte Fettsäuren=2,3g, Kohlenhydrate=102,4g, davon Zucker=12,7g, Ballaststoffe=17,2g, Eiweiß=28,3g, Salz=7,9g,\nMensa Lingen\t01.02.2022\t2130\t4389\tKM 2 Fleisch/Fisc,+1,55 €\tHauptgericht\t521\tRindergulasch Firehouse (2,14,17,18)\tBio-Schnittlauchkartoffeln (19,21)\t\t\t\t\tFirehouse beef goulash (2,14,17,18)\tOrganic chive potatoes (19,21)\t\t\t\t\t2,60\t4,15\t4,95\tc\t2\t\t2, 14, 17, 18, 19, 21, 0\tmit Konservierungsstoff, Rindfleisch, Knoblauch, Fleisch aus artgerechter Tierhaltung, Bio-Erzeugnis DE-ÖKO-039, vegan, zusatzstoff- und allergenfrei\t-\tBrennwert=1373 kJ (328 kcal), Fett=5,0g, davon gesättigte Fettsäuren=1,9g, Kohlenhydrate=35,0g, davon Zucker=6,5g, Ballaststoffe=1,1g, Eiweiß=29,3g, Salz=4,7g,\nMensa Lingen\t01.02.2022\t2130\t4389\tKM 2 Fleisch/Fisc,+1,55 €\tHauptgericht\t1098\tRindergulasch Firehouse (2,14,17,18)\tBio-Schnittlauchkartoffeln (19,21)\t\t\t\t\tFirehouse beef goulash (2,14,17,18)\tOrganic chive potatoes (19,21)\t\t\t\t\t2,60\t4,15\t4,95\tc\t2\t\t2, 14, 17, 18, 19, 21, 0\tmit Konservierungsstoff, Rindfleisch, Knoblauch, Fleisch aus artgerechter Tierhaltung, Bio-Erzeugnis DE-ÖKO-039, vegan, zusatzstoff- und allergenfrei\t-\tBrennwert=1373 kJ (328 kcal), Fett=5,0g, davon gesättigte Fettsäuren=1,9g, Kohlenhydrate=35,0g, davon Zucker=6,5g, Ballaststoffe=1,1g, Eiweiß=29,3g, Salz=4,7g,\nMensa Lingen\t01.02.2022\t2130\t10518\tKM 5 veget./vegan,+1,35 €\tHauptgericht\t3183\tPommes frites groß (21)\t\t\t\t\t\tPommes frites large (21)\t\t\t\t\t\t1,00\t2,35\t3,15\tc\t2\t\t21, 0\tvegan, zusatzstoff- und allergenfrei\t-\t-\nMensa Schlossgarten\t01.02.2022\t1701\t3646\tGemüsebeilage 3/Tagessala\tTagessalat\t740\tBunter Salat mit Mungobohnensprossen (21)\t\t\t\t\t\tColourful mung bean sprout salad (21)\t\t\t\t\t\t0,45\t0,95\t1,15\ta\t\t\t21, 0\tvegan, zusatzstoff- und allergenfrei\t-\tBrennwert=797 kJ (190 kcal), Fett=12,6g, davon gesättigte Fettsäuren=1,0g, Kohlenhydrate=11,0g, davon Zucker=8,6g, Ballaststoffe=3,9g, Eiweiß=6,3g, Salz=2,3g,\nMensa Schlossgarten\t01.02.2022\t2130\t4389\tKM 2 Fleisch/Fisc,+1,55 €\tHauptgericht\t521\tRindergulasch Firehouse (2,14,17,18)\tBio-Schnittlauchkartoffeln (19,21)\t\t\t\t\tFirehouse beef goulash (2,14,17,18)\tOrganic chive potatoes (19,21)\t\t\t\t\t2,60\t4,15\t4,95\tc\t\t\t2, 14, 17, 18, 19, 21, 0\tmit Konservierungsstoff, Rindfleisch, Knoblauch, Fleisch aus artgerechter Tierhaltung, Bio-Erzeugnis DE-ÖKO-039, vegan, zusatzstoff- und allergenfrei\t-\tBrennwert=1373 kJ (328 kcal), Fett=5,0g, davon gesättigte Fettsäuren=1,9g, Kohlenhydrate=35,0g, davon Zucker=6,5g, Ballaststoffe=1,1g, Eiweiß=29,4g, Salz=4,7g,\nMensa Schlossgarten\t01.02.2022\t2130\t4388\tKM 1 veget./vegan,+1,35 €\tHauptgericht\t2890\tRote Bio-Linsen-Bolognese mit Bio-Spaghetti (16,17,19,21,23,a,i)\t\t\t\t\t\tRed organic lentil bolognese with organic spaghetti (16,17,19,21,23,a,i)\t\t\t\t\t\t1,80\t3,15\t3,95\tg\t\t\t16, 17, 19, 21, 23, a, i, 0\tKlimaTeller, Knoblauch, Bio-Erzeugnis DE-ÖKO-039, vegan, Bio-Menü, Glutenhaltiges Getreide (a), Sellerie (i), zusatzstoff- und allergenfrei\t-\tBrennwert=2834 kJ (677 kcal), Fett=12,3g, davon gesättigte Fettsäuren=2,3g, Kohlenhydrate=102,6g, davon Zucker=12,9g, Ballaststoffe=17,2g, Eiweiß=28,4g, Salz=7,9g,\nMensa Schlossgarten\t01.02.2022\t2130\t6510\tKM 3 veget./vegan,+1,35 €\tHauptgericht\t2123\tSalatteller mit gebratenen Champignons und Hirtenkäse (3,20,g,k,j)\t\t\t\t\t\tPlate of salad with fried mushrooms and herder’s cheese (3,20,g,k,j)\t\t\t\t\t\t2,40\t3,75\t4,55\ta\t\t\t3, 20, g, k, j, 0\tmit Antioxidationsmittel, vegetarisch, Milch und Laktose (g), Schwefeldioxid u. Sulfite (k), Senf (j), zusatzstoff- und allergenfrei\t-\tBrennwert=1545 kJ (369 kcal), Fett=28,4g, davon gesättigte Fettsäuren=5,5g, Kohlenhydrate=14,7g, davon Zucker=13,2g, Ballaststoffe=7,1g, Eiweiß=8,9g, Salz=1,2g,\nMensa Schlossgarten\t01.02.2022\t2097\t3665\tDessert 1\tDessert\t2735\tBio-Vanillepudding mit Bio-Schokotropfen (20,g,f)\t\t\t\t\t\tOrganic vanilla pudding with organic chocolate drops (20,g,f)\t\t\t\t\t\t0,70\t1,20\t1,40\tc\t\t\t19, 20, 23, g, f, 0\tBio-Erzeugnis DE-ÖKO-039, vegetarisch, Bio-Menü, Milch und Laktose (g), Soja (f), zusatzstoff- und allergenfrei\t-\tBrennwert=854 kJ (204 kcal), Fett=6,3g, davon gesättigte Fettsäuren=4,0g, Kohlenhydrate=31,3g, davon Zucker=20,8g, Ballaststoffe=0,6g, Eiweiß=4,8g, Salz=0,2g,\nMensa Schlossgarten\t01.02.2022\t1701\t3648\tStärkebeilage 3\tBeilagen\t525\tPommes frites klein (21)\t\t\t\t\t\tPommes frites small (21)\t\t\t\t\t\t0,55\t1,05\t1,25\tc\t\t\t21, 0\tvegan, zusatzstoff- und allergenfrei\t-\t-\nMensa Schlossgarten\t01.02.2022\t2130\t4389\tKM 2 Fleisch/Fisc,+1,55 €\tHauptgericht\t1098\tRindergulasch Firehouse (2,14,17,18)\tBio-Schnittlauchkartoffeln (19,21)\t\t\t\t\tFirehouse beef goulash (2,14,17,18)\tOrganic chive potatoes (19,21)\t\t\t\t\t2,60\t4,15\t4,95\tc\t\t\t2, 14, 17, 18, 19, 21, 0\tmit Konservierungsstoff, Rindfleisch, Knoblauch, Fleisch aus artgerechter Tierhaltung, Bio-Erzeugnis DE-ÖKO-039, vegan, zusatzstoff- und allergenfrei\t-\tBrennwert=1373 kJ (328 kcal), Fett=5,0g, davon gesättigte Fettsäuren=1,9g, Kohlenhydrate=35,0g, davon Zucker=6,5g, Ballaststoffe=1,1g, Eiweiß=29,4g, Salz=4,7g,\nMensa Schlossgarten\t01.02.2022\t2130\t10518\tKM 5 veget./vegan,+1,35 €\tHauptgericht\t3183\tPommes frites groß (21)\t\t\t\t\t\tPommes frites large (21)\t\t\t\t\t\t1,00\t2,35\t3,15\tc\t\t\t21, 0\tvegan, zusatzstoff- und allergenfrei\t-\t-\nMensa Vechta\t01.02.2022\t2130\t4389\tKM 2 Fleisch/Fisc,+1,55 €\tHauptgericht\t48\tSchweinerückensteak (2,13,a)\tBio-Schwenkkartoffeln (19,21)\tGrüne Bio-Bohnen (19,21)\tKräuterbutter (17,20,g)\t\t\tPork loin steak (2,13,a)\tOrganic potatoes tossed in oil (19,21)\tOrganic French beans (19,21)\tHerb butter (17,20,g)\t\t\t3,00\t4,55\t5,35\tc\t2\t\t2, 13, 17, 19, 20, 21, a, g, 0\tmit Konservierungsstoff, Schweinefleisch, Knoblauch, Bio-Erzeugnis DE-ÖKO-039, vegetarisch, vegan, Glutenhaltiges Getreide (a), Milch und Laktose (g), zusatzstoff- und allergenfrei\t-\tBrennwert=2985 kJ (713 kcal), Fett=36,2g, davon gesättigte Fettsäuren=12,2g, Kohlenhydrate=46,5g, davon Zucker=5,3g, Ballaststoffe=3,5g, Eiweiß=47,1g, Salz=5,0g,\nMensa Vechta\t01.02.2022\t2130\t4388\tKM 1 veget./vegan,+1,35 €\tHauptgericht\t2890\tRote Bio-Linsen-Bolognese mit Bio-Spaghetti (16,17,19,21,23,a,i)\t\t\t\t\t\tRed organic lentil bolognese with organic spaghetti (16,17,19,21,23,a,i)\t\t\t\t\t\t1,80\t3,15\t3,95\tg\t2\t\t16, 17, 19, 21, 23, a, i, 0\tKlimaTeller, Knoblauch, Bio-Erzeugnis DE-ÖKO-039, vegan, Bio-Menü, Glutenhaltiges Getreide (a), Sellerie (i), zusatzstoff- und allergenfrei\t-\tBrennwert=2834 kJ (677 kcal), Fett=12,3g, davon gesättigte Fettsäuren=2,3g, Kohlenhydrate=102,6g, davon Zucker=12,8g, Ballaststoffe=17,2g, Eiweiß=28,4g, Salz=7,9g,\nMensa Vechta\t01.02.2022\t1701\t3648\tStärkebeilage 3\tBeilagen\t525\tPommes frites klein (21)\t\t\t\t\t\tPommes frites small (21)\t\t\t\t\t\t0,55\t1,05\t1,25\tc\t2\t\t21, 0\tvegan, zusatzstoff- und allergenfrei\t-\t-\nMensa Vechta\t01.02.2022\t2130\t4389\tKM 2 Fleisch/Fisc,+1,55 €\tHauptgericht\t558\tSchweinerückensteak (2,13,a)\tBio-Schwenkkartoffeln (19,21)\tGrüne Bio-Bohnen (19,21)\tKräuterbutter (17,20,g)\t\t\tPork loin steak (2,13,a)\tOrganic potatoes tossed in oil (19,21)\tOrganic French beans (19,21)\tHerb butter (17,20,g)\t\t\t3,00\t4,55\t5,35\tc\t2\t\t2, 13, 17, 19, 20, 21, a, g, 0\tmit Konservierungsstoff, Schweinefleisch, Knoblauch, Bio-Erzeugnis DE-ÖKO-039, vegetarisch, vegan, Glutenhaltiges Getreide (a), Milch und Laktose (g), zusatzstoff- und allergenfrei\t-\tBrennwert=2985 kJ (713 kcal), Fett=36,2g, davon gesättigte Fettsäuren=12,2g, Kohlenhydrate=46,5g, davon Zucker=5,3g, Ballaststoffe=3,5g, Eiweiß=47,1g, Salz=5,0g,\nMensa Vechta\t01.02.2022\t2130\t10518\tKM 5 veget./vegan,+1,35 €\tHauptgericht\t3183\tPommes frites groß (21)\t\t\t\t\t\tPommes frites large (21)\t\t\t\t\t\t1,00\t2,35\t3,15\tc\t2\t\t21, 0\tvegan, zusatzstoff- und allergenfrei\t-\t-\nMensa Vechta\t01.02.2022\t2130\t4389\tKM 2 Fleisch/Fisc,+1,55 €\tHauptgericht\t539\tSchweinerückensteak (2,13,a)\tBio-Schwenkkartoffeln (19,21)\tGrüne Bio-Bohnen (19,21)\tKräuterbutter (17,20,g)\t\t\tPork loin steak (2,13,a)\tOrganic potatoes tossed in oil (19,21)\tOrganic French beans (19,21)\tHerb butter (17,20,g)\t\t\t3,00\t4,55\t5,35\tc\t2\t\t2, 13, 17, 19, 20, 21, a, g, 0\tmit Konservierungsstoff, Schweinefleisch, Knoblauch, Bio-Erzeugnis DE-ÖKO-039, vegetarisch, vegan, Glutenhaltiges Getreide (a), Milch und Laktose (g), zusatzstoff- und allergenfrei\t-\tBrennwert=2985 kJ (713 kcal), Fett=36,2g, davon gesättigte Fettsäuren=12,2g, Kohlenhydrate=46,5g, davon Zucker=5,3g, Ballaststoffe=3,5g, Eiweiß=47,1g, Salz=5,0g,\nMensa Vechta\t01.02.2022\t2130\t4389\tKM 2 Fleisch/Fisc,+1,55 €\tHauptgericht\t2063\tSchweinerückensteak (2,13,a)\tBio-Schwenkkartoffeln (19,21)\tGrüne Bio-Bohnen (19,21)\tKräuterbutter (17,20,g)\t\t\tPork loin steak (2,13,a)\tOrganic potatoes tossed in oil (19,21)\tOrganic French beans (19,21)\tHerb butter (17,20,g)\t\t\t3,00\t4,55\t5,35\tc\t2\t\t2, 13, 17, 19, 20, 21, a, g, 0\tmit Konservierungsstoff, Schweinefleisch, Knoblauch, Bio-Erzeugnis DE-ÖKO-039, vegetarisch, vegan, Glutenhaltiges Getreide (a), Milch und Laktose (g), zusatzstoff- und allergenfrei\t-\tBrennwert=2985 kJ (713 kcal), Fett=36,2g, davon gesättigte Fettsäuren=12,2g, Kohlenhydrate=46,5g, davon Zucker=5,3g, Ballaststoffe=3,5g, Eiweiß=47,1g, Salz=5,0g,\nMensa Westerberg\t01.02.2022\t1701\t3648\tStärkebeilage 3\tBeilagen\t525\tPommes frites klein (21)\t\t\t\t\t\tPommes frites small (21)\t\t\t\t\t\t0,55\t1,05\t1,25\tc\t\t\t21, 0\tvegan, zusatzstoff- und allergenfrei\t-\t-\nMensa Westerberg\t01.02.2022\t2130\t4389\tKM 2 Fleisch/Fisc,+1,55 €\tHauptgericht\t521\tRindergulasch Firehouse (2,14,17,18)\tBio-Schnittlauchkartoffeln (19,21)\t\t\t\t\tFirehouse beef goulash (2,14,17,18)\tOrganic chive potatoes (19,21)\t\t\t\t\t2,60\t4,15\t4,95\tc\t\t\t2, 14, 17, 18, 19, 21, 0\tmit Konservierungsstoff, Rindfleisch, Knoblauch, Fleisch aus artgerechter Tierhaltung, Bio-Erzeugnis DE-ÖKO-039, vegan, zusatzstoff- und allergenfrei\t-\tBrennwert=1374 kJ (328 kcal), Fett=5,0g, davon gesättigte Fettsäuren=1,9g, Kohlenhydrate=35,0g, davon Zucker=6,6g, Ballaststoffe=1,1g, Eiweiß=29,4g, Salz=4,7g,\nMensa Westerberg\t01.02.2022\t2130\t4389\tKM 2 Fleisch/Fisc,+1,55 €\tHauptgericht\t1098\tRindergulasch Firehouse (2,14,17,18)\tBio-Schnittlauchkartoffeln (19,21)\t\t\t\t\tFirehouse beef goulash (2,14,17,18)\tOrganic chive potatoes (19,21)\t\t\t\t\t2,60\t4,15\t4,95\tc\t\t\t2, 14, 17, 18, 19, 21, 0\tmit Konservierungsstoff, Rindfleisch, Knoblauch, Fleisch aus artgerechter Tierhaltung, Bio-Erzeugnis DE-ÖKO-039, vegan, zusatzstoff- und allergenfrei\t-\tBrennwert=1374 kJ (328 kcal), Fett=5,0g, davon gesättigte Fettsäuren=1,9g, Kohlenhydrate=35,0g, davon Zucker=6,6g, Ballaststoffe=1,1g, Eiweiß=29,4g, Salz=4,7g,\nMensa Westerberg\t01.02.2022\t1701\t3646\tGemüsebeilage 3/Tagessala\tTagessalat\t740\tBunter Salat mit Mungobohnensprossen (21)\t\t\t\t\t\tColourful mung bean sprout salad (21)\t\t\t\t\t\t0,45\t0,95\t1,15\ta\t\t\t21, 0\tvegan, zusatzstoff- und allergenfrei\t-\tBrennwert=799 kJ (191 kcal), Fett=12,6g, davon gesättigte Fettsäuren=1,0g, Kohlenhydrate=11,0g, davon Zucker=8,6g, Ballaststoffe=3,9g, Eiweiß=6,3g, Salz=2,3g,\nMensa Westerberg\t01.02.2022\t2130\t4388\tKM 1 veget./vegan,+1,35 €\tHauptgericht\t2890\tRote Bio-Linsen-Bolognese mit Bio-Spaghetti (16,17,19,21,23,a,i)\t\t\t\t\t\tRed organic lentil bolognese with organic spaghetti (16,17,19,21,23,a,i)\t\t\t\t\t\t1,80\t3,15\t3,95\tg\t\t\t16, 17, 19, 21, 23, a, i, 0\tKlimaTeller, Knoblauch, Bio-Erzeugnis DE-ÖKO-039, vegan, Bio-Menü, Glutenhaltiges Getreide (a), Sellerie (i), zusatzstoff- und allergenfrei\t-\tBrennwert=2836 kJ (677 kcal), Fett=12,3g, davon gesättigte Fettsäuren=2,3g, Kohlenhydrate=102,6g, davon Zucker=12,9g, Ballaststoffe=17,2g, Eiweiß=28,4g, Salz=7,9g,\nMensa Westerberg\t01.02.2022\t2097\t3665\tDessert 1\tDessert\t2735\tBio-Vanillepudding mit Bio-Schokotropfen (20,g,f)\t\t\t\t\t\tOrganic vanilla pudding with organic chocolate drops (20,g,f)\t\t\t\t\t\t0,70\t1,20\t1,40\tc\t\t\t19, 20, 23, g, f, 0\tBio-Erzeugnis DE-ÖKO-039, vegetarisch, Bio-Menü, Milch und Laktose (g), Soja (f), zusatzstoff- und allergenfrei\t-\tBrennwert=854 kJ (204 kcal), Fett=6,3g, davon gesättigte Fettsäuren=4,0g, Kohlenhydrate=31,3g, davon Zucker=20,8g, Ballaststoffe=0,6g, Eiweiß=4,8g, Salz=0,2g,\nMensa Westerberg\t01.02.2022\t2130\t6510\tKM 3 veget./vegan,+1,35 €\tHauptgericht\t2123\tSalatteller mit gebratenen Champignons und Hirtenkäse (3,20,g,k,j)\t\t\t\t\t\tPlate of salad with fried mushrooms and herder’s cheese (3,20,g,k,j)\t\t\t\t\t\t2,40\t3,75\t4,55\ta\t\t\t3, 20, g, k, j, 0\tmit Antioxidationsmittel, vegetarisch, Milch und Laktose (g), Schwefeldioxid u. Sulfite (k), Senf (j), zusatzstoff- und allergenfrei\t-\tBrennwert=1546 kJ (369 kcal), Fett=28,4g, davon gesättigte Fettsäuren=5,5g, Kohlenhydrate=14,7g, davon Zucker=13,2g, Ballaststoffe=7,1g, Eiweiß=8,9g, Salz=1,2g,\nMensa Westerberg\t01.02.2022\t2130\t10518\tKM 5 veget./vegan,+1,35 €\tHauptgericht\t3183\tPommes frites groß (21)\t\t\t\t\t\tPommes frites large (21)\t\t\t\t\t\t1,00\t2,35\t3,15\tc\t\t\t21, 0\tvegan, zusatzstoff- und allergenfrei\t-\t-\nMensa Haste\t02.02.2022\t1714\t3614\tEintopf (Terrine, Teller)\tEintopf Terrine\t3157\tBio Paprika-Maiseintopf (19,21,23)\tBio-Dinkelbrötchen (19,21,a)\t\t\t\t\tOrganic bell pepper and sweetcorn stew (19,21,23)\tOrganic spelt roll (19,21,a)\t\t\t\t\t1,80\t3,40\t4,20\tg\t2\t\t19, 21, 23, a, 0\tBio-Erzeugnis DE-ÖKO-039, vegan, Bio-Menü, Glutenhaltiges Getreide (a), zusatzstoff- und allergenfrei\t-\tBrennwert=1898 kJ (453 kcal), Fett=5,7g, davon gesättigte Fettsäuren=0,8g, Kohlenhydrate=77,9g, davon Zucker=15,3g, Ballaststoffe=11,9g, Eiweiß=13,5g, Salz=4,4g,\nMensa Haste\t02.02.2022\t2130\t6510\tKM 3 veget./vegan,+1,35 €\tHauptgericht\t1855\tKräuter-Rahmchampignons mit Semmelknödeln (1,20,a,c,g)\tSalatgarnitur (21)\t\t\t\t\tCreamy herb mushrooms with bread dumplings (1,20,a,c,g)\tSalad bouquet (21)\t\t\t\t\t2,30\t3,65\t4,45\tc\t2\t\t1, 20, 21, 22, a, c, g, 0\tmit Farbstoff, vegetarisch, vegan, nicht vegan/vegetarisch (tierische Hilfsstoffe), Glutenhaltiges Getreide (a), Hühnerei (c), Milch und Laktose (g), zusatzstoff- und allergenfrei\t-\tBrennwert=946 kJ (226 kcal), Fett=12,0g, davon gesättigte Fettsäuren=4,6g, Kohlenhydrate=16,7g, davon Zucker=7,2g, Ballaststoffe=5,9g, Eiweiß=8,4g, Salz=2,8g,\nMensa Haste\t02.02.2022\t2130\t6510\tKM 3 veget./vegan,+1,35 €\tHauptgericht\t806\tKräuter-Rahmchampignons mit Semmelknödeln (1,20,a,c,g)\tSalatgarnitur (21)\t\t\t\t\tCreamy herb mushrooms with bread dumplings (1,20,a,c,g)\tSalad bouquet (21)\t\t\t\t\t2,30\t3,65\t4,45\tc\t2\t\t1, 20, 21, 22, a, c, g, 0\tmit Farbstoff, vegetarisch, vegan, nicht vegan/vegetarisch (tierische Hilfsstoffe), Glutenhaltiges Getreide (a), Hühnerei (c), Milch und Laktose (g), zusatzstoff- und allergenfrei\t-\tBrennwert=946 kJ (226 kcal), Fett=12,0g, davon gesättigte Fettsäuren=4,6g, Kohlenhydrate=16,7g, davon Zucker=7,2g, Ballaststoffe=5,9g, Eiweiß=8,4g, Salz=2,8g,\nMensa Haste\t02.02.2022\t2130\t4388\tKM 1 veget./vegan,+1,35 €\tHauptgericht\t2772\tBurrito Bowl mit Räuchertofu, Naturreis, Avocado und Koriandertopping an feuriger Sauce (2,21,a,f)\t\t\t\t\t\tBurrito Bowl with smoked tofu, brown rice, avocado, coriander topping and spicy sauce (2,21,a,f)\t\t\t\t\t\t3,30\t4,65\t5,45\tg\t2\t\t2, 21, a, f, 0\tmit Konservierungsstoff, vegan, Glutenhaltiges Getreide (a), Soja (f), zusatzstoff- und allergenfrei\t-\tBrennwert=3847 kJ (919 kcal), Fett=36,6g, davon gesättigte Fettsäuren=5,5g, Kohlenhydrate=100,9g, davon Zucker=20,9g, Ballaststoffe=10,1g, Eiweiß=35,5g, Salz=6,6g,\nMensa Haste\t02.02.2022\t1714\t3614\tEintopf (Terrine, Teller)\tEintopf Terrine\t2074\tBio Paprika-Maiseintopf (19,21,23)\tBio-Dinkelbrötchen (19,21,a)\t\t\t\t\tOrganic bell pepper and sweetcorn stew (19,21,23)\tOrganic spelt roll (19,21,a)\t\t\t\t\t1,80\t3,40\t4,20\tg\t2\t\t19, 21, 23, a, 0\tBio-Erzeugnis DE-ÖKO-039, vegan, Bio-Menü, Glutenhaltiges Getreide (a), zusatzstoff- und allergenfrei\t-\tBrennwert=1898 kJ (453 kcal), Fett=5,7g, davon gesättigte Fettsäuren=0,8g, Kohlenhydrate=77,9g, davon Zucker=15,3g, Ballaststoffe=11,9g, Eiweiß=13,5g, Salz=4,4g,\nMensa Haste\t02.02.2022\t2130\t4389\tKM 2 Fleisch/Fisc,+1,55 €\tHauptgericht\t3149\tBurrito Bowl mit Pulled Chicken, Naturreis, Avocado und Koriandertopping an feuriger Sauce (2,a,40)\t\t\t\t\t\tBurrito Bowl with pulled chicken, brown rice, avocado, coriander topping and spicy sauce (2,a,40)\t\t\t\t\t\t3,70\t5,25\t6,05\ta\t2\t\t2, a, 40, 0\tmit Konservierungsstoff, Glutenhaltiges Getreide (a), Geflügel, zusatzstoff- und allergenfrei\t-\tBrennwert=3420 kJ (817 kcal), Fett=28,0g, davon gesättigte Fettsäuren=4,5g, Kohlenhydrate=100,1g, davon Zucker=20,1g, Ballaststoffe=8,3g, Eiweiß=30,7g, Salz=8,1g,\nMensa Lingen\t02.02.2022\t2130\t4389\tKM 2 Fleisch/Fisc,+1,55 €\tHauptgericht\t3149\tBurrito Bowl mit Pulled Chicken, Naturreis, Avocado und Koriandertopping an feuriger Sauce (2,a,40)\t\t\t\t\t\tBurrito Bowl with pulled chicken, brown rice, avocado, coriander topping and spicy sauce (2,a,40)\t\t\t\t\t\t3,70\t5,25\t6,05\ta\t2\t\t2, a, 40, 0\tmit Konservierungsstoff, Glutenhaltiges Getreide (a), Geflügel, zusatzstoff- und allergenfrei\t-\tBrennwert=3420 kJ (817 kcal), Fett=28,0g, davon gesättigte Fettsäuren=4,5g, Kohlenhydrate=100,1g, davon Zucker=20,1g, Ballaststoffe=8,3g, Eiweiß=30,7g, Salz=8,1g,\nMensa Lingen\t02.02.2022\t2130\t6510\tKM 3 veget./vegan,+1,35 €\tHauptgericht\t806\tKräuter-Rahmchampignons mit Semmelknödeln (1,20,a,c,g)\tSalatgarnitur (21)\t\t\t\t\tCreamy herb mushrooms with bread dumplings (1,20,a,c,g)\tSalad bouquet (21)\t\t\t\t\t2,30\t3,65\t4,45\tc\t2\t\t1, 20, 21, 22, a, c, g, 0\tmit Farbstoff, vegetarisch, vegan, nicht vegan/vegetarisch (tierische Hilfsstoffe), Glutenhaltiges Getreide (a), Hühnerei (c), Milch und Laktose (g), zusatzstoff- und allergenfrei\t-\tBrennwert=946 kJ (226 kcal), Fett=12,0g, davon gesättigte Fettsäuren=4,6g, Kohlenhydrate=16,7g, davon Zucker=7,2g, Ballaststoffe=5,9g, Eiweiß=8,4g, Salz=2,8g,\nMensa Lingen\t02.02.2022\t2130\t4388\tKM 1 veget./vegan,+1,35 €\tHauptgericht\t2772\tBurrito Bowl mit Räuchertofu, Naturreis, Avocado und Koriandertopping an feuriger Sauce (2,21,a,f)\t\t\t\t\t\tBurrito Bowl with smoked tofu, brown rice, avocado, coriander topping and spicy sauce (2,21,a,f)\t\t\t\t\t\t3,30\t4,65\t5,45\tg\t2\t\t2, 21, a, f, 0\tmit Konservierungsstoff, vegan, Glutenhaltiges Getreide (a), Soja (f), zusatzstoff- und allergenfrei\t-\tBrennwert=3847 kJ (919 kcal), Fett=36,6g, davon gesättigte Fettsäuren=5,5g, Kohlenhydrate=100,9g, davon Zucker=20,9g, Ballaststoffe=10,1g, Eiweiß=35,5g, Salz=6,6g,\nMensa Lingen\t02.02.2022\t2130\t6510\tKM 3 veget./vegan,+1,35 €\tHauptgericht\t1855\tKräuter-Rahmchampignons mit Semmelknödeln (1,20,a,c,g)\tSalatgarnitur (21)\t\t\t\t\tCreamy herb mushrooms with bread dumplings (1,20,a,c,g)\tSalad bouquet (21)\t\t\t\t\t2,30\t3,65\t4,45\tc\t2\t\t1, 20, 21, 22, a, c, g, 0\tmit Farbstoff, vegetarisch, vegan, nicht vegan/vegetarisch (tierische Hilfsstoffe), Glutenhaltiges Getreide (a), Hühnerei (c), Milch und Laktose (g), zusatzstoff- und allergenfrei\t-\tBrennwert=946 kJ (226 kcal), Fett=12,0g, davon gesättigte Fettsäuren=4,6g, Kohlenhydrate=16,7g, davon Zucker=7,2g, Ballaststoffe=5,9g, Eiweiß=8,4g, Salz=2,8g,\nMensa Schlossgarten\t02.02.2022\t1701\t3646\tGemüsebeilage 3/Tagessala\tTagessalat\t2024\tCouscoussalat (2,3,21,a,k)\t\t\t\t\t\tCouscous salad (2,3,21,a,k)\t\t\t\t\t\t0,70\t1,20\t1,40\ta\t\t\t2, 3, 21, a, k, 0\tmit Konservierungsstoff, mit Antioxidationsmittel, vegan, Glutenhaltiges Getreide (a), Schwefeldioxid u. Sulfite (k), zusatzstoff- und allergenfrei\t-\tBrennwert=690 kJ (165 kcal), Fett=1,9g, davon gesättigte Fettsäuren=0,3g, Kohlenhydrate=27,5g, davon Zucker=7,1g, Ballaststoffe=3,3g, Eiweiß=5,7g, Salz=5,6g,\nMensa Schlossgarten\t02.02.2022\t1714\t3614\tEintopf (Terrine, Teller)\tEintopf Terrine\t2074\tBio Paprika-Maiseintopf (19,21,23)\tBio-Dinkelbrötchen (19,21,a)\t\t\t\t\tOrganic bell pepper and sweetcorn stew (19,21,23)\tOrganic spelt roll (19,21,a)\t\t\t\t\t1,80\t3,40\t4,20\tg\t\t\t19, 21, 23, a, 0\tBio-Erzeugnis DE-ÖKO-039, vegan, Bio-Menü, Glutenhaltiges Getreide (a), zusatzstoff- und allergenfrei\t-\tBrennwert=1900 kJ (454 kcal), Fett=5,7g, davon gesättigte Fettsäuren=0,8g, Kohlenhydrate=78,0g, davon Zucker=15,4g, Ballaststoffe=11,9g, Eiweiß=13,5g, Salz=4,4g,\nMensa Schlossgarten\t02.02.2022\t1714\t3614\tEintopf (Terrine, Teller)\tEintopf Terrine\t3157\tBio Paprika-Maiseintopf (19,21,23)\tBio-Dinkelbrötchen (19,21,a)\t\t\t\t\tOrganic bell pepper and sweetcorn stew (19,21,23)\tOrganic spelt roll (19,21,a)\t\t\t\t\t1,80\t3,40\t4,20\tg\t\t\t19, 21, 23, a, 0\tBio-Erzeugnis DE-ÖKO-039, vegan, Bio-Menü, Glutenhaltiges Getreide (a), zusatzstoff- und allergenfrei\t-\tBrennwert=1900 kJ (454 kcal), Fett=5,7g, davon gesättigte Fettsäuren=0,8g, Kohlenhydrate=78,0g, davon Zucker=15,4g, Ballaststoffe=11,9g, Eiweiß=13,5g, Salz=4,4g,\nMensa Schlossgarten\t02.02.2022\t2097\t3665\tDessert 1\tDessert\t2131\tGötterspeise Waldmeister (1,25)\tVanillesauce (g)\t\t\t\t\tWoodruff jelly (1,25)\t\t\t\t\t\t0,40\t0,90\t1,10\tc\t\t\t1, 25, g, 0\tmit Farbstoff, mit Gelatine, Milch und Laktose (g), zusatzstoff- und allergenfrei\t-\tBrennwert=626 kJ (150 kcal), Fett=1,1g, davon gesättigte Fettsäuren=0,7g, Kohlenhydrate=31,1g, davon Zucker=30,2g, Eiweiß=3,1g, Salz=0,1g,\nMensa Schlossgarten\t02.02.2022\t2097\t3665\tDessert 1\tDessert\t294\tGötterspeise Waldmeister (1,25)\tVanillesauce (g)\t\t\t\t\tWoodruff jelly (1,25)\t\t\t\t\t\t0,40\t0,90\t1,10\tc\t\t\t1, 25, g, 0\tmit Farbstoff, mit Gelatine, Milch und Laktose (g), zusatzstoff- und allergenfrei\t-\tBrennwert=626 kJ (150 kcal), Fett=1,1g, davon gesättigte Fettsäuren=0,7g, Kohlenhydrate=31,1g, davon Zucker=30,2g, Eiweiß=3,1g, Salz=0,1g,\nMensa Schlossgarten\t02.02.2022\t2130\t6510\tKM 3 veget./vegan,+1,35 €\tHauptgericht\t806\tKräuter-Rahmchampignons mit Semmelknödeln (1,20,a,c,g)\tSalatgarnitur (21)\t\t\t\t\tCreamy herb mushrooms with bread dumplings (1,20,a,c,g)\tSalad bouquet (21)\t\t\t\t\t2,30\t3,65\t4,45\tc\t\t\t1, 20, 21, 22, a, c, g, 0\tmit Farbstoff, vegetarisch, vegan, nicht vegan/vegetarisch (tierische Hilfsstoffe), Glutenhaltiges Getreide (a), Hühnerei (c), Milch und Laktose (g), zusatzstoff- und allergenfrei\t-\tBrennwert=950 kJ (227 kcal), Fett=12,0g, davon gesättigte Fettsäuren=4,6g, Kohlenhydrate=16,9g, davon Zucker=7,3g, Ballaststoffe=5,9g, Eiweiß=8,5g, Salz=2,8g,\nMensa Schlossgarten\t02.02.2022\t2130\t6510\tKM 3 veget./vegan,+1,35 €\tHauptgericht\t1855\tKräuter-Rahmchampignons mit Semmelknödeln (1,20,a,c,g)\tSalatgarnitur (21)\t\t\t\t\tCreamy herb mushrooms with bread dumplings (1,20,a,c,g)\tSalad bouquet (21)\t\t\t\t\t2,30\t3,65\t4,45\tc\t\t\t1, 20, 21, 22, a, c, g, 0\tmit Farbstoff, vegetarisch, vegan, nicht vegan/vegetarisch (tierische Hilfsstoffe), Glutenhaltiges Getreide (a), Hühnerei (c), Milch und Laktose (g), zusatzstoff- und allergenfrei\t-\tBrennwert=950 kJ (227 kcal), Fett=12,0g, davon gesättigte Fettsäuren=4,6g, Kohlenhydrate=16,9g, davon Zucker=7,3g, Ballaststoffe=5,9g, Eiweiß=8,5g, Salz=2,8g,\nMensa Schlossgarten\t02.02.2022\t2130\t4389\tKM 2 Fleisch/Fisc,+1,55 €\tHauptgericht\t3149\tBurrito Bowl mit Pulled Pork, Naturreis, Avocado und Koriandertopping an feuriger Sauce (2,13,a)\t\t\t\t\t\tBurrito Bowl with pulled pork, brown rice, avocado, coriander topping and spicy sauce (2,13,a)\t\t\t\t\t\t3,70\t5,25\t6,05\ta\t\t\t2, 13, a, 0\tmit Konservierungsstoff, Schweinefleisch, Glutenhaltiges Getreide (a), zusatzstoff- und allergenfrei\t-\tBrennwert=3465 kJ (828 kcal), Fett=29,2g, davon gesättigte Fettsäuren=5,1g, Kohlenhydrate=100,1g, davon Zucker=20,1g, Ballaststoffe=8,3g, Eiweiß=30,7g, Salz=8,3g,\nMensa Schlossgarten\t02.02.2022\t2130\t4388\tKM 1 veget./vegan,+1,35 €\tHauptgericht\t2772\tBurrito Bowl mit Räuchertofu, Naturreis, Avocado und Koriandertopping an feuriger Sauce (2,21,a,f)\t\t\t\t\t\tBurrito Bowl with smoked tofu, brown rice, avocado, coriander topping and spicy sauce (2,21,a,f)\t\t\t\t\t\t3,30\t4,65\t5,45\tg\t\t\t2, 21, a, f, 0\tmit Konservierungsstoff, vegan, Glutenhaltiges Getreide (a), Soja (f), zusatzstoff- und allergenfrei\t-\tBrennwert=3847 kJ (919 kcal), Fett=36,6g, davon gesättigte Fettsäuren=5,5g, Kohlenhydrate=100,9g, davon Zucker=20,9g, Ballaststoffe=10,1g, Eiweiß=35,5g, Salz=6,6g,\nMensa Vechta\t02.02.2022\t2130\t4389\tKM 2 Fleisch/Fisc,+1,55 €\tHauptgericht\t3149\tBurrito Bowl mit Pulled Chicken, Naturreis, Avocado und Koriandertopping an feuriger Sauce (2,a,40)\t\t\t\t\t\tBurrito Bowl with pulled chicken, brown rice, avocado, coriander topping and spicy sauce (2,a,40)\t\t\t\t\t\t3,70\t5,25\t6,05\ta\t2\t\t2, a, 40, 0\tmit Konservierungsstoff, Glutenhaltiges Getreide (a), Geflügel, zusatzstoff- und allergenfrei\t-\tBrennwert=3420 kJ (817 kcal), Fett=28,0g, davon gesättigte Fettsäuren=4,5g, Kohlenhydrate=100,1g, davon Zucker=20,1g, Ballaststoffe=8,3g, Eiweiß=30,7g, Salz=8,1g,\nMensa Vechta\t02.02.2022\t2130\t4388\tKM 1 veget./vegan,+1,35 €\tHauptgericht\t2772\tBurrito Bowl mit Räuchertofu, Naturreis, Avocado und Koriandertopping an feuriger Sauce (2,21,a,f)\t\t\t\t\t\tBurrito Bowl with smoked tofu, brown rice, avocado, coriander topping and spicy sauce (2,21,a,f)\t\t\t\t\t\t3,30\t4,65\t5,45\tg\t2\t\t2, 21, a, f, 0\tmit Konservierungsstoff, vegan, Glutenhaltiges Getreide (a), Soja (f), zusatzstoff- und allergenfrei\t-\tBrennwert=3847 kJ (919 kcal), Fett=36,6g, davon gesättigte Fettsäuren=5,5g, Kohlenhydrate=100,9g, davon Zucker=20,9g, Ballaststoffe=10,1g, Eiweiß=35,5g, Salz=6,6g,\nMensa Vechta\t02.02.2022\t2130\t6510\tKM 3 veget./vegan,+1,35 €\tHauptgericht\t806\tKräuter-Rahmchampignons mit Semmelknödeln (1,20,a,c,g)\tSalatgarnitur (21)\t\t\t\t\tCreamy herb mushrooms with bread dumplings (1,20,a,c,g)\tSalad bouquet (21)\t\t\t\t\t2,30\t3,65\t4,45\tc\t2\t\t1, 20, 21, 22, a, c, g, 0\tmit Farbstoff, vegetarisch, vegan, nicht vegan/vegetarisch (tierische Hilfsstoffe), Glutenhaltiges Getreide (a), Hühnerei (c), Milch und Laktose (g), zusatzstoff- und allergenfrei\t-\tBrennwert=953 kJ (228 kcal), Fett=12,0g, davon gesättigte Fettsäuren=4,6g, Kohlenhydrate=17,1g, davon Zucker=7,4g, Ballaststoffe=6,0g, Eiweiß=8,5g, Salz=2,8g,\nMensa Vechta\t02.02.2022\t2130\t6510\tKM 3 veget./vegan,+1,35 €\tHauptgericht\t1855\tKräuter-Rahmchampignons mit Semmelknödeln (1,20,a,c,g)\tSalatgarnitur (21)\t\t\t\t\tCreamy herb mushrooms with bread dumplings (1,20,a,c,g)\tSalad bouquet (21)\t\t\t\t\t2,30\t3,65\t4,45\tc\t2\t\t1, 20, 21, 22, a, c, g, 0\tmit Farbstoff, vegetarisch, vegan, nicht vegan/vegetarisch (tierische Hilfsstoffe), Glutenhaltiges Getreide (a), Hühnerei (c), Milch und Laktose (g), zusatzstoff- und allergenfrei\t-\tBrennwert=953 kJ (228 kcal), Fett=12,0g, davon gesättigte Fettsäuren=4,6g, Kohlenhydrate=17,1g, davon Zucker=7,4g, Ballaststoffe=6,0g, Eiweiß=8,5g, Salz=2,8g,\nMensa Vechta\t02.02.2022\t1714\t3614\tEintopf (Terrine, Teller)\tEintopf Terrine\t3157\tBio Paprika-Maiseintopf (19,21,23)\tBio-Dinkelbrötchen (19,21,a)\t\t\t\t\tOrganic bell pepper and sweetcorn stew (19,21,23)\tOrganic spelt roll (19,21,a)\t\t\t\t\t1,80\t3,40\t4,20\tg\t2\t\t19, 21, 23, a, 0\tBio-Erzeugnis DE-ÖKO-039, vegan, Bio-Menü, Glutenhaltiges Getreide (a), zusatzstoff- und allergenfrei\t-\tBrennwert=1898 kJ (453 kcal), Fett=5,7g, davon gesättigte Fettsäuren=0,8g, Kohlenhydrate=77,9g, davon Zucker=15,3g, Ballaststoffe=11,9g, Eiweiß=13,5g, Salz=4,4g,\nMensa Vechta\t02.02.2022\t1714\t3614\tEintopf (Terrine, Teller)\tEintopf Terrine\t2074\tBio Paprika-Maiseintopf (19,21,23)\tBio-Dinkelbrötchen (19,21,a)\t\t\t\t\tOrganic bell pepper and sweetcorn stew (19,21,23)\tOrganic spelt roll (19,21,a)\t\t\t\t\t1,80\t3,40\t4,20\tg\t2\t\t19, 21, 23, a, 0\tBio-Erzeugnis DE-ÖKO-039, vegan, Bio-Menü, Glutenhaltiges Getreide (a), zusatzstoff- und allergenfrei\t-\tBrennwert=1898 kJ (453 kcal), Fett=5,7g, davon gesättigte Fettsäuren=0,8g, Kohlenhydrate=77,9g, davon Zucker=15,3g, Ballaststoffe=11,9g, Eiweiß=13,5g, Salz=4,4g,\nMensa Westerberg\t02.02.2022\t2097\t3665\tDessert 1\tDessert\t294\tGötterspeise Waldmeister (1,25)\tVanillesauce (g)\t\t\t\t\tWoodruff jelly (1,25)\t\t\t\t\t\t0,40\t0,90\t1,10\tc\t\t\t1, 25, g, 0\tmit Farbstoff, mit Gelatine, Milch und Laktose (g), zusatzstoff- und allergenfrei\t-\tBrennwert=627 kJ (150 kcal), Fett=1,1g, davon gesättigte Fettsäuren=0,7g, Kohlenhydrate=31,1g, davon Zucker=30,2g, Eiweiß=3,1g, Salz=0,1g,\nMensa Westerberg\t02.02.2022\t1714\t3614\tEintopf (Terrine, Teller)\tEintopf Terrine\t2074\tBio Paprika-Maiseintopf (19,21,23)\tBio-Dinkelbrötchen (19,21,a)\t\t\t\t\tOrganic bell pepper and sweetcorn stew (19,21,23)\tOrganic spelt roll (19,21,a)\t\t\t\t\t1,80\t3,40\t4,20\tg\t\t\t19, 21, 23, a, 0\tBio-Erzeugnis DE-ÖKO-039, vegan, Bio-Menü, Glutenhaltiges Getreide (a), zusatzstoff- und allergenfrei\t-\tBrennwert=1900 kJ (454 kcal), Fett=5,7g, davon gesättigte Fettsäuren=0,8g, Kohlenhydrate=78,0g, davon Zucker=15,4g, Ballaststoffe=11,9g, Eiweiß=13,5g, Salz=4,4g,\nMensa Westerberg\t02.02.2022\t2130\t6510\tKM 3 veget./vegan,+1,35 €\tHauptgericht\t1855\tKräuter-Rahmchampignons mit Semmelknödeln (1,20,a,c,g)\tSalatgarnitur (21)\t\t\t\t\tCreamy herb mushrooms with bread dumplings (1,20,a,c,g)\tSalad bouquet (21)\t\t\t\t\t2,30\t3,65\t4,45\tc\t\t\t1, 20, 21, 22, a, c, g, 0\tmit Farbstoff, vegetarisch, vegan, nicht vegan/vegetarisch (tierische Hilfsstoffe), Glutenhaltiges Getreide (a), Hühnerei (c), Milch und Laktose (g), zusatzstoff- und allergenfrei\t-\tBrennwert=950 kJ (227 kcal), Fett=12,0g, davon gesättigte Fettsäuren=4,6g, Kohlenhydrate=16,9g, davon Zucker=7,3g, Ballaststoffe=5,9g, Eiweiß=8,5g, Salz=2,8g,\nMensa Westerberg\t02.02.2022\t2130\t4388\tKM 1 veget./vegan,+1,35 €\tHauptgericht\t2772\tBurrito Bowl mit Räuchertofu, Naturreis, Avocado und Koriandertopping an feuriger Sauce (2,21,a,f)\t\t\t\t\t\tBurrito Bowl with smoked tofu, brown rice, avocado, coriander topping and spicy sauce (2,21,a,f)\t\t\t\t\t\t3,30\t4,65\t5,45\tg\t\t\t2, 21, a, f, 0\tmit Konservierungsstoff, vegan, Glutenhaltiges Getreide (a), Soja (f), zusatzstoff- und allergenfrei\t-\tBrennwert=3847 kJ (919 kcal), Fett=36,6g, davon gesättigte Fettsäuren=5,5g, Kohlenhydrate=100,9g, davon Zucker=20,9g, Ballaststoffe=10,1g, Eiweiß=35,5g, Salz=6,6g,\nMensa Westerberg\t02.02.2022\t1714\t3614\tEintopf (Terrine, Teller)\tEintopf Terrine\t3157\tBio Paprika-Maiseintopf (19,21,23)\tBio-Dinkelbrötchen (19,21,a)\t\t\t\t\tOrganic bell pepper and sweetcorn stew (19,21,23)\tOrganic spelt roll (19,21,a)\t\t\t\t\t1,80\t3,40\t4,20\tg\t\t\t19, 21, 23, a, 0\tBio-Erzeugnis DE-ÖKO-039, vegan, Bio-Menü, Glutenhaltiges Getreide (a), zusatzstoff- und allergenfrei\t-\tBrennwert=1900 kJ (454 kcal), Fett=5,7g, davon gesättigte Fettsäuren=0,8g, Kohlenhydrate=78,0g, davon Zucker=15,4g, Ballaststoffe=11,9g, Eiweiß=13,5g, Salz=4,4g,\nMensa Westerberg\t02.02.2022\t2130\t6510\tKM 3 veget./vegan,+1,35 €\tHauptgericht\t806\tKräuter-Rahmchampignons mit Semmelknödeln (1,20,a,c,g)\tSalatgarnitur (21)\t\t\t\t\tCreamy herb mushrooms with bread dumplings (1,20,a,c,g)\tSalad bouquet (21)\t\t\t\t\t2,30\t3,65\t4,45\tc\t\t\t1, 20, 21, 22, a, c, g, 0\tmit Farbstoff, vegetarisch, vegan, nicht vegan/vegetarisch (tierische Hilfsstoffe), Glutenhaltiges Getreide (a), Hühnerei (c), Milch und Laktose (g), zusatzstoff- und allergenfrei\t-\tBrennwert=950 kJ (227 kcal), Fett=12,0g, davon gesättigte Fettsäuren=4,6g, Kohlenhydrate=16,9g, davon Zucker=7,3g, Ballaststoffe=5,9g, Eiweiß=8,5g, Salz=2,8g,\nMensa Westerberg\t02.02.2022\t2097\t3665\tDessert 1\tDessert\t2131\tGötterspeise Waldmeister (1,25)\tVanillesauce (g)\t\t\t\t\tWoodruff jelly (1,25)\t\t\t\t\t\t0,40\t0,90\t1,10\tc\t\t\t1, 25, g, 0\tmit Farbstoff, mit Gelatine, Milch und Laktose (g), zusatzstoff- und allergenfrei\t-\tBrennwert=627 kJ (150 kcal), Fett=1,1g, davon gesättigte Fettsäuren=0,7g, Kohlenhydrate=31,1g, davon Zucker=30,2g, Eiweiß=3,1g, Salz=0,1g,\nMensa Westerberg\t02.02.2022\t1701\t3646\tGemüsebeilage 3/Tagessala\tTagessalat\t2024\tCouscoussalat (2,3,21,a,k)\t\t\t\t\t\tCouscous salad (2,3,21,a,k)\t\t\t\t\t\t0,70\t1,20\t1,40\ta\t\t\t2, 3, 21, a, k, 0\tmit Konservierungsstoff, mit Antioxidationsmittel, vegan, Glutenhaltiges Getreide (a), Schwefeldioxid u. Sulfite (k), zusatzstoff- und allergenfrei\t-\tBrennwert=691 kJ (165 kcal), Fett=1,9g, davon gesättigte Fettsäuren=0,3g, Kohlenhydrate=27,6g, davon Zucker=7,2g, Ballaststoffe=3,3g, Eiweiß=5,7g, Salz=5,6g,\nMensa Westerberg\t02.02.2022\t2130\t4389\tKM 2 Fleisch/Fisc,+1,55 €\tHauptgericht\t3149\tBurrito Bowl mit Pulled Chicken, Naturreis, Avocado und Koriandertopping an feuriger Sauce (2,a,40)\t\t\t\t\t\tBurrito Bowl with pulled chicken, brown rice, avocado, coriander topping and spicy sauce (2,a,40)\t\t\t\t\t\t3,70\t5,25\t6,05\ta\t\t\t2, a, 40, 0\tmit Konservierungsstoff, Glutenhaltiges Getreide (a), Geflügel, zusatzstoff- und allergenfrei\t-\tBrennwert=3420 kJ (817 kcal), Fett=28,0g, davon gesättigte Fettsäuren=4,5g, Kohlenhydrate=100,1g, davon Zucker=20,1g, Ballaststoffe=8,3g, Eiweiß=30,7g, Salz=8,1g,\nMensa Haste\t03.02.2022\t2130\t10518\tKM 5 veget./vegan,+1,35 €\tHauptgericht\t3183\tPommes frites groß (21)\t\t\t\t\t\tPommes frites large (21)\t\t\t\t\t\t1,00\t2,35\t3,15\tc\t\t\t21, 0\tvegan, zusatzstoff- und allergenfrei\t-\t-\nMensa Haste\t03.02.2022\t2130\t4389\tKM 2 Fleisch/Fisc,+1,55 €\tHauptgericht\t651\tPaniertes Putenschnitzel (a,40)\tSchaschliksauce (17,40)\tHerzoginkartoffeln (2,20,a,c,g)\tGrüne Schnittbohnen (21)\t\t\tBreaded turkey escalope (a,40)\tShashlik sauce (17,40)\tDuchess potatoes (2,20,a,c,g)\tGreen beans (21)\t\t\t2,90\t4,45\t5,25\tc\t\t\t2, R, 17, 20, 21, a, c, g, 40, 0\tmit Konservierungsstoff, Artikel aus der Region, Knoblauch, vegetarisch, vegan, Glutenhaltiges Getreide (a), Hühnerei (c), Milch und Laktose (g), Geflügel, zusatzstoff- und allergenfrei\t-\t-\nMensa Haste\t03.02.2022\t2130\t4389\tKM 2 Fleisch/Fisc,+1,55 €\tHauptgericht\t1162\tPaniertes Putenschnitzel (a,40)\tSchaschliksauce (17,40)\tHerzoginkartoffeln (2,20,a,c,g)\tGrüne Schnittbohnen (21)\t\t\tBreaded turkey escalope (a,40)\tShashlik sauce (17,40)\tDuchess potatoes (2,20,a,c,g)\tGreen beans (21)\t\t\t2,90\t4,45\t5,25\tc\t\t\t2, R, 17, 20, 21, a, c, g, 40, 0\tmit Konservierungsstoff, Artikel aus der Region, Knoblauch, vegetarisch, vegan, Glutenhaltiges Getreide (a), Hühnerei (c), Milch und Laktose (g), Geflügel, zusatzstoff- und allergenfrei\t-\t-\nMensa Haste\t03.02.2022\t2130\t4389\tKM 2 Fleisch/Fisc,+1,55 €\tHauptgericht\t11\tPaniertes Putenschnitzel (a,40)\tSchaschliksauce (17,40)\tHerzoginkartoffeln (2,20,a,c,g)\tGrüne Schnittbohnen (21)\t\t\tBreaded turkey escalope (a,40)\tShashlik sauce (17,40)\tDuchess potatoes (2,20,a,c,g)\tGreen beans (21)\t\t\t2,90\t4,45\t5,25\tc\t\t\t2, R, 17, 20, 21, a, c, g, 40, 0\tmit Konservierungsstoff, Artikel aus der Region, Knoblauch, vegetarisch, vegan, Glutenhaltiges Getreide (a), Hühnerei (c), Milch und Laktose (g), Geflügel, zusatzstoff- und allergenfrei\t-\t-\nMensa Haste\t03.02.2022\t1701\t3648\tStärkebeilage 3\tBeilagen\t525\tPommes frites klein (21)\t\t\t\t\t\tPommes frites small (21)\t\t\t\t\t\t0,55\t1,05\t1,25\tc\t\t\t21, 0\tvegan, zusatzstoff- und allergenfrei\t-\t-\nMensa Haste\t03.02.2022\t1714\t3614\tEintopf (Terrine, Teller)\tEintopf Terrine\t1037\tPikanter Linseneintopf mit Knoblauch und Tomate (2,17,21,i)\tWeizenbrötchen (1,21,a,f)\t\t\t\t\tSpicy lentil stew with garlic and tomato (2,17,21,i)\tBread roll (1,21,a,f)\t\t\t\t\t1,80\t3,40\t4,20\tg\t\t\t1, 2, 17, 21, a, i, f, 0\tmit Farbstoff, mit Konservierungsstoff, Knoblauch, vegan, Glutenhaltiges Getreide (a), Sellerie (i), Soja (f), zusatzstoff- und allergenfrei\t-\t-\nMensa Haste\t03.02.2022\t2130\t4389\tKM 2 Fleisch/Fisc,+1,55 €\tHauptgericht\t2762\tPaniertes Putenschnitzel (a,40)\tSchaschliksauce (17,40)\tHerzoginkartoffeln (2,20,a,c,g)\tGrüne Schnittbohnen (21)\t\t\tBreaded turkey escalope (a,40)\tShashlik sauce (17,40)\tDuchess potatoes (2,20,a,c,g)\tGreen beans (21)\t\t\t2,90\t4,45\t5,25\tc\t\t\t2, R, 17, 20, 21, a, c, g, 40, 0\tmit Konservierungsstoff, Artikel aus der Region, Knoblauch, vegetarisch, vegan, Glutenhaltiges Getreide (a), Hühnerei (c), Milch und Laktose (g), Geflügel, zusatzstoff- und allergenfrei\t-\t-\nMensa Haste\t03.02.2022\t2130\t4388\tKM 1 veget./vegan,+1,35 €\tHauptgericht\t2923\tMiso Nasu Donburi - Sojageschnetzeltes mit Gemüse, Sesam und Basmatireis (2,17,21,m,f)\t\t\t\t\t\tMiso Nasu Donburi - Soy cutlets with vegetables, sesame and basmati rice (2,17,21,m,f)\t\t\t\t\t\t2,40\t3,75\t4,55\tg\t\t\t2, 17, 21, m, f, 0\tmit Konservierungsstoff, Knoblauch, vegan, Sesam (m), Soja (f), zusatzstoff- und allergenfrei\t-\t-\nMensa Haste\t03.02.2022\t1714\t3614\tEintopf (Terrine, Teller)\tEintopf Terrine\t2045\tPikanter Linseneintopf mit Knoblauch und Tomate (2,17,21,i)\tWeizenbrötchen (1,21,a,f)\t\t\t\t\tSpicy lentil stew with garlic and tomato (2,17,21,i)\tBread roll (1,21,a,f)\t\t\t\t\t1,80\t3,40\t4,20\tg\t\t\t1, 2, 17, 21, a, i, f, 0\tmit Farbstoff, mit Konservierungsstoff, Knoblauch, vegan, Glutenhaltiges Getreide (a), Sellerie (i), Soja (f), zusatzstoff- und allergenfrei\t-\t-\nMensa Lingen\t03.02.2022\t2130\t4389\tKM 2 Fleisch/Fisc,+1,55 €\tHauptgericht\t1162\tPaniertes Putenschnitzel (a,40)\tSchaschliksauce (17,40)\tHerzoginkartoffeln (2,20,a,c,g)\tGrüne Schnittbohnen (21)\t\t\tBreaded turkey escalope (a,40)\tShashlik sauce (17,40)\tDuchess potatoes (2,20,a,c,g)\tGreen beans (21)\t\t\t2,90\t4,45\t5,25\tc\t\t\t2, R, 17, 20, 21, a, c, g, 40, 0\tmit Konservierungsstoff, Artikel aus der Region, Knoblauch, vegetarisch, vegan, Glutenhaltiges Getreide (a), Hühnerei (c), Milch und Laktose (g), Geflügel, zusatzstoff- und allergenfrei\t-\t-\nMensa Lingen\t03.02.2022\t2130\t10518\tKM 5 veget./vegan,+1,35 €\tHauptgericht\t3183\tPommes frites groß (21)\t\t\t\t\t\tPommes frites large (21)\t\t\t\t\t\t1,00\t2,35\t3,15\tc\t\t\t21, 0\tvegan, zusatzstoff- und allergenfrei\t-\t-\nMensa Lingen\t03.02.2022\t2130\t4389\tKM 2 Fleisch/Fisc,+1,55 €\tHauptgericht\t651\tPaniertes Putenschnitzel (a,40)\tSchaschliksauce (17,40)\tHerzoginkartoffeln (2,20,a,c,g)\tGrüne Schnittbohnen (21)\t\t\tBreaded turkey escalope (a,40)\tShashlik sauce (17,40)\tDuchess potatoes (2,20,a,c,g)\tGreen beans (21)\t\t\t2,90\t4,45\t5,25\tc\t\t\t2, R, 17, 20, 21, a, c, g, 40, 0\tmit Konservierungsstoff, Artikel aus der Region, Knoblauch, vegetarisch, vegan, Glutenhaltiges Getreide (a), Hühnerei (c), Milch und Laktose (g), Geflügel, zusatzstoff- und allergenfrei\t-\t-\nMensa Lingen\t03.02.2022\t2130\t4389\tKM 2 Fleisch/Fisc,+1,55 €\tHauptgericht\t11\tPaniertes Putenschnitzel (a,40)\tSchaschliksauce (17,40)\tHerzoginkartoffeln (2,20,a,c,g)\tGrüne Schnittbohnen (21)\t\t\tBreaded turkey escalope (a,40)\tShashlik sauce (17,40)\tDuchess potatoes (2,20,a,c,g)\tGreen beans (21)\t\t\t2,90\t4,45\t5,25\tc\t\t\t2, R, 17, 20, 21, a, c, g, 40, 0\tmit Konservierungsstoff, Artikel aus der Region, Knoblauch, vegetarisch, vegan, Glutenhaltiges Getreide (a), Hühnerei (c), Milch und Laktose (g), Geflügel, zusatzstoff- und allergenfrei\t-\t-\nMensa Lingen\t03.02.2022\t2130\t4389\tKM 2 Fleisch/Fisc,+1,55 €\tHauptgericht\t2762\tPaniertes Putenschnitzel (a,40)\tSchaschliksauce (17,40)\tHerzoginkartoffeln (2,20,a,c,g)\tGrüne Schnittbohnen (21)\t\t\tBreaded turkey escalope (a,40)\tShashlik sauce (17,40)\tDuchess potatoes (2,20,a,c,g)\tGreen beans (21)\t\t\t2,90\t4,45\t5,25\tc\t\t\t2, R, 17, 20, 21, a, c, g, 40, 0\tmit Konservierungsstoff, Artikel aus der Region, Knoblauch, vegetarisch, vegan, Glutenhaltiges Getreide (a), Hühnerei (c), Milch und Laktose (g), Geflügel, zusatzstoff- und allergenfrei\t-\t-\nMensa Lingen\t03.02.2022\t2130\t4388\tKM 1 veget./vegan,+1,35 €\tHauptgericht\t2923\tMiso Nasu Donburi - Sojageschnetzeltes mit Gemüse, Sesam und Basmatireis (2,17,21,m,f)\t\t\t\t\t\tMiso Nasu Donburi - Soy cutlets with vegetables, sesame and basmati rice (2,17,21,m,f)\t\t\t\t\t\t2,40\t3,75\t4,55\tg\t\t\t2, 17, 21, m, f, 0\tmit Konservierungsstoff, Knoblauch, vegan, Sesam (m), Soja (f), zusatzstoff- und allergenfrei\t-\t-\nMensa Lingen\t03.02.2022\t1701\t3648\tStärkebeilage 3\tBeilagen\t525\tPommes frites klein (21)\t\t\t\t\t\tPommes frites small (21)\t\t\t\t\t\t0,55\t1,05\t1,25\tc\t\t\t21, 0\tvegan, zusatzstoff- und allergenfrei\t-\t-\nMensa Schlossgarten\t03.02.2022\t2130\t4388\tKM 1 veget./vegan,+1,35 €\tHauptgericht\t2923\tMiso Nasu Donburi - Sojageschnetzeltes mit Gemüse, Sesam und Basmatireis (2,17,21,m,f)\t\t\t\t\t\tMiso Nasu Donburi - Soy cutlets with vegetables, sesame and basmati rice (2,17,21,m,f)\t\t\t\t\t\t2,40\t3,75\t4,55\tg\t\t\t2, 17, 21, m, f, 0\tmit Konservierungsstoff, Knoblauch, vegan, Sesam (m), Soja (f), zusatzstoff- und allergenfrei\t-\tBrennwert=2459 kJ (587 kcal), Fett=11,0g, davon gesättigte Fettsäuren=1,7g, Kohlenhydrate=73,5g, davon Zucker=12,7g, Ballaststoffe=18,0g, Eiweiß=36,6g, Salz=1,8g,\nMensa Schlossgarten\t03.02.2022\t1701\t3648\tStärkebeilage 3\tBeilagen\t525\tPommes frites klein (21)\t\t\t\t\t\tPommes frites small (21)\t\t\t\t\t\t0,55\t1,05\t1,25\tc\t\t\t21, 0\tvegan, zusatzstoff- und allergenfrei\t-\t-\nMensa Schlossgarten\t03.02.2022\t1701\t3646\tGemüsebeilage 3/Tagessala\tTagessalat\t473\tGurken-Maissalat (21,j)\t\t\t\t\t\tCucumber and sweetcorn salad (21,j)\t\t\t\t\t\t0,50\t1,00\t1,20\ta\t\t\t21, j, 0\tvegan, Senf (j), zusatzstoff- und allergenfrei\t-\tBrennwert=537 kJ (128 kcal), Fett=5,3g, davon gesättigte Fettsäuren=0,5g, Kohlenhydrate=16,0g, davon Zucker=9,2g, Ballaststoffe=2,4g, Eiweiß=2,9g, Salz=2,5g,\nMensa Schlossgarten\t03.02.2022\t1714\t3614\tEintopf (Terrine, Teller)\tEintopf Terrine\t2045\tPikanter Linseneintopf mit Knoblauch und Tomate (2,17,21,i)\tWeizenbrötchen (1,21,a,f)\t\t\t\t\tSpicy lentil stew with garlic and tomato (2,17,21,i)\tBread roll (1,21,a,f)\t\t\t\t\t1,80\t3,40\t4,20\tg\t\t\t1, 2, 17, 21, a, i, f, 0\tmit Farbstoff, mit Konservierungsstoff, Knoblauch, vegan, Glutenhaltiges Getreide (a), Sellerie (i), Soja (f), zusatzstoff- und allergenfrei\t-\tBrennwert=2018 kJ (482 kcal), Fett=2,1g, davon gesättigte Fettsäuren=0,6g, Kohlenhydrate=88,5g, davon Zucker=11,2g, Ballaststoffe=9,7g, Eiweiß=20,0g, Salz=7,1g,\nMensa Schlossgarten\t03.02.2022\t1714\t3614\tEintopf (Terrine, Teller)\tEintopf Terrine\t1037\tPikanter Linseneintopf mit Knoblauch und Tomate (2,17,21,i)\tWeizenbrötchen (1,21,a,f)\t\t\t\t\tSpicy lentil stew with garlic and tomato (2,17,21,i)\tBread roll (1,21,a,f)\t\t\t\t\t1,80\t3,40\t4,20\tg\t\t\t1, 2, 17, 21, a, i, f, 0\tmit Farbstoff, mit Konservierungsstoff, Knoblauch, vegan, Glutenhaltiges Getreide (a), Sellerie (i), Soja (f), zusatzstoff- und allergenfrei\t-\tBrennwert=2018 kJ (482 kcal), Fett=2,1g, davon gesättigte Fettsäuren=0,6g, Kohlenhydrate=88,5g, davon Zucker=11,2g, Ballaststoffe=9,7g, Eiweiß=20,0g, Salz=7,1g,\nMensa Schlossgarten\t03.02.2022\t2130\t4389\tKM 2 Fleisch/Fisc,+1,55 €\tHauptgericht\t651\tPaniertes Putenschnitzel (a,40)\tSchaschliksauce (17,40)\tHerzoginkartoffeln (2,20,a,c,g)\tGrüne Schnittbohnen (21)\t\t\tBreaded turkey escalope (a,40)\tShashlik sauce (17,40)\tDuchess potatoes (2,20,a,c,g)\tGreen beans (21)\t\t\t2,90\t4,45\t5,25\tc\t\t\t2, R, 17, 20, 21, a, c, g, 40, 0\tmit Konservierungsstoff, Artikel aus der Region, Knoblauch, vegetarisch, vegan, Glutenhaltiges Getreide (a), Hühnerei (c), Milch und Laktose (g), Geflügel, zusatzstoff- und allergenfrei\t-\tBrennwert=3757 kJ (897 kcal), Fett=49,1g, davon gesättigte Fettsäuren=5,2g, Kohlenhydrate=74,4g, davon Zucker=16,7g, Ballaststoffe=5,8g, Eiweiß=36,6g, Salz=7,4g,\nMensa Schlossgarten\t03.02.2022\t2130\t4389\tKM 2 Fleisch/Fisc,+1,55 €\tHauptgericht\t11\tPaniertes Putenschnitzel (a,40)\tSchaschliksauce (17,40)\tHerzoginkartoffeln (2,20,a,c,g)\tGrüne Schnittbohnen (21)\t\t\tBreaded turkey escalope (a,40)\tShashlik sauce (17,40)\tDuchess potatoes (2,20,a,c,g)\tGreen beans (21)\t\t\t2,90\t4,45\t5,25\tc\t\t\t2, R, 17, 20, 21, a, c, g, 40, 0\tmit Konservierungsstoff, Artikel aus der Region, Knoblauch, vegetarisch, vegan, Glutenhaltiges Getreide (a), Hühnerei (c), Milch und Laktose (g), Geflügel, zusatzstoff- und allergenfrei\t-\tBrennwert=3757 kJ (897 kcal), Fett=49,1g, davon gesättigte Fettsäuren=5,2g, Kohlenhydrate=74,4g, davon Zucker=16,7g, Ballaststoffe=5,8g, Eiweiß=36,6g, Salz=7,4g,\nMensa Schlossgarten\t03.02.2022\t2130\t4389\tKM 2 Fleisch/Fisc,+1,55 €\tHauptgericht\t2762\tPaniertes Putenschnitzel (a,40)\tSchaschliksauce (17,40)\tHerzoginkartoffeln (2,20,a,c,g)\tGrüne Schnittbohnen (21)\t\t\tBreaded turkey escalope (a,40)\tShashlik sauce (17,40)\tDuchess potatoes (2,20,a,c,g)\tGreen beans (21)\t\t\t2,90\t4,45\t5,25\tc\t\t\t2, R, 17, 20, 21, a, c, g, 40, 0\tmit Konservierungsstoff, Artikel aus der Region, Knoblauch, vegetarisch, vegan, Glutenhaltiges Getreide (a), Hühnerei (c), Milch und Laktose (g), Geflügel, zusatzstoff- und allergenfrei\t-\tBrennwert=3757 kJ (897 kcal), Fett=49,1g, davon gesättigte Fettsäuren=5,2g, Kohlenhydrate=74,4g, davon Zucker=16,7g, Ballaststoffe=5,8g, Eiweiß=36,6g, Salz=7,4g,\nMensa Schlossgarten\t03.02.2022\t2130\t4389\tKM 2 Fleisch/Fisc,+1,55 €\tHauptgericht\t1162\tPaniertes Putenschnitzel (a,40)\tSchaschliksauce (17,40)\tHerzoginkartoffeln (2,20,a,c,g)\tGrüne Schnittbohnen (21)\t\t\tBreaded turkey escalope (a,40)\tShashlik sauce (17,40)\tDuchess potatoes (2,20,a,c,g)\tGreen beans (21)\t\t\t2,90\t4,45\t5,25\tc\t\t\t2, R, 17, 20, 21, a, c, g, 40, 0\tmit Konservierungsstoff, Artikel aus der Region, Knoblauch, vegetarisch, vegan, Glutenhaltiges Getreide (a), Hühnerei (c), Milch und Laktose (g), Geflügel, zusatzstoff- und allergenfrei\t-\tBrennwert=3757 kJ (897 kcal), Fett=49,1g, davon gesättigte Fettsäuren=5,2g, Kohlenhydrate=74,4g, davon Zucker=16,7g, Ballaststoffe=5,8g, Eiweiß=36,6g, Salz=7,4g,\nMensa Schlossgarten\t03.02.2022\t2130\t10518\tKM 5 veget./vegan,+1,35 €\tHauptgericht\t3183\tPommes frites groß (21)\t\t\t\t\t\tPommes frites large (21)\t\t\t\t\t\t1,00\t2,35\t3,15\tc\t\t\t21, 0\tvegan, zusatzstoff- und allergenfrei\t-\t-\nMensa Schlossgarten\t03.02.2022\t2097\t3665\tDessert 1\tDessert\t2331\tVeganer Grießbrei mit Zimt und Zucker (21,a,f)\t\t\t\t\t\tVegan semolina pudding with cinnamon and sugar (21,a,f)\t\t\t\t\t\t0,70\t1,20\t1,40\tg\t\t\t21, a, f, 0\tvegan, Glutenhaltiges Getreide (a), Soja (f), zusatzstoff- und allergenfrei\t-\tBrennwert=861 kJ (206 kcal), Fett=8,8g, davon gesättigte Fettsäuren=2,2g, Kohlenhydrate=29,0g, davon Zucker=12,5g, Ballaststoffe=1,9g, Eiweiß=2,6g, Salz=0,8g,\nMensa Vechta\t03.02.2022\t2130\t4389\tKM 2 Fleisch/Fisc,+1,55 €\tHauptgericht\t2070\tPaniertes Putenschnitzel (a,40)\tSchaschliksauce (17,40)\tHerzoginkartoffeln (2,20,a,c,g)\tBio-Maisgemüse (19,21)\t\t\tBreaded turkey escalope (a,40)\tShashlik sauce (17,40)\tDuchess potatoes (2,20,a,c,g)\tOrganic sweetcorn (19,21)\t\t\t2,90\t4,45\t5,25\tc\t\t\t2, R, 17, 19, 20, 21, a, c, g, 40, 0\tmit Konservierungsstoff, Artikel aus der Region, Knoblauch, Bio-Erzeugnis DE-ÖKO-039, vegetarisch, vegan, Glutenhaltiges Getreide (a), Hühnerei (c), Milch und Laktose (g), Geflügel, zusatzstoff- und allergenfrei\t-\tBrennwert=4332 kJ (1035 kcal), Fett=52,8g, davon gesättigte Fettsäuren=6,1g, Kohlenhydrate=98,3g, davon Zucker=21,6g, Ballaststoffe=6,6g, Eiweiß=37,8g, Salz=7,1g,\nMensa Vechta\t03.02.2022\t2130\t4389\tKM 2 Fleisch/Fisc,+1,55 €\tHauptgericht\t11\tPaniertes Putenschnitzel (a,40)\tSchaschliksauce (17,40)\tHerzoginkartoffeln (2,20,a,c,g)\tBio-Maisgemüse (19,21)\t\t\tBreaded turkey escalope (a,40)\tShashlik sauce (17,40)\tDuchess potatoes (2,20,a,c,g)\tOrganic sweetcorn (19,21)\t\t\t2,90\t4,45\t5,25\tc\t\t\t2, R, 17, 19, 20, 21, a, c, g, 40, 0\tmit Konservierungsstoff, Artikel aus der Region, Knoblauch, Bio-Erzeugnis DE-ÖKO-039, vegetarisch, vegan, Glutenhaltiges Getreide (a), Hühnerei (c), Milch und Laktose (g), Geflügel, zusatzstoff- und allergenfrei\t-\tBrennwert=4332 kJ (1035 kcal), Fett=52,8g, davon gesättigte Fettsäuren=6,1g, Kohlenhydrate=98,3g, davon Zucker=21,6g, Ballaststoffe=6,6g, Eiweiß=37,8g, Salz=7,1g,\nMensa Vechta\t03.02.2022\t2130\t4389\tKM 2 Fleisch/Fisc,+1,55 €\tHauptgericht\t1162\tPaniertes Putenschnitzel (a,40)\tSchaschliksauce (17,40)\tHerzoginkartoffeln (2,20,a,c,g)\tBio-Maisgemüse (19,21)\t\t\tBreaded turkey escalope (a,40)\tShashlik sauce (17,40)\tDuchess potatoes (2,20,a,c,g)\tOrganic sweetcorn (19,21)\t\t\t2,90\t4,45\t5,25\tc\t\t\t2, R, 17, 19, 20, 21, a, c, g, 40, 0\tmit Konservierungsstoff, Artikel aus der Region, Knoblauch, Bio-Erzeugnis DE-ÖKO-039, vegetarisch, vegan, Glutenhaltiges Getreide (a), Hühnerei (c), Milch und Laktose (g), Geflügel, zusatzstoff- und allergenfrei\t-\tBrennwert=4332 kJ (1035 kcal), Fett=52,8g, davon gesättigte Fettsäuren=6,1g, Kohlenhydrate=98,3g, davon Zucker=21,6g, Ballaststoffe=6,6g, Eiweiß=37,8g, Salz=7,1g,\nMensa Vechta\t03.02.2022\t1701\t3648\tStärkebeilage 3\tBeilagen\t525\tPommes frites klein (21)\t\t\t\t\t\tPommes frites small (21)\t\t\t\t\t\t0,55\t1,05\t1,25\tc\t\t\t21, 0\tvegan, zusatzstoff- und allergenfrei\t-\t-\nMensa Vechta\t03.02.2022\t2130\t10518\tKM 5 veget./vegan,+1,35 €\tHauptgericht\t3183\tPommes frites groß (21)\t\t\t\t\t\tPommes frites large (21)\t\t\t\t\t\t1,00\t2,35\t3,15\tc\t\t\t21, 0\tvegan, zusatzstoff- und allergenfrei\t-\tBrennwert=2194 kJ (524 kcal), Fett=24,2g, davon gesättigte Fettsäuren=8,8g, Kohlenhydrate=66,0g, davon Zucker=1,5g, Ballaststoffe=6,0g, Eiweiß=7,5g, Salz=1,6g,\nMensa Vechta\t03.02.2022\t2130\t4388\tKM 1 veget./vegan,+1,35 €\tHauptgericht\t2923\tMiso Nasu Donburi - Sojageschnetzeltes mit Gemüse, Sesam und Basmatireis (2,17,21,m,f)\t\t\t\t\t\tMiso Nasu Donburi - Soy cutlets with vegetables, sesame and basmati rice (2,17,21,m,f)\t\t\t\t\t\t2,40\t3,75\t4,55\tg\t\t\t2, 17, 21, m, f, 0\tmit Konservierungsstoff, Knoblauch, vegan, Sesam (m), Soja (f), zusatzstoff- und allergenfrei\t-\tBrennwert=2463 kJ (588 kcal), Fett=11,1g, davon gesättigte Fettsäuren=1,7g, Kohlenhydrate=73,5g, davon Zucker=12,6g, Ballaststoffe=18,0g, Eiweiß=36,7g, Salz=1,8g,\nMensa Vechta\t03.02.2022\t2130\t4389\tKM 2 Fleisch/Fisc,+1,55 €\tHauptgericht\t651\tPaniertes Putenschnitzel (a,40)\tSchaschliksauce (17,40)\tHerzoginkartoffeln (2,20,a,c,g)\tBio-Maisgemüse (19,21)\t\t\tBreaded turkey escalope (a,40)\tShashlik sauce (17,40)\tDuchess potatoes (2,20,a,c,g)\tOrganic sweetcorn (19,21)\t\t\t2,90\t4,45\t5,25\tc\t\t\t2, R, 17, 19, 20, 21, a, c, g, 40, 0\tmit Konservierungsstoff, Artikel aus der Region, Knoblauch, Bio-Erzeugnis DE-ÖKO-039, vegetarisch, vegan, Glutenhaltiges Getreide (a), Hühnerei (c), Milch und Laktose (g), Geflügel, zusatzstoff- und allergenfrei\t-\tBrennwert=4332 kJ (1035 kcal), Fett=52,8g, davon gesättigte Fettsäuren=6,1g, Kohlenhydrate=98,3g, davon Zucker=21,6g, Ballaststoffe=6,6g, Eiweiß=37,8g, Salz=7,1g,\nMensa Westerberg\t03.02.2022\t2130\t4388\tKM 1 veget./vegan,+1,35 €\tHauptgericht\t2923\tMiso Nasu Donburi - Sojageschnetzeltes mit Gemüse, Sesam und Basmatireis (2,17,21,m,f)\t\t\t\t\t\tMiso Nasu Donburi - Soy cutlets with vegetables, sesame and basmati rice (2,17,21,m,f)\t\t\t\t\t\t2,40\t3,75\t4,55\tg\t\t\t2, 17, 21, m, f, 0\tmit Konservierungsstoff, Knoblauch, vegan, Sesam (m), Soja (f), zusatzstoff- und allergenfrei\t-\tBrennwert=2459 kJ (587 kcal), Fett=11,0g, davon gesättigte Fettsäuren=1,7g, Kohlenhydrate=73,5g, davon Zucker=12,7g, Ballaststoffe=18,0g, Eiweiß=36,6g, Salz=1,8g,\nMensa Westerberg\t03.02.2022\t1714\t3614\tEintopf (Terrine, Teller)\tEintopf Terrine\t1037\tPikanter Linseneintopf mit Knoblauch und Tomate (2,17,21,i)\tWeizenbrötchen (1,21,a,f)\t\t\t\t\tSpicy lentil stew with garlic and tomato (2,17,21,i)\tBread roll (1,21,a,f)\t\t\t\t\t1,80\t3,40\t4,20\tg\t\t\t1, 2, 17, 21, a, i, f, 0\tmit Farbstoff, mit Konservierungsstoff, Knoblauch, vegan, Glutenhaltiges Getreide (a), Sellerie (i), Soja (f), zusatzstoff- und allergenfrei\t-\tBrennwert=2016 kJ (482 kcal), Fett=2,1g, davon gesättigte Fettsäuren=0,5g, Kohlenhydrate=88,4g, davon Zucker=11,1g, Ballaststoffe=9,7g, Eiweiß=19,9g, Salz=7,1g,\nMensa Westerberg\t03.02.2022\t1701\t3646\tGemüsebeilage 3/Tagessala\tTagessalat\t473\tGurken-Maissalat (21,j)\t\t\t\t\t\tCucumber and sweetcorn salad (21,j)\t\t\t\t\t\t0,50\t1,00\t1,20\ta\t\t\t21, j, 0\tvegan, Senf (j), zusatzstoff- und allergenfrei\t-\tBrennwert=537 kJ (128 kcal), Fett=5,3g, davon gesättigte Fettsäuren=0,5g, Kohlenhydrate=16,0g, davon Zucker=9,2g, Ballaststoffe=2,4g, Eiweiß=2,9g, Salz=2,6g,\nMensa Westerberg\t03.02.2022\t2130\t4389\tKM 2 Fleisch/Fisc,+1,55 €\tHauptgericht\t1162\tPaniertes Putenschnitzel (a,40)\tSchaschliksauce (17,40)\tHerzoginkartoffeln (2,20,a,c,g)\tGrüne Schnittbohnen (21)\t\t\tBreaded turkey escalope (a,40)\tShashlik sauce (17,40)\tDuchess potatoes (2,20,a,c,g)\tGreen beans (21)\t\t\t2,90\t4,45\t5,25\tc\t\t\t2, R, 17, 20, 21, a, c, g, 40, 0\tmit Konservierungsstoff, Artikel aus der Region, Knoblauch, vegetarisch, vegan, Glutenhaltiges Getreide (a), Hühnerei (c), Milch und Laktose (g), Geflügel, zusatzstoff- und allergenfrei\t-\tBrennwert=3758 kJ (898 kcal), Fett=49,1g, davon gesättigte Fettsäuren=5,2g, Kohlenhydrate=74,4g, davon Zucker=16,8g, Ballaststoffe=5,8g, Eiweiß=36,6g, Salz=7,4g,\nMensa Westerberg\t03.02.2022\t2130\t10518\tKM 5 veget./vegan,+1,35 €\tHauptgericht\t3183\tPommes frites groß (21)\t\t\t\t\t\tPommes frites large (21)\t\t\t\t\t\t1,00\t2,35\t3,15\tc\t\t\t21, 0\tvegan, zusatzstoff- und allergenfrei\t-\t-\nMensa Westerberg\t03.02.2022\t2097\t3665\tDessert 1\tDessert\t2331\tVeganer Grießbrei mit Zimt und Zucker (21,a,f)\t\t\t\t\t\tVegan semolina pudding with cinnamon and sugar (21,a,f)\t\t\t\t\t\t0,70\t1,20\t1,40\tg\t\t\t21, a, f, 0\tvegan, Glutenhaltiges Getreide (a), Soja (f), zusatzstoff- und allergenfrei\t-\tBrennwert=861 kJ (206 kcal), Fett=8,8g, davon gesättigte Fettsäuren=2,2g, Kohlenhydrate=29,0g, davon Zucker=12,5g, Ballaststoffe=2,0g, Eiweiß=2,6g, Salz=0,8g,\nMensa Westerberg\t03.02.2022\t1714\t3614\tEintopf (Terrine, Teller)\tEintopf Terrine\t2045\tPikanter Linseneintopf mit Knoblauch und Tomate (2,17,21,i)\tWeizenbrötchen (1,21,a,f)\t\t\t\t\tSpicy lentil stew with garlic and tomato (2,17,21,i)\tBread roll (1,21,a,f)\t\t\t\t\t1,80\t3,40\t4,20\tg\t\t\t1, 2, 17, 21, a, i, f, 0\tmit Farbstoff, mit Konservierungsstoff, Knoblauch, vegan, Glutenhaltiges Getreide (a), Sellerie (i), Soja (f), zusatzstoff- und allergenfrei\t-\tBrennwert=2016 kJ (482 kcal), Fett=2,1g, davon gesättigte Fettsäuren=0,5g, Kohlenhydrate=88,4g, davon Zucker=11,1g, Ballaststoffe=9,7g, Eiweiß=19,9g, Salz=7,1g,\nMensa Westerberg\t03.02.2022\t1701\t3648\tStärkebeilage 3\tBeilagen\t525\tPommes frites klein (21)\t\t\t\t\t\tPommes frites small (21)\t\t\t\t\t\t0,55\t1,05\t1,25\tc\t\t\t21, 0\tvegan, zusatzstoff- und allergenfrei\t-\t-\nMensa Westerberg\t03.02.2022\t2130\t4389\tKM 2 Fleisch/Fisc,+1,55 €\tHauptgericht\t651\tPaniertes Putenschnitzel (a,40)\tSchaschliksauce (17,40)\tHerzoginkartoffeln (2,20,a,c,g)\tGrüne Schnittbohnen (21)\t\t\tBreaded turkey escalope (a,40)\tShashlik sauce (17,40)\tDuchess potatoes (2,20,a,c,g)\tGreen beans (21)\t\t\t2,90\t4,45\t5,25\tc\t\t\t2, R, 17, 20, 21, a, c, g, 40, 0\tmit Konservierungsstoff, Artikel aus der Region, Knoblauch, vegetarisch, vegan, Glutenhaltiges Getreide (a), Hühnerei (c), Milch und Laktose (g), Geflügel, zusatzstoff- und allergenfrei\t-\tBrennwert=3758 kJ (898 kcal), Fett=49,1g, davon gesättigte Fettsäuren=5,2g, Kohlenhydrate=74,4g, davon Zucker=16,8g, Ballaststoffe=5,8g, Eiweiß=36,6g, Salz=7,4g,\nMensa Westerberg\t03.02.2022\t2130\t4389\tKM 2 Fleisch/Fisc,+1,55 €\tHauptgericht\t11\tPaniertes Putenschnitzel (a,40)\tSchaschliksauce (17,40)\tHerzoginkartoffeln (2,20,a,c,g)\tGrüne Schnittbohnen (21)\t\t\tBreaded turkey escalope (a,40)\tShashlik sauce (17,40)\tDuchess potatoes (2,20,a,c,g)\tGreen beans (21)\t\t\t2,90\t4,45\t5,25\tc\t\t\t2, R, 17, 20, 21, a, c, g, 40, 0\tmit Konservierungsstoff, Artikel aus der Region, Knoblauch, vegetarisch, vegan, Glutenhaltiges Getreide (a), Hühnerei (c), Milch und Laktose (g), Geflügel, zusatzstoff- und allergenfrei\t-\tBrennwert=3758 kJ (898 kcal), Fett=49,1g, davon gesättigte Fettsäuren=5,2g, Kohlenhydrate=74,4g, davon Zucker=16,8g, Ballaststoffe=5,8g, Eiweiß=36,6g, Salz=7,4g,\nMensa Westerberg\t03.02.2022\t2130\t4389\tKM 2 Fleisch/Fisc,+1,55 €\tHauptgericht\t2762\tPaniertes Putenschnitzel (a,40)\tSchaschliksauce (17,40)\tHerzoginkartoffeln (2,20,a,c,g)\tGrüne Schnittbohnen (21)\t\t\tBreaded turkey escalope (a,40)\tShashlik sauce (17,40)\tDuchess potatoes (2,20,a,c,g)\tGreen beans (21)\t\t\t2,90\t4,45\t5,25\tc\t\t\t2, R, 17, 20, 21, a, c, g, 40, 0\tmit Konservierungsstoff, Artikel aus der Region, Knoblauch, vegetarisch, vegan, Glutenhaltiges Getreide (a), Hühnerei (c), Milch und Laktose (g), Geflügel, zusatzstoff- und allergenfrei\t-\tBrennwert=3758 kJ (898 kcal), Fett=49,1g, davon gesättigte Fettsäuren=5,2g, Kohlenhydrate=74,4g, davon Zucker=16,8g, Ballaststoffe=5,8g, Eiweiß=36,6g, Salz=7,4g,\nMensa Haste\t04.02.2022\t2130\t4389\tKM 2 Fleisch/Fisc,+1,55 €\tHauptgericht\t390\tHokifilet Müllerin Art (24,d,a,g,j,43)\tSauce nach Tartarenart (1,2,9,20,c,g,j)\tBio-Bratkartoffeln (19,21)\tBio-Brokkoli (19,21)\t\t\tHoki fillet meunière (24,d,a,g,j,43)\tTartar sauce (1,2,9,20,c,g,j)\tOrganic fried potatoes (19,21)\tOrganic broccoli (19,21)\t\t\t3,15\t4,70\t5,50\tc\t\t\t1, 2, 9, 19, 20, 21, 24, d, a, c, g, j, 43, 0\tmit Farbstoff, mit Konservierungsstoff, mit Süßungsmitteln, Bio-Erzeugnis DE-ÖKO-039, vegetarisch, vegan, Fisch aus nachhaltiger Fischerei, Fisch (d), Glutenhaltiges Getreide (a), Hühnerei (c), Milch und Laktose (g), Senf (j), Fisch, zusatzstoff- und allergenfrei\t-\t-\nMensa Haste\t04.02.2022\t2130\t6510\tKM 3 veget./vegan,+1,35 €\tHauptgericht\t2337\tOfenkartoffel mit Kräuterdip und Currygemüse (20,g)\t\t\t\t\t\tBaked potato with herb dip and curry vegetables (20,g)\t\t\t\t\t\t1,80\t3,15\t3,95\ta\t\t\t20, g, 0\tvegetarisch, Milch und Laktose (g), zusatzstoff- und allergenfrei\t-\t-\nMensa Haste\t04.02.2022\t2130\t4389\tKM 2 Fleisch/Fisc,+1,55 €\tHauptgericht\t540\tHokifilet Müllerin Art (24,d,a,g,j,43)\tSauce nach Tartarenart (1,2,9,20,c,g,j)\tBio-Bratkartoffeln (19,21)\tBio-Brokkoli (19,21)\t\t\tHoki fillet meunière (24,d,a,g,j,43)\tTartar sauce (1,2,9,20,c,g,j)\tOrganic fried potatoes (19,21)\tOrganic broccoli (19,21)\t\t\t3,15\t4,70\t5,50\tc\t\t\t1, 2, 9, 19, 20, 21, 24, d, a, c, g, j, 43, 0\tmit Farbstoff, mit Konservierungsstoff, mit Süßungsmitteln, Bio-Erzeugnis DE-ÖKO-039, vegetarisch, vegan, Fisch aus nachhaltiger Fischerei, Fisch (d), Glutenhaltiges Getreide (a), Hühnerei (c), Milch und Laktose (g), Senf (j), Fisch, zusatzstoff- und allergenfrei\t-\t-\nMensa Haste\t04.02.2022\t2130\t4389\tKM 2 Fleisch/Fisc,+1,55 €\tHauptgericht\t2949\tHokifilet Müllerin Art (24,d,a,g,j,43)\tSauce nach Tartarenart (1,2,9,20,c,g,j)\tBio-Bratkartoffeln (19,21)\tBio-Brokkoli (19,21)\t\t\tHoki fillet meunière (24,d,a,g,j,43)\tTartar sauce (1,2,9,20,c,g,j)\tOrganic fried potatoes (19,21)\tOrganic broccoli (19,21)\t\t\t3,15\t4,70\t5,50\tc\t\t\t1, 2, 9, 19, 20, 21, 24, d, a, c, g, j, 43, 0\tmit Farbstoff, mit Konservierungsstoff, mit Süßungsmitteln, Bio-Erzeugnis DE-ÖKO-039, vegetarisch, vegan, Fisch aus nachhaltiger Fischerei, Fisch (d), Glutenhaltiges Getreide (a), Hühnerei (c), Milch und Laktose (g), Senf (j), Fisch, zusatzstoff- und allergenfrei\t-\t-\nMensa Haste\t04.02.2022\t1701\t3648\tStärkebeilage 3\tBeilagen\t525\tPommes frites klein (21)\t\t\t\t\t\tPommes frites small (21)\t\t\t\t\t\t0,55\t1,05\t1,25\tc\t\t\t21, 0\tvegan, zusatzstoff- und allergenfrei\t-\t-\nMensa Haste\t04.02.2022\t2130\t4388\tKM 1 veget./vegan,+1,35 €\tHauptgericht\t2807\tBuchweizen-Chili mit Nachos und Guacamole (3,16,17,21)\t\t\t\t\t\tBuckwheat chili with nachos and guacamole (3,16,17,21)\t\t\t\t\t\t2,20\t3,55\t4,35\tg\t\t\t3, 16, 17, 21, 0\tmit Antioxidationsmittel, KlimaTeller, Knoblauch, vegan, zusatzstoff- und allergenfrei\t-\t-\nMensa Haste\t04.02.2022\t2130\t4389\tKM 2 Fleisch/Fisc,+1,55 €\tHauptgericht\t1831\tHokifilet Müllerin Art (24,d,a,g,j,43)\tSauce nach Tartarenart (1,2,9,20,c,g,j)\tBio-Bratkartoffeln (19,21)\tBio-Brokkoli (19,21)\t\t\tHoki fillet meunière (24,d,a,g,j,43)\tTartar sauce (1,2,9,20,c,g,j)\tOrganic fried potatoes (19,21)\tOrganic broccoli (19,21)\t\t\t3,15\t4,70\t5,50\tc\t\t\t1, 2, 9, 19, 20, 21, 24, d, a, c, g, j, 43, 0\tmit Farbstoff, mit Konservierungsstoff, mit Süßungsmitteln, Bio-Erzeugnis DE-ÖKO-039, vegetarisch, vegan, Fisch aus nachhaltiger Fischerei, Fisch (d), Glutenhaltiges Getreide (a), Hühnerei (c), Milch und Laktose (g), Senf (j), Fisch, zusatzstoff- und allergenfrei\t-\t-\nMensa Haste\t04.02.2022\t2130\t10518\tKM 5 veget./vegan,+1,35 €\tHauptgericht\t3183\tPommes frites groß (21)\t\t\t\t\t\tPommes frites large (21)\t\t\t\t\t\t1,00\t2,35\t3,15\tc\t\t\t21, 0\tvegan, zusatzstoff- und allergenfrei\t-\t-\nMensa Lingen\t04.02.2022\t1701\t3648\tStärkebeilage 3\tBeilagen\t525\tPommes frites klein (21)\t\t\t\t\t\tPommes frites small (21)\t\t\t\t\t\t0,55\t1,05\t1,25\tc\t\t\t21, 0\tvegan, zusatzstoff- und allergenfrei\t-\t-\nMensa Lingen\t04.02.2022\t2130\t10518\tKM 5 veget./vegan,+1,35 €\tHauptgericht\t3183\tPommes frites groß (21)\t\t\t\t\t\tPommes frites large (21)\t\t\t\t\t\t1,00\t2,35\t3,15\tc\t\t\t21, 0\tvegan, zusatzstoff- und allergenfrei\t-\t-\nMensa Lingen\t04.02.2022\t2130\t4388\tKM 1 veget./vegan,+1,35 €\tHauptgericht\t2807\tBuchweizen-Chili mit Nachos und Guacamole (3,16,17,21)\t\t\t\t\t\tBuckwheat chili with nachos and guacamole (3,16,17,21)\t\t\t\t\t\t2,20\t3,55\t4,35\tg\t\t\t3, 16, 17, 21, 0\tmit Antioxidationsmittel, KlimaTeller, Knoblauch, vegan, zusatzstoff- und allergenfrei\t-\t-\nMensa Lingen\t04.02.2022\t2130\t4389\tKM 2 Fleisch/Fisc,+1,55 €\tHauptgericht\t1831\tHokifilet Müllerin Art (24,d,a,g,j,43)\tSauce nach Tartarenart (1,2,9,20,c,g,j)\tBio-Bratkartoffeln (19,21)\tBio-Brokkoli (19,21)\t\t\tHoki fillet meunière (24,d,a,g,j,43)\tTartar sauce (1,2,9,20,c,g,j)\tOrganic fried potatoes (19,21)\tOrganic broccoli (19,21)\t\t\t3,15\t4,70\t5,50\tc\t\t\t1, 2, 9, 19, 20, 21, 24, d, a, c, g, j, 43, 0\tmit Farbstoff, mit Konservierungsstoff, mit Süßungsmitteln, Bio-Erzeugnis DE-ÖKO-039, vegetarisch, vegan, Fisch aus nachhaltiger Fischerei, Fisch (d), Glutenhaltiges Getreide (a), Hühnerei (c), Milch und Laktose (g), Senf (j), Fisch, zusatzstoff- und allergenfrei\t-\t-\nMensa Lingen\t04.02.2022\t2130\t4389\tKM 2 Fleisch/Fisc,+1,55 €\tHauptgericht\t540\tHokifilet Müllerin Art (24,d,a,g,j,43)\tSauce nach Tartarenart (1,2,9,20,c,g,j)\tBio-Bratkartoffeln (19,21)\tBio-Brokkoli (19,21)\t\t\tHoki fillet meunière (24,d,a,g,j,43)\tTartar sauce (1,2,9,20,c,g,j)\tOrganic fried potatoes (19,21)\tOrganic broccoli (19,21)\t\t\t3,15\t4,70\t5,50\tc\t\t\t1, 2, 9, 19, 20, 21, 24, d, a, c, g, j, 43, 0\tmit Farbstoff, mit Konservierungsstoff, mit Süßungsmitteln, Bio-Erzeugnis DE-ÖKO-039, vegetarisch, vegan, Fisch aus nachhaltiger Fischerei, Fisch (d), Glutenhaltiges Getreide (a), Hühnerei (c), Milch und Laktose (g), Senf (j), Fisch, zusatzstoff- und allergenfrei\t-\t-\nMensa Lingen\t04.02.2022\t2130\t4389\tKM 2 Fleisch/Fisc,+1,55 €\tHauptgericht\t2949\tHokifilet Müllerin Art (24,d,a,g,j,43)\tSauce nach Tartarenart (1,2,9,20,c,g,j)\tBio-Bratkartoffeln (19,21)\tBio-Brokkoli (19,21)\t\t\tHoki fillet meunière (24,d,a,g,j,43)\tTartar sauce (1,2,9,20,c,g,j)\tOrganic fried potatoes (19,21)\tOrganic broccoli (19,21)\t\t\t3,15\t4,70\t5,50\tc\t\t\t1, 2, 9, 19, 20, 21, 24, d, a, c, g, j, 43, 0\tmit Farbstoff, mit Konservierungsstoff, mit Süßungsmitteln, Bio-Erzeugnis DE-ÖKO-039, vegetarisch, vegan, Fisch aus nachhaltiger Fischerei, Fisch (d), Glutenhaltiges Getreide (a), Hühnerei (c), Milch und Laktose (g), Senf (j), Fisch, zusatzstoff- und allergenfrei\t-\t-\nMensa Lingen\t04.02.2022\t2130\t4389\tKM 2 Fleisch/Fisc,+1,55 €\tHauptgericht\t390\tHokifilet Müllerin Art (24,d,a,g,j,43)\tSauce nach Tartarenart (1,2,9,20,c,g,j)\tBio-Bratkartoffeln (19,21)\tBio-Brokkoli (19,21)\t\t\tHoki fillet meunière (24,d,a,g,j,43)\tTartar sauce (1,2,9,20,c,g,j)\tOrganic fried potatoes (19,21)\tOrganic broccoli (19,21)\t\t\t3,15\t4,70\t5,50\tc\t\t\t1, 2, 9, 19, 20, 21, 24, d, a, c, g, j, 43, 0\tmit Farbstoff, mit Konservierungsstoff, mit Süßungsmitteln, Bio-Erzeugnis DE-ÖKO-039, vegetarisch, vegan, Fisch aus nachhaltiger Fischerei, Fisch (d), Glutenhaltiges Getreide (a), Hühnerei (c), Milch und Laktose (g), Senf (j), Fisch, zusatzstoff- und allergenfrei\t-\t-\nMensa Schlossgarten\t04.02.2022\t2130\t4388\tKM 1 veget./vegan,+1,35 €\tHauptgericht\t2807\tBuchweizen-Chili mit Nachos und Guacamole (3,16,17,21)\t\t\t\t\t\tBuckwheat chili with nachos and guacamole (3,16,17,21)\t\t\t\t\t\t2,20\t3,55\t4,35\tg\t\t\t3, 16, 17, 21, 0\tmit Antioxidationsmittel, KlimaTeller, Knoblauch, vegan, zusatzstoff- und allergenfrei\t-\tBrennwert=2707 kJ (647 kcal), Fett=22,6g, davon gesättigte Fettsäuren=5,4g, Kohlenhydrate=78,9g, davon Zucker=13,6g, Ballaststoffe=16,4g, Eiweiß=22,5g, Salz=1,2g,\nMensa Schlossgarten\t04.02.2022\t1701\t3648\tStärkebeilage 3\tBeilagen\t525\tPommes frites klein (21)\t\t\t\t\t\tPommes frites small (21)\t\t\t\t\t\t0,55\t1,05\t1,25\tc\t\t\t21, 0\tvegan, zusatzstoff- und allergenfrei\t-\t-\nMensa Schlossgarten\t04.02.2022\t1701\t3646\tGemüsebeilage 3/Tagessala\tTagessalat\t477\tMensa-Salatmix (3,21,k,j)\t\t\t\t\t\tMixed salad (3,21,k,j)\t\t\t\t\t\t0,50\t1,00\t1,20\tc\t\t\t3, 21, k, j, 0\tmit Antioxidationsmittel, vegan, Schwefeldioxid u. Sulfite (k), Senf (j), zusatzstoff- und allergenfrei\t-\tBrennwert=624 kJ (149 kcal), Fett=9,5g, davon gesättigte Fettsäuren=0,8g, Kohlenhydrate=8,9g, davon Zucker=6,7g, Ballaststoffe=4,8g, Eiweiß=2,7g, Salz=0,2g,\nMensa Schlossgarten\t04.02.2022\t2097\t3665\tDessert 1\tDessert\t251\tQuark (20,g)\tBrombeersauce\t\t\t\t\tQuark dessert (20,g)\tBlackberry sauce\t\t\t\t\t0,50\t1,00\t1,20\tc\t\t\t20, g, 0\tvegetarisch, Milch und Laktose (g), zusatzstoff- und allergenfrei\t-\tBrennwert=606 kJ (145 kcal), Fett=1,2g, davon gesättigte Fettsäuren=0,6g, Kohlenhydrate=19,1g, davon Zucker=18,4g, Ballaststoffe=0,5g, Eiweiß=12,9g, Salz=0,1g,\nMensa Schlossgarten\t04.02.2022\t2097\t3665\tDessert 1\tDessert\t461\tQuark (20,g)\tBrombeersauce\t\t\t\t\tQuark dessert (20,g)\tBlackberry sauce\t\t\t\t\t0,50\t1,00\t1,20\tc\t\t\t20, g, 0\tvegetarisch, Milch und Laktose (g), zusatzstoff- und allergenfrei\t-\tBrennwert=606 kJ (145 kcal), Fett=1,2g, davon gesättigte Fettsäuren=0,6g, Kohlenhydrate=19,1g, davon Zucker=18,4g, Ballaststoffe=0,5g, Eiweiß=12,9g, Salz=0,1g,\nMensa Schlossgarten\t04.02.2022\t2130\t10518\tKM 5 veget./vegan,+1,35 €\tHauptgericht\t3183\tPommes frites groß (21)\t\t\t\t\t\tPommes frites large (21)\t\t\t\t\t\t1,00\t2,35\t3,15\tc\t\t\t21, 0\tvegan, zusatzstoff- und allergenfrei\t-\t-\nMensa Schlossgarten\t04.02.2022\t2130\t6510\tKM 3 veget./vegan,+1,35 €\tHauptgericht\t2337\tOfenkartoffel mit Kräuterdip und Currygemüse (20,g)\t\t\t\t\t\tBaked potato with herb dip and curry vegetables (20,g)\t\t\t\t\t\t1,80\t3,15\t3,95\ta\t\t\t20, g, 0\tvegetarisch, Milch und Laktose (g), zusatzstoff- und allergenfrei\t-\tBrennwert=2363 kJ (564 kcal), Fett=25,3g, davon gesättigte Fettsäuren=9,9g, Kohlenhydrate=61,2g, davon Zucker=16,2g, Ballaststoffe=10,4g, Eiweiß=17,2g, Salz=1,3g,\nMensa Schlossgarten\t04.02.2022\t2130\t4389\tKM 2 Fleisch/Fisc,+1,55 €\tHauptgericht\t1831\tHokifilet Müllerin Art (24,d,a,g,j,43)\tSauce nach Tartarenart (1,2,9,20,c,g,j)\tBio-Bratkartoffeln (19,21)\tBio-Brokkoli (19,21)\t\t\tHoki fillet meunière (24,d,a,g,j,43)\tTartar sauce (1,2,9,20,c,g,j)\tOrganic fried potatoes (19,21)\tOrganic broccoli (19,21)\t\t\t3,15\t4,70\t5,50\tc\t\t\t1, 2, 9, 19, 20, 21, 24, d, a, c, g, j, 43, 0\tmit Farbstoff, mit Konservierungsstoff, mit Süßungsmitteln, Bio-Erzeugnis DE-ÖKO-039, vegetarisch, vegan, Fisch aus nachhaltiger Fischerei, Fisch (d), Glutenhaltiges Getreide (a), Hühnerei (c), Milch und Laktose (g), Senf (j), Fisch, zusatzstoff- und allergenfrei\t-\tBrennwert=4394 kJ (1049 kcal), Fett=71,3g, davon gesättigte Fettsäuren=7,5g, Kohlenhydrate=61,6g, davon Zucker=10,8g, Ballaststoffe=4,1g, Eiweiß=34,2g, Salz=6,6g,\nMensa Schlossgarten\t04.02.2022\t2130\t4389\tKM 2 Fleisch/Fisc,+1,55 €\tHauptgericht\t390\tHokifilet Müllerin Art (24,d,a,g,j,43)\tSauce nach Tartarenart (1,2,9,20,c,g,j)\tBio-Bratkartoffeln (19,21)\tBio-Brokkoli (19,21)\t\t\tHoki fillet meunière (24,d,a,g,j,43)\tTartar sauce (1,2,9,20,c,g,j)\tOrganic fried potatoes (19,21)\tOrganic broccoli (19,21)\t\t\t3,15\t4,70\t5,50\tc\t\t\t1, 2, 9, 19, 20, 21, 24, d, a, c, g, j, 43, 0\tmit Farbstoff, mit Konservierungsstoff, mit Süßungsmitteln, Bio-Erzeugnis DE-ÖKO-039, vegetarisch, vegan, Fisch aus nachhaltiger Fischerei, Fisch (d), Glutenhaltiges Getreide (a), Hühnerei (c), Milch und Laktose (g), Senf (j), Fisch, zusatzstoff- und allergenfrei\t-\tBrennwert=4394 kJ (1049 kcal), Fett=71,3g, davon gesättigte Fettsäuren=7,5g, Kohlenhydrate=61,6g, davon Zucker=10,8g, Ballaststoffe=4,1g, Eiweiß=34,2g, Salz=6,6g,\nMensa Schlossgarten\t04.02.2022\t2130\t4389\tKM 2 Fleisch/Fisc,+1,55 €\tHauptgericht\t2949\tHokifilet Müllerin Art (24,d,a,g,j,43)\tSauce nach Tartarenart (1,2,9,20,c,g,j)\tBio-Bratkartoffeln (19,21)\tBio-Brokkoli (19,21)\t\t\tHoki fillet meunière (24,d,a,g,j,43)\tTartar sauce (1,2,9,20,c,g,j)\tOrganic fried potatoes (19,21)\tOrganic broccoli (19,21)\t\t\t3,15\t4,70\t5,50\tc\t\t\t1, 2, 9, 19, 20, 21, 24, d, a, c, g, j, 43, 0\tmit Farbstoff, mit Konservierungsstoff, mit Süßungsmitteln, Bio-Erzeugnis DE-ÖKO-039, vegetarisch, vegan, Fisch aus nachhaltiger Fischerei, Fisch (d), Glutenhaltiges Getreide (a), Hühnerei (c), Milch und Laktose (g), Senf (j), Fisch, zusatzstoff- und allergenfrei\t-\tBrennwert=4394 kJ (1049 kcal), Fett=71,3g, davon gesättigte Fettsäuren=7,5g, Kohlenhydrate=61,6g, davon Zucker=10,8g, Ballaststoffe=4,1g, Eiweiß=34,2g, Salz=6,6g,\nMensa Schlossgarten\t04.02.2022\t2130\t4389\tKM 2 Fleisch/Fisc,+1,55 €\tHauptgericht\t540\tHokifilet Müllerin Art (24,d,a,g,j,43)\tSauce nach Tartarenart (1,2,9,20,c,g,j)\tBio-Bratkartoffeln (19,21)\tBio-Brokkoli (19,21)\t\t\tHoki fillet meunière (24,d,a,g,j,43)\tTartar sauce (1,2,9,20,c,g,j)\tOrganic fried potatoes (19,21)\tOrganic broccoli (19,21)\t\t\t3,15\t4,70\t5,50\tc\t\t\t1, 2, 9, 19, 20, 21, 24, d, a, c, g, j, 43, 0\tmit Farbstoff, mit Konservierungsstoff, mit Süßungsmitteln, Bio-Erzeugnis DE-ÖKO-039, vegetarisch, vegan, Fisch aus nachhaltiger Fischerei, Fisch (d), Glutenhaltiges Getreide (a), Hühnerei (c), Milch und Laktose (g), Senf (j), Fisch, zusatzstoff- und allergenfrei\t-\tBrennwert=4394 kJ (1049 kcal), Fett=71,3g, davon gesättigte Fettsäuren=7,5g, Kohlenhydrate=61,6g, davon Zucker=10,8g, Ballaststoffe=4,1g, Eiweiß=34,2g, Salz=6,6g,\nMensa Vechta\t04.02.2022\t2130\t10518\tKM 5 veget./vegan,+1,35 €\tHauptgericht\t3183\tPommes frites groß (21)\t\t\t\t\t\tPommes frites large (21)\t\t\t\t\t\t1,00\t2,35\t3,15\tc\t\t\t21, 0\tvegan, zusatzstoff- und allergenfrei\t-\t-\nMensa Vechta\t04.02.2022\t2130\t4389\tKM 2 Fleisch/Fisc,+1,55 €\tHauptgericht\t540\tHokifilet Müllerin Art (24,d,a,g,j,43)\tSauce nach Tartarenart (1,2,9,20,c,g,j)\tBio-Bratkartoffeln (19,21)\tBio-Brokkoli (19,21)\t\t\tHoki fillet meunière (24,d,a,g,j,43)\tTartar sauce (1,2,9,20,c,g,j)\tOrganic fried potatoes (19,21)\tOrganic broccoli (19,21)\t\t\t3,15\t4,70\t5,50\tc\t\t\t1, 2, 9, 19, 20, 21, 24, d, a, c, g, j, 43, 0\tmit Farbstoff, mit Konservierungsstoff, mit Süßungsmitteln, Bio-Erzeugnis DE-ÖKO-039, vegetarisch, vegan, Fisch aus nachhaltiger Fischerei, Fisch (d), Glutenhaltiges Getreide (a), Hühnerei (c), Milch und Laktose (g), Senf (j), Fisch, zusatzstoff- und allergenfrei\t-\tBrennwert=4396 kJ (1050 kcal), Fett=71,3g, davon gesättigte Fettsäuren=7,5g, Kohlenhydrate=61,7g, davon Zucker=10,8g, Ballaststoffe=4,2g, Eiweiß=34,2g, Salz=6,7g,\nMensa Vechta\t04.02.2022\t2130\t4389\tKM 2 Fleisch/Fisc,+1,55 €\tHauptgericht\t2949\tHokifilet Müllerin Art (24,d,a,g,j,43)\tSauce nach Tartarenart (1,2,9,20,c,g,j)\tBio-Bratkartoffeln (19,21)\tBio-Brokkoli (19,21)\t\t\tHoki fillet meunière (24,d,a,g,j,43)\tTartar sauce (1,2,9,20,c,g,j)\tOrganic fried potatoes (19,21)\tOrganic broccoli (19,21)\t\t\t3,15\t4,70\t5,50\tc\t\t\t1, 2, 9, 19, 20, 21, 24, d, a, c, g, j, 43, 0\tmit Farbstoff, mit Konservierungsstoff, mit Süßungsmitteln, Bio-Erzeugnis DE-ÖKO-039, vegetarisch, vegan, Fisch aus nachhaltiger Fischerei, Fisch (d), Glutenhaltiges Getreide (a), Hühnerei (c), Milch und Laktose (g), Senf (j), Fisch, zusatzstoff- und allergenfrei\t-\tBrennwert=4396 kJ (1050 kcal), Fett=71,3g, davon gesättigte Fettsäuren=7,5g, Kohlenhydrate=61,7g, davon Zucker=10,8g, Ballaststoffe=4,2g, Eiweiß=34,2g, Salz=6,7g,\nMensa Vechta\t04.02.2022\t2130\t4389\tKM 2 Fleisch/Fisc,+1,55 €\tHauptgericht\t390\tHokifilet Müllerin Art (24,d,a,g,j,43)\tSauce nach Tartarenart (1,2,9,20,c,g,j)\tBio-Bratkartoffeln (19,21)\tBio-Brokkoli (19,21)\t\t\tHoki fillet meunière (24,d,a,g,j,43)\tTartar sauce (1,2,9,20,c,g,j)\tOrganic fried potatoes (19,21)\tOrganic broccoli (19,21)\t\t\t3,15\t4,70\t5,50\tc\t\t\t1, 2, 9, 19, 20, 21, 24, d, a, c, g, j, 43, 0\tmit Farbstoff, mit Konservierungsstoff, mit Süßungsmitteln, Bio-Erzeugnis DE-ÖKO-039, vegetarisch, vegan, Fisch aus nachhaltiger Fischerei, Fisch (d), Glutenhaltiges Getreide (a), Hühnerei (c), Milch und Laktose (g), Senf (j), Fisch, zusatzstoff- und allergenfrei\t-\tBrennwert=4396 kJ (1050 kcal), Fett=71,3g, davon gesättigte Fettsäuren=7,5g, Kohlenhydrate=61,7g, davon Zucker=10,8g, Ballaststoffe=4,2g, Eiweiß=34,2g, Salz=6,7g,\nMensa Vechta\t04.02.2022\t2130\t4389\tKM 2 Fleisch/Fisc,+1,55 €\tHauptgericht\t1831\tHokifilet Müllerin Art (24,d,a,g,j,43)\tSauce nach Tartarenart (1,2,9,20,c,g,j)\tBio-Bratkartoffeln (19,21)\tBio-Brokkoli (19,21)\t\t\tHoki fillet meunière (24,d,a,g,j,43)\tTartar sauce (1,2,9,20,c,g,j)\tOrganic fried potatoes (19,21)\tOrganic broccoli (19,21)\t\t\t3,15\t4,70\t5,50\tc\t\t\t1, 2, 9, 19, 20, 21, 24, d, a, c, g, j, 43, 0\tmit Farbstoff, mit Konservierungsstoff, mit Süßungsmitteln, Bio-Erzeugnis DE-ÖKO-039, vegetarisch, vegan, Fisch aus nachhaltiger Fischerei, Fisch (d), Glutenhaltiges Getreide (a), Hühnerei (c), Milch und Laktose (g), Senf (j), Fisch, zusatzstoff- und allergenfrei\t-\tBrennwert=4396 kJ (1050 kcal), Fett=71,3g, davon gesättigte Fettsäuren=7,5g, Kohlenhydrate=61,7g, davon Zucker=10,8g, Ballaststoffe=4,2g, Eiweiß=34,2g, Salz=6,7g,\nMensa Vechta\t04.02.2022\t1701\t3648\tStärkebeilage 3\tBeilagen\t525\tPommes frites klein (21)\t\t\t\t\t\tPommes frites small (21)\t\t\t\t\t\t0,55\t1,05\t1,25\tc\t\t\t21, 0\tvegan, zusatzstoff- und allergenfrei\t-\t-\nMensa Vechta\t04.02.2022\t2130\t4388\tKM 1 veget./vegan,+1,35 €\tHauptgericht\t2807\tBuchweizen-Chili mit Nachos und Guacamole (3,16,17,21)\t\t\t\t\t\tBuckwheat chili with nachos and guacamole (3,16,17,21)\t\t\t\t\t\t2,20\t3,55\t4,35\tg\t\t\t3, 16, 17, 21, 0\tmit Antioxidationsmittel, KlimaTeller, Knoblauch, vegan, zusatzstoff- und allergenfrei\t-\tBrennwert=2705 kJ (646 kcal), Fett=22,6g, davon gesättigte Fettsäuren=5,4g, Kohlenhydrate=78,8g, davon Zucker=13,6g, Ballaststoffe=16,4g, Eiweiß=22,4g, Salz=1,3g,\nMensa Westerberg\t04.02.2022\t2130\t4389\tKM 2 Fleisch/Fisc,+1,55 €\tHauptgericht\t2949\tHokifilet Müllerin Art (24,d,a,g,j,43)\tSauce nach Tartarenart (1,2,9,20,c,g,j)\tBio-Bratkartoffeln (19,21)\tBio-Brokkoli (19,21)\t\t\tHoki fillet meunière (24,d,a,g,j,43)\tTartar sauce (1,2,9,20,c,g,j)\tOrganic fried potatoes (19,21)\tOrganic broccoli (19,21)\t\t\t3,15\t4,70\t5,50\tc\t\t\t1, 2, 9, 19, 20, 21, 24, d, a, c, g, j, 43, 0\tmit Farbstoff, mit Konservierungsstoff, mit Süßungsmitteln, Bio-Erzeugnis DE-ÖKO-039, vegetarisch, vegan, Fisch aus nachhaltiger Fischerei, Fisch (d), Glutenhaltiges Getreide (a), Hühnerei (c), Milch und Laktose (g), Senf (j), Fisch, zusatzstoff- und allergenfrei\t-\tBrennwert=4394 kJ (1049 kcal), Fett=71,3g, davon gesättigte Fettsäuren=7,5g, Kohlenhydrate=61,6g, davon Zucker=10,8g, Ballaststoffe=4,1g, Eiweiß=34,2g, Salz=6,6g,\nMensa Westerberg\t04.02.2022\t2130\t4389\tKM 2 Fleisch/Fisc,+1,55 €\tHauptgericht\t390\tHokifilet Müllerin Art (24,d,a,g,j,43)\tSauce nach Tartarenart (1,2,9,20,c,g,j)\tBio-Bratkartoffeln (19,21)\tBio-Brokkoli (19,21)\t\t\tHoki fillet meunière (24,d,a,g,j,43)\tTartar sauce (1,2,9,20,c,g,j)\tOrganic fried potatoes (19,21)\tOrganic broccoli (19,21)\t\t\t3,15\t4,70\t5,50\tc\t\t\t1, 2, 9, 19, 20, 21, 24, d, a, c, g, j, 43, 0\tmit Farbstoff, mit Konservierungsstoff, mit Süßungsmitteln, Bio-Erzeugnis DE-ÖKO-039, vegetarisch, vegan, Fisch aus nachhaltiger Fischerei, Fisch (d), Glutenhaltiges Getreide (a), Hühnerei (c), Milch und Laktose (g), Senf (j), Fisch, zusatzstoff- und allergenfrei\t-\tBrennwert=4394 kJ (1049 kcal), Fett=71,3g, davon gesättigte Fettsäuren=7,5g, Kohlenhydrate=61,6g, davon Zucker=10,8g, Ballaststoffe=4,1g, Eiweiß=34,2g, Salz=6,6g,\nMensa Westerberg\t04.02.2022\t2130\t4389\tKM 2 Fleisch/Fisc,+1,55 €\tHauptgericht\t1831\tHokifilet Müllerin Art (24,d,a,g,j,43)\tSauce nach Tartarenart (1,2,9,20,c,g,j)\tBio-Bratkartoffeln (19,21)\tBio-Brokkoli (19,21)\t\t\tHoki fillet meunière (24,d,a,g,j,43)\tTartar sauce (1,2,9,20,c,g,j)\tOrganic fried potatoes (19,21)\tOrganic broccoli (19,21)\t\t\t3,15\t4,70\t5,50\tc\t\t\t1, 2, 9, 19, 20, 21, 24, d, a, c, g, j, 43, 0\tmit Farbstoff, mit Konservierungsstoff, mit Süßungsmitteln, Bio-Erzeugnis DE-ÖKO-039, vegetarisch, vegan, Fisch aus nachhaltiger Fischerei, Fisch (d), Glutenhaltiges Getreide (a), Hühnerei (c), Milch und Laktose (g), Senf (j), Fisch, zusatzstoff- und allergenfrei\t-\tBrennwert=4394 kJ (1049 kcal), Fett=71,3g, davon gesättigte Fettsäuren=7,5g, Kohlenhydrate=61,6g, davon Zucker=10,8g, Ballaststoffe=4,1g, Eiweiß=34,2g, Salz=6,6g,\nMensa Westerberg\t04.02.2022\t2130\t10518\tKM 5 veget./vegan,+1,35 €\tHauptgericht\t3183\tPommes frites groß (21)\t\t\t\t\t\tPommes frites large (21)\t\t\t\t\t\t1,00\t2,35\t3,15\tc\t\t\t21, 0\tvegan, zusatzstoff- und allergenfrei\t-\t-\nMensa Westerberg\t04.02.2022\t2130\t4389\tKM 2 Fleisch/Fisc,+1,55 €\tHauptgericht\t540\tHokifilet Müllerin Art (24,d,a,g,j,43)\tSauce nach Tartarenart (1,2,9,20,c,g,j)\tBio-Bratkartoffeln (19,21)\tBio-Brokkoli (19,21)\t\t\tHoki fillet meunière (24,d,a,g,j,43)\tTartar sauce (1,2,9,20,c,g,j)\tOrganic fried potatoes (19,21)\tOrganic broccoli (19,21)\t\t\t3,15\t4,70\t5,50\tc\t\t\t1, 2, 9, 19, 20, 21, 24, d, a, c, g, j, 43, 0\tmit Farbstoff, mit Konservierungsstoff, mit Süßungsmitteln, Bio-Erzeugnis DE-ÖKO-039, vegetarisch, vegan, Fisch aus nachhaltiger Fischerei, Fisch (d), Glutenhaltiges Getreide (a), Hühnerei (c), Milch und Laktose (g), Senf (j), Fisch, zusatzstoff- und allergenfrei\t-\tBrennwert=4394 kJ (1049 kcal), Fett=71,3g, davon gesättigte Fettsäuren=7,5g, Kohlenhydrate=61,6g, davon Zucker=10,8g, Ballaststoffe=4,1g, Eiweiß=34,2g, Salz=6,6g,\nMensa Westerberg\t04.02.2022\t2097\t3665\tDessert 1\tDessert\t251\tQuark (20,g)\tBrombeersauce\t\t\t\t\tQuark dessert (20,g)\tBlackberry sauce\t\t\t\t\t0,50\t1,00\t1,20\tc\t\t\t20, g, 0\tvegetarisch, Milch und Laktose (g), zusatzstoff- und allergenfrei\t-\tBrennwert=607 kJ (145 kcal), Fett=1,2g, davon gesättigte Fettsäuren=0,6g, Kohlenhydrate=19,1g, davon Zucker=18,4g, Ballaststoffe=0,5g, Eiweiß=12,9g, Salz=0,1g,\nMensa Westerberg\t04.02.2022\t2097\t3665\tDessert 1\tDessert\t461\tQuark (20,g)\tBrombeersauce\t\t\t\t\tQuark dessert (20,g)\tBlackberry sauce\t\t\t\t\t0,50\t1,00\t1,20\tc\t\t\t20, g, 0\tvegetarisch, Milch und Laktose (g), zusatzstoff- und allergenfrei\t-\tBrennwert=607 kJ (145 kcal), Fett=1,2g, davon gesättigte Fettsäuren=0,6g, Kohlenhydrate=19,1g, davon Zucker=18,4g, Ballaststoffe=0,5g, Eiweiß=12,9g, Salz=0,1g,\nMensa Westerberg\t04.02.2022\t1701\t3648\tStärkebeilage 3\tBeilagen\t525\tPommes frites klein (21)\t\t\t\t\t\tPommes frites small (21)\t\t\t\t\t\t0,55\t1,05\t1,25\tc\t\t\t21, 0\tvegan, zusatzstoff- und allergenfrei\t-\t-\nMensa Westerberg\t04.02.2022\t2130\t6510\tKM 3 veget./vegan,+1,35 €\tHauptgericht\t2337\tOfenkartoffel mit Kräuterdip und Currygemüse (20,g)\t\t\t\t\t\tBaked potato with herb dip and curry vegetables (20,g)\t\t\t\t\t\t1,80\t3,15\t3,95\ta\t\t\t20, g, 0\tvegetarisch, Milch und Laktose (g), zusatzstoff- und allergenfrei\t-\tBrennwert=2364 kJ (565 kcal), Fett=25,3g, davon gesättigte Fettsäuren=9,9g, Kohlenhydrate=61,2g, davon Zucker=16,2g, Ballaststoffe=10,4g, Eiweiß=17,2g, Salz=1,3g,\nMensa Westerberg\t04.02.2022\t2130\t4388\tKM 1 veget./vegan,+1,35 €\tHauptgericht\t2807\tBuchweizen-Chili mit Nachos und Guacamole (3,16,17,21)\t\t\t\t\t\tBuckwheat chili with nachos and guacamole (3,16,17,21)\t\t\t\t\t\t2,20\t3,55\t4,35\tg\t\t\t3, 16, 17, 21, 0\tmit Antioxidationsmittel, KlimaTeller, Knoblauch, vegan, zusatzstoff- und allergenfrei\t-\tBrennwert=2707 kJ (647 kcal), Fett=22,6g, davon gesättigte Fettsäuren=5,4g, Kohlenhydrate=78,9g, davon Zucker=13,6g, Ballaststoffe=16,4g, Eiweiß=22,5g, Salz=1,2g,\nMensa Westerberg\t04.02.2022\t1701\t3646\tGemüsebeilage 3/Tagessala\tTagessalat\t477\tMensa-Salatmix (3,21,k,j)\t\t\t\t\t\tMixed salad (3,21,k,j)\t\t\t\t\t\t0,50\t1,00\t1,20\tc\t\t\t3, 21, k, j, 0\tmit Antioxidationsmittel, vegan, Schwefeldioxid u. Sulfite (k), Senf (j), zusatzstoff- und allergenfrei\t-\tBrennwert=624 kJ (149 kcal), Fett=9,5g, davon gesättigte Fettsäuren=0,8g, Kohlenhydrate=8,9g, davon Zucker=6,7g, Ballaststoffe=4,8g, Eiweiß=2,7g, Salz=0,2g,\n"
}
